title,post,source
AITA for asking my blind boyfriend to pay for half of the monthly parking cost for my car?,"My (29F) boyfriend (30M) is legally blind and cannot drive. We are currently living in a city which is safe and walkable. A parking spot for my car is included in our rent. We both take the bus to work, so mostly I use my car for errands. I drive us to visit his friends and family that are not accessible by public transit.

Towards the end of our lease, he told me he wasn't happy living in our current city, and he wanted to move to  a nearby bigger city for the following reasons:

* He wants to be closer to work and the train, which he uses to get around and visit friends. In our current city, he has to take a 15-20 minute bus ride to get to the train but would prefer to live somewhere he can walk to it. He hates the bus. Also, if we moved to the downtown area of this bigger city we could both walk to work.
* He feels that our current city is boring. He said there is nothing to do, and the downtown area with a theater, bars and restaurants is too far away (1 mile). 
* He wants an apartment with amenities like a dishwasher, A/C, and an in-unit washer/dryer. It's not always easy to find units that have been renovated with all these amenities in our current city because the buildings are older. In the bigger city, there are a lot of newer buildings. 

I had the following reservations about moving to the bigger city:

* The area he wants to live in is not safe. I would not be able to take a walk in my own neighborhood. When we have friends over their cars will be at risk of break ins.
* The apartments are expensive. We will need to take on a roommate. I had hoped to be done with roommates and I will miss our privacy. Even with the roommate we will both be paying more in rent.
* You almost always pay extra for a parking spot. We are looking at a building where a spot is $175/month.

Despite my reservations, I agreed to move to the bigger city. He is the one living with a disability, and easy walking access to the train means independence to him. If I want to take a walk or visit my old city it's only a 15 minute drive away. I decided that it would be fair to ask my boyfriend to split the cost of the parking spot with me for the following reasons:

* We both benefit from me having a car.
* I'm making compromises on what I value in a living situation to make him more comfortable, spending more money to live somewhere I like less.
* I am only asking for help with parking because that cost is directly related to this move. I've never asked him to contribute to anything else car-related. 

I asked him if he would consider contributing to parking. He gave me a cold look and said no. Immediately, I felt so embarrassed and greedy for even asking. I apologized and didn't even try to defend why I thought it might be fair.

However, I can't shake the feeling that it wasn't such a crazy request. I was thinking about bringing it up again, so I'd like to know AITA for asking my legally blind boyfriend to pay for half of the parking spot for my car?",AmItheAsshole
AITA for calling out my sister in law for buying and returning books just to make Booktoks?,"My sister started posting “booktok” videos in October of last year. If you are not familiar, it is the part of tiktok where people post about books. People post reviews, lists of recommendations, book hauls, etc. She’s always been a big reader so I wanted to support her in this. Her videos are not super popular and she’s perpetually stuck in “200 view jail” as they call it. 

She decided that in order for her to get more views and engagement she would need to do the thing that gets people a lot of views and post “book hauls” which is just ‘here’s a bunch of books I bought.’ I do not get it, but whatever. 

Well what she actually decided to do was go buy a ton of books and then return them. And she kept doing it too. I was shocked when she told me and asked her why she’d do that. She said it was just so she could get the views. I asked why she didn’t just take videos in the store and she said there was no way to make it “aesthetic” in the store. I told her this was sketchy behavior, and when she said it was from our local bookstore and not the big box one, I said that makes it 10x worse.

She told me I was being a shitty, unsupportive sister and that she is trying her hardest to come up with ideas and break into booktok, that it’s hard because there are already people with 10k followers and she will never get there. I told her that she should spend more time researching and working on her content, maybe she can come up with ideas that aren’t so sketch.

She’s pissed off at me and made a video talking about her unsupportive family. It got 200 views so it didn’t exactly work out for her. Was it wrong of me to call her out for how she gets the books and returns them?",AmItheAsshole
AITA for not wanting to give Ex-Mother-in-law MY recipe,"My ex-husband (Jacob) and I lived with his Mom (Marry) and step-dad prior to us getting married and Jacob joining the military. I continued to live there while Jacob was in basic training. Marry and I did everything together at that point because her husband was away at this time too for deployment. 

I thought her and I had a great relationship but I found out that she had been writing Jacob and telling him things like not to sign power of attorney papers over to me, not to trust me... Jacob put her in her place eventually but I never really let my guard down with her after that.

And as you can imagine, this type of behavior from her was not an isolated incident. I managed to mirror her fakeness and we got along just fine for the 10 yrs my ex and I were married.

 Fast forward to last year when I had to take Jacob to court to have the custody agreement changed for the safety of our children. Jacob tried to keep Luke, our oldest, from being a part of the custody case because he was going to be 18 in less than 6 months and was going to be able to testify. Our other two children were under 10 and would not have as much of a voice because of their ages.

But the way my ex-in laws, the ENTIRE family has treated  Luke because he stood up for himself and his siblings makes my blood boil. Mary (Luke's grandmother) and Aunt telling him they couldn't or won't talk to him until court is over because they don't want to take sides. But they continued to visit and talk with his dad. They continue to make plans and never follow through with them even now and court ended in September 2023. Breaks my heart. 

The point of all this is, Mary (my ex mother-in-law and Luke's grandmother) text Luke a few days ago and wanted him to ask me for MY sweet potato casserole recipe. I was originally going to give it to her (people pleaser in me).

This is a dish of mine that is requested often when I'm invited to parties. I've had a few ways I'd like to respond to her request.... ""Goggle it"", it's not gonna be the same but it's as close as you'll ever get again... 

AITA for refusing to give my Ex Monster-in-law my recipe that I tweaked and made my own?",AmItheAsshole
AITA for calling my step mum strange and obsessive?,"My (F16) dad, Liam (M34) got married a couple years ago to a woman, Tilly (F40). She's not in the least similar to his ex girlfriends, all who were quite fun, lively and usually either modelled or worked in the arts. She works in a pre approved school and likes to act as if I was one of the students there.

Liam used to be eccentric before he met her, he's still usually energetic and funny when she's not around, but she does keep him on a tight leash. He's given up modelling and painting for a conventional job, he gets his haircut into the style that she likes, which is very short and she's practically remodelled him into her ideal partner. Based in how Liam was before he met her, I was raised pretty unconventionally too. We moved around a lot, I learned to be very social, I went to most parties he attended, I'd usually get to miss school to go on little coffee dates with him and whoever he was dating at the time in posh London cafes. I usually dressed however I wanted.

The girl he was with prior to Tilly, Cherry (F33), was his longest relationship. She is my mam as far as I'm concerned. We all lived in her apartment in a lively part of London, so we frequently went out. I was used to Cherry taking me out to get our hair done together, or clothes shopping or for brunch. She'd always buy me the most beautiful clothes. Cherry even managed to get me modelling gigs when I was a kid. Of course, when Liam married Tilly, all that went down the gutter, she out of nowhere started to control what I wore, even how I spoke. She tried her best to treat me as if I was a little kid, forcing me into all these twee, little girly activities and outfits and whatever.

I still speak to Cherry on a regular basis. I told Cherry that I was still interested in modelling and she managed to book me a gig! It was great, Cherry took me out for the day to get both hair and lash extensions put in, my nails gently manicured and get some new clothes, we spent the rest of the day just lolling about her apartment.

When I came home, Tilly was extremely upset that Cherry allowed me to alter my appearance, even though it wasn't altered that much. She started ranting about it and asking me to take my extensions out. I told her that I couldn't, that Cherry had managed to book me a modelling shoot and I can't just ruin all the work she paid for, which set Tilly off. Tilly said that it was a stupid vanity contest and that Cherry shouldn't be encouraging me to do things like that, or allowing me to alter my appearance without her consent. I yelled at Tilly that she was acting super obsessive and strange, that she shouldn't act as if she holds some kind of ownership over me - its a simple photoshoot and literally just the most unnoticeable extensions you could get.

She got upset and went crying to Liam about it, who said that I was acting like a dick when Tilly just didn't want me acting too grown up for my age. Cherry said that she was being melodramatic.",AmItheAsshole
AITA for refusing to let my best friend's girlfriend stay at our house?,"My (25M) best friend, let's call him John, has been dating his girlfriend, Sarah (24F), for about a year now. They've been having some issues lately, and Sarah has been staying at my place on and off for the past few weeks.

At first, I didn't mind. I'm close with John, and I want to support him in any way I can. But it's starting to take a toll on me. Sarah is constantly complaining about John, and she's always trying to get me to take her side. I'm also not comfortable with her being here all the time. I feel like I'm losing my own space and privacy.

I've tried talking to John about it, but he always gets defensive and says I'm overreacting. I've also tried talking to Sarah directly, but she just gets upset and says I'm not being a good friend.

Last night, Sarah came over again and asked if she could stay for a few more days. I finally snapped and told her no. I explained that I needed my own space and that I couldn't handle her constant complaining anymore.

Sarah was furious. She called me an asshole and said I was being selfish. John was also upset and said I was being unfair.

So, AITA?",AmItheAsshole
AITA for walking out on my lab partner?,"So, I (20f) am in a biology class at my local community college. We have a random lab partner for papers every few weeks, and this week I have Andy (37M).  Andy is severely dyslexic, so working with him can be hard but not impossible.  
  
So Andy is married, and I am in a committed relationship with my boyfriend. This is important I swear. His wife has come to classes a few times, so she has seen me.  
  
We were working on our papers at the library on campus, and had ourlatops and notes out getting our project done. He had a webcam session oen with his wife, and we were just talking, comparting notes and coming up with the major points of our assignment when his wife would call him. Okay, no big deal right? He goes outside, spends about ten minutes talking to her and then came back in. About twenty minutes later, same thing.   
  
Over. And over. And over.  
  
when he came back to the table again, I asked him if there was a problem. He said his wife was just worried about him being alone with me. He is in the library. With a webcame session open. He has TWO different location tracking apps on his phone. She knows where he is and who he is with.   
  
I finally turned off his webcam session, and asked him was she calling him over and over again because he was with a younger woman in the library. He said yes. I told him if he walked out of the library one more time I was going to leave and he was going to have to do his portion of the project on his own. That would sink his grade if I did that. Not five minutes later his phone went off again, and guess who it was? He picked it up on ring three and walked outside again. So i picked up my laptop and notes, and walked out the library door in front of him.   
  
I know this is really not his fault, but I can't get my part of the project done is we have to keep stopping every 15-20 minutes because his wife HAS to know where he is. And now he has to do his section by himself which is going to be very difficult for him. So, AITA for walking out after I told my lab partner to stop answering his phone? ",AmItheAsshole
WIBTA if i told a couple on holiday to parent their child?,"I'm (31m) on holiday with my fiancé (36f) and our daughter (2f) at a family friendly hotel, think kids pool and playground with lots of other families, and there is another couple with their daughter (5f) let's call her jess for the post.

Jess (obviously not her fault) is looking for attention that she's not getting from her parents. Both my fiance and I have politely told her that we are there to play with our daughter and make sure she's safe in the pool as she's only just learning to swim. We've had to do this because the Jess is incessantly talking to us to the point that we literally couldn't get a word in edgewise to encourage our own child. 

At least 3 other families with children have decided to get out of the pool because Jess is in their personal space and simply won't leave them alone as well as a few older couples obviously there just trying to relax. 

In the 3 days we have been here so far, we have not seen her parents spend any time in the pool with her and they seem obvious to the fact that she is getting in other people's way. I HAVE seen the dad in the pool in the deep end whilst Jess was harassing other people in the shallow end. 

Also we have heard her ask multiple times for the parents to join her in the pool only to be flatly refused even though the dad would happily swim on his own.

So yeah, WIBTA if I, politely as possible, told them that if they're going to come on holiday as a family then they should spend some time in the pool as a family? ",AmItheAsshole
AITA Girlfriend always buys festival tickets for me around her Birthday,"Been dating my girlfriend for about 7 years. Every year when she has her birthday it is a weekly event, meaning that she plans something like going to DisneyWorld, going to a music festival, etc. The past few years she will buy a ticket to an EDM festival or something similar and tell me to ask for 3-4 days off to celebrate her birthday. Usually this wouldnt be an issue except I am a bartender and work weekends and there are few if any people to cover my shift because 9 times out of 10 she will pick a weekend to celebrate her birthday. Example for this year her birthday is May 8, but she wants me to take of May 2,3,4,5 for SOLFEST in Vortex Springs, FL. The last few years she does this were she will buy a ticket to the festival and then tell me ""You need to take off days x,y,z for my birthday"". Then I usually tell her either A ""I cant go to said event because I wont have anybody to cover my shift"" B"" Im not interested in this festival and It will make me uncomfortable to be there"" or C ""I dont have anyone to cover my shift, and Im not interested"". Then she proceeds to get mad at me because she already bought the ticket in advance and now has to scramble to sell the ticket. AITA for not being able to take the days off or not wanting to go? Everytime around her birthday I feel like Im obligated to do these things and they just dont work. I dread her birthday time because this is what always happens. I tell her ahead of time that Im not interested or cant get anyone to cover my shifts but she buys the tickets anyway and then uses it as a point of contention saying ""You never want to do anything for my birthday"" or ""Your a selfish piece of shit"". She bartends too so when I said ""May 8 is your birthday not 2,3,4,5(the days of SOLFEST)"" she says ""Yeah but those are the days I took off for my birthday and I work all the other days"". ",AmItheAsshole
WIBTA for standing my ground on a group project?,"First ever post here, so hello everyone. I(18mtf) and my group mates(19y.o-20y.o) have a project for a class.

The project is that we choose a scene to modernize from an ancient Greek epic poem, shoot it, edit it, and then submit. For anonymity, I won't be giving the specific text.

This was given to us back in February and now we have to finish it within 3 weeks. I asked my teammates what scene they'd like to choose, but they'd always say ""we have time"" or something along those lines.

I, on the other hand, am a very strict person when it comes to homeworks. So I suggested that I write the script for us, then we talk about how we'd like to continue, they refused saying ""you don't need to do it now."" In March, I notified them again and it was the same excuse, but this time, I started drafting some ideas and talked about it with some other friends instead.

So this month, when I thought the submission date was closer to the end of May, our teacher re-informed us that it was in 3 weeks. I obviously panicked and let them know that we have to write a script. I stayed up late one night and wrote it for them to review (they still haven't).

The submission date is 10th of May and I am freaking out basically. I gave them a schedule of shoots and the equipment needed, they didn't say anything but ""sounds good.""

We were supposed to meet tomorrow for the first shoot, one of them canceled. I didn't say anything bad, but I did clafiry the situation many times saying that we need proper equipment, we need a place to shoot, and I need time editing it. I sent these messages in a group chat trying to explain myself, but they'd constantly say the same shit they were saying for months now. They are practically refusing to listen to me and I don't want to get a shitty grade for something I am losing my mind over. I want to say something but I already spammed the group chat and would feel like an asshole.

So, WIBTA for standing up?
And outside of the asshole thing, do y'all have any advice?",AmItheAsshole
AITA for running a hair salon out my house?,"I (29M) have been cutting and colouring my own hair since I was a preteen (11/12ish). I am not black but I have very thick curly hair and struggled to find people who would cut it properly so I started doing it myself. I started cutting hair for my friends in my teens, mostly my black and biracial friends who didn't trust anyone to cut and style it right bcs there are no black barbers local.

These days as a bit of a gig on the side I cut, style and colour friends hair. I do not charge that much at all, just for my time and it's a bit more if they want a dye bcs I charge for the cost of that as well. it used to be free just for mates and stuff but all my friends starting telling their friends about it and now I'm booked weeks in advance so I charge like £5/£10 a cut and maybe £16/£20 if I dye it as well so definitely not salon level prices. Mostly the people who get their hair cut by me are black or biracial or middle Eastern or have thick curly hair, which the shops near me are notoriously bad at cutting. 

A friend told me in passing she wanted to get her brother a nice haircut as a birthday treat bcs he's always wanted it dyed and no one has ever cut his hair right and I told her that I'd be happy to do the whole thing (cut and dye) for a tenner. mates rates. she got pissed off at me and said that if I was a real friend I'd do it for free. I said I wasn't pulling a number out of my arse and that I cut hair in my free time and literally have a waiting list and a ton of returning customers. She asked me if I was trained professionally and when I told her I wasn't she said that I'm lying to my customers (I make it very clear upfront that I'm not professionally trained and some ppl have decided not to let me cut their hair bcs of that which is fine! but the ppl who I do cut and dye the hair of know I'm not a professional). she also said it was illegal to cut ppls hair for money and that I'm taking work away from the trained hair dressers and barbers. she got really pissed off and hasn't spoken to me since. I feel like maybe it was an overreaction but she's normally very levelled headed and calm so I'm worried I did something wrong so. AITA? ",AmItheAsshole
AITA for arguing with my father and basically blaming all my problems on him,"I (M 17) just snapped with my dad (M 54) . For context, my mother (F 49) if finnish and my father is moraccan. We currently live in Finland, and my parents are distant at best from each other, even though they are still together and we all live under the same roof. My father is unemployed, and stays home all day, laying in bed and staring at his computer, and eating. He will get mad at the slightest thing, and will always threaten me when he does. Anyways, so today we agreed that I would move a box to the upstairs storage (we live in an apartment), while he goes to buy onions. While I was in the middle of looking for the storage key, he told me to go to the shop to get onions, and I simply said 'fine, I guess I'll do both', in admittedly a very teenager type of tone. He yelled at me for this, and I snapped, for the damn near first time actually yelling beck, about how he gets mad about the slightest thing, and makes messes that I always have to clean, and how he leeches of my mother. He went silent, and just left. Am I the asshole here?",AmItheAsshole
AITA for not wanting to attend my friend's 18th birthday party?,"My friend Sarah was throwing this big bash, but I just wasn't feeling it. See, me and my friends from primary and high school, we all got invites, but we had a gut feeling Sarah was just trying to show us off to her new crowd. And honestly, we weren't keen on her new friends.

Sarah's always been a bit of a social climber, you know? She'd do anything to keep up with the trends, even if it meant stretching the truth or borrowing money she couldn't pay back. But despite all that, we've been friends since 1st grade, and I always thought that meant something.

When Sarah asked if we were coming, I didn't want to lie, but I also didn't want to hurt her feelings. So, I tried to be honest, telling her I had other plans without mentioning the real reason. She seemed disappointed but didn't push it.

On the night of the party, my friends and I ended up having a quiet hangout instead, reminiscing about old times. And yeah, there was a tinge of guilt for not being there for Sarah, but at the same time, it felt like the right decision. Still, I can't help but wonder, AITA?",AmItheAsshole
AITA for hating my ex mates cuz they hang out with the guy who touched me ,"To put into context I'm 15 and a guy and I was mates with another guy my age, let's call him Ben. So every science lesson Ben would reach under the desk and rub his hand up and down my thigh getting closer to my crotch and whisper stuff in my ear, moan and talk about his d1ck size and whether he was hard or not. Obviously this made me Hella uncomfortable and it came to a point where I asked the teacher to move but couldn't bring myself as to explain why. He said no and I sat there and lasted through it for some more lessons. After that point I gave up trynna pretend I was okay and moved across the class and refused to go back to my original seat which annoyed my teacher at first but he soon was fine with it. I finally felt the need to tell someone as to what was happening as it was happening on my bus journey home when it was just me and Ben. I told my best mates and they said it was awful and gross of him but I noticed they never stopped talking to him even if it was just a little bit. It's not like I'm wanting him to be friendless or anything I just felt as people who said they were my best friends to not be so oblivious to the fact that I was scared of being around this guy. Idk tho 🤷",AmItheAsshole
