title,post,source
AITA for refusing to share food I had ordered for myself?,"This week I had a minor examination at hospital that required me to not eat for 24 hours prior to the test. My appointment was also delayed by 4 hours so by the time it was done and by the time I got home it was over 32-34 hours since I had eaten anything.

Because of this I was very hungry and tired so I decided to order some food. I asked my gf if she wanted anything but she said no. My gf said she'd rather cook than order out but I said I'd prefer a takeaway so we can just have separate meals.

She said she'd rather we both just cooked but I again refused and told her I'm ordering myself food. I ordered the food and she decided to not cook and just said she didn't want anything.

Once my food came I was sat eating and she came over and asked if she could have some. I asked if she was serious. I pointed out I asked her multiple times if she wanted anything and she's waited for me to sit and enjoy my food to try and take it.

I mentioned that I've ordered exactly what I was because of how hungry I am but she just said she was hungry too since she hadn't eaten. I mentioned that the only reason she hadn't eaten was because I didn't want to cook for her and that doesn't mean she can come and take my food instead.

I said if she wants something to eat she can either order herself something or cook it but I'm not sharing what I ordered.

She said I was being too selfish and that I have enough to share so I should be fine sharing with her. She said she's not asking for much and that I'm being unfair.

AITAH for refusing to share the food I ordered?",AmItheAsshole
AITA for not paying for the damage on my bosses new car?,"So I work for a fairly large company, not a huge corporation. We have roughly 30 locations in our state. I was driving one of our box trucks and my boss was behind me. I went to back into a parking spot and didn’t see that he had pulled into it first and backed right into his brand new car. 

The damages come out to like $1200 and he wants me to pay it out of pocket. I feel like he should file a claim with our companies insurance because I was on the clock and in a company vehicle, he disagrees.

AITA for refusing to pay the $1200 in damages?",AmItheAsshole
AITA for threatening to take my ‘best friend’ to court,"I (23 F) have been living with my roommate/best friend (21 F) for over a year. Things were good until she started dating a new guy. He was nice at the start, but then began staying over 3-4 days out of the week and bringing his dog (5 year old pitbull) with him for the duration of his stays. I’m a big animal lover and have a cat, but his dog was tough to live with. We have a small apartment and he is a big guy, and he can be very aggressive (the boyfriend said he has bit people before). He also was not potty trained and would pee EVERYWHERE. He did not clean up after him, and after about 2 months of him basically living here, the place began to reek of dog pee. I started gently throwing out solutions to help, which were always met with excuses of why it wouldn’t work. 
Well, out of the blue last week, she texts me and my other roommate (26 F) that she is moving out with her boyfriend and we needed to find a replacement for her on the lease. We asked to have a roommate meeting to clarify things and get some details hammered out which she reluctantly agreed to. We were kind in our approach so she wouldn’t feel attacked, and asked if she could get the carpets cleaned before leaving as it would be hard to sell the room to someone when the place smelled of dog pee. We also told her we hadn’t had any luck finding anyone on such short notice to move in in less than 2 weeks, but had someone who could move in June 1st. We told her she would be responsible still for Mays rent, because that’s how a contract works. She said no to all of this. 
This, however, was not my final straw. My final straw came this weekend, when she moved out the majority of her things and in the process, stole several of my possessions, including a set of vintage glass goblets I had inherited from my grandmother who basically raised me when she passed away, and broke some of my things. So, yesterday I sent her a text saying that I had tried to be kind and civil and I had let a lot of things slide in the past but now if she was going to be evil I would be too. I sent her screenshots of the lease where it said no guests could bring animals, as well as where it said guests couldn’t stay more than 5 nights within a quarter year without being on the lease. I told her if my things weren’t returned I would take her to court for all of this as well as her unpaid rent and my stolen items. 
She did not reply, instead her boyfriend snap chatted me that I needed to ‘grow up’ and that i wouldn’t be getting my stuff back, and then blocked me so I couldn’t reply. 
So, AITA? Because they certainly think I am! ",AmItheAsshole
WIBTA if I said no to taking care of my disabled stepdad after my mom screamed over a bathroom?,"Hi Reddit, I’m kind of conflicted here. Here’s some backstory. My (20F) dad (70m) had a stroke in November 2022 that left him unable to walk. I was living alone until April 2023 where I came home to help. My mom (48f) and I juggle the responsibilities of taking care of me. 

I was recently in the ER this week to get checked out and found out I have some respiratory virus. This week, I’ve been completely knocked out and sleeping a little more than I would like to. That’s pretty much what happened today, I accidentally fell asleep at around 7pm and woke up at around 9:30pm of her screaming that the bathroom isn’t done, that I’m lazy, and that she’s a slave in her own house. I didn’t mean to sleep for that long, I was just so tired and my body just let me sleep. My mom is still screaming. I don’t want to get in her way as she’s screaming so I just stay quiet. 

She comes into my room and screams “The bathroom, OP!” and slams my door. My mom does this a lot and I think I’m just tired. 

Here’s where I might be the asshole. 

I’m moving to a different town soon to pursue my BA. My mom wants to take more solo trips before she’s stuck with my dad until I finish university.
My mom is planning on taking a trip to the east coast for ten days at some point, leaving my dad in my own care. I don’t want to not take care of my dad but it feels unfair that she can scream at me all she wants but I still do this big thing that she wanted me to do? 

I know I probably should’ve cleaned the bathroom when I was more conscious but I don’t know. I don’t want to keep doing nice things for her if she’s just going to scream at me when I’m sick.",AmItheAsshole
AITA for asking neighbor to leave my packages alone,"I (32F) sometimes miss deliveries so truck drivers typically leave packages by the front doors (Two family house). My next door neighbor(landlord) would take my packages and put it inside his house. His reasoning was for safe keeping and not to entice package thieves which I understand but I prefer my packages just to be left by my door. Plus there is a ring camera at the door and it’s a safe neighborhood so theft really isn’t a huge concern.

First time I asked for my packages to be left by my door it seemed to upset him. He listened a few times then either started bringing my packages inside his house again or knocking on my door to hand them to me. Thing is I don’t want to be forced to interact each time I expect a package. I’m not trying to sound overly dramatic here but dealing with him is starting to ignite some negative emotions. I think he knows it too and enjoys it. Last straw was a day I was home he knocked on my door for each delivery which was a total of 4x. I am so annoyed by his knock and hearing his ring hit the glass that I sternly (slightly yelled) through my window for him to just leave the package at my door. AITA here? I don’t know why but it feels like a control thing camouflaged as a good deed.",AmItheAsshole
AITA for not giving the family I babysat my new phone number? ,"I (17F), babysat for my neighbors one time about 7 months ago. They have 4 kids, 3 girls and 1 boy, ranging in ages 3-12. The only reason that they asked me is because their first 2 options of babysitters, Sarah and Maria (fake names), weren’t available, meaning it was my first time watching them. I have babysat my younger cousins my whole life, but never another family’s. 

Recently, I had to get a new phone and number due to issues with my Apple ID. I know most people keep their numbers when they upgrade, but it wasn’t possible for me. I didn’t realize that this would be happening until I was in the store so I only had time to send my new number to a couple of close friends and family. I lost all my contacts and I won’t lie, my neighbors were not the first people I thought to pass my number to. 

I recently found out that these neighbors have been telling parents around town that I’m irresponsible/rude/an asshole for not responding to their messages, and no one should hire me as their babysitter. I’m not a babysitter. I don’t want anyone to hire me to watch their kids, I have an actual job that I put a lot of hours into and I was really just helping this one family out. However, it’s a small town and everyone knows everyone. I have a reputation to manage and so far I haven’t had a bad one. I see them in their yard almost every day and talk to their kids on the bus/in school, is it that hard to just talk to me like a normal human?!

My mom thinks I should walk over there to explain myself but honestly, I don’t want to babysit for them anyways. These kids were more than just energetic- they were constantly competing for my attention, wouldn’t go to bed, and jumped on me and wouldn’t stop touching me. I get it, that’s just how kids are, but let’s just say I’m not begging for them to take me back. But there was 4 of them, and I don’t mean to sound ungrateful, but the $20 an hour they paid me was not worth it.

So, AITA for not sending a flair message to my neighbors with my phone number?",AmItheAsshole
AITA for not seeing my ex boyfriend’s mom in hospital after a car accident?,"On mobile

I (29f) and ex (30m) have a complicated situation, we live with each other and share a child but are not together. 

Yesterday on my way back from work, my ex called me to let me know that his mom and aunt were in a severe accident and were taken to the hospital. He asked me to take him to go see her. I agreed but one thing he asked of me was to not act petty. 
His mom and myself have kinda gone no contact, I still see her but we don’t talk.

Background:
My relationship with his mom started off ok but there were several instances where she crossed the line when my child was born in 2020 during Covid. She said she hated me and I was a bitch. we did make up and started talking, but then a few things happened between my ex (was bf), caught him talking to another girl in 2022. I tried to forgive him but couldn’t, after the hell I was put through giving birth, caught him having an emotional affair. In 2023, I was depressed and stressed out after losing my job and starting a new low paying job. During this time my ex and I were fighting non stop, where I demanded to break up with him several times. He would decline the break up because we live together, so i was trapped with him.

At my new job I met a client who I started flirting with, we were texting back and forth, I met him about 5 times but nothing more. one late night he invited me over to a movie and I lied to my “bf” about going out. he read the text from him and called me out. That’s a whole other mess, but he told his mom and she began to act distant with me. In the past I told mom on how difficult her son is, how our relationship was not healthy and I wanted to leave with our child but she begged me to stay with him because he’s “misunderstood.” When she found out about my actions, she took his side and would just thumbs up my messages, talk bad about me so I cut her off.

Back to accident:
I drove my ex  to see his mom during traffic hours, in my head I couldn’t process what just had happened I was still taking it in. Hospitals give me bad anxiety because my mom (rip) was constantly in and out of them due to her epilepsy and my experience during labor/birth. I tried distracting myself by commenting about traffic. Once we were told only one visitor at a time, he goes in I stay outside with child. Ex calls to ask if I wanted to see mom, I’m shocked. I tell him I don’t, I don’t know what to say. We haven’t talked in months. He gets very offended, in the car he repeats himself on how disappointed he is of me, that he would do it for my dad. I told him I’d bring flowers and a card the next day for her but it lead into a full blow argument on how I’m still a piece of shit for not seeing her, I was rolling eyes and scoffing. I said I needed a day to think on what I wanted to say, it wasn’t enough for him. Said I’m an asshole, piece of shit, ugly all in front of our kid.  I wasn’t a saint either but I told him to fuck off, get out of my car and that he was an asshole. 

AITA?",AmItheAsshole
AITA for not watching my step kids every weekend?,"AITA that I don't want to watch my husbands 2 kids since both he and bio mom (BM) work Friday and Saturday nights? The BM is moving and she will no longer have her roommate there to watch them (really it's just their 9 year old daughter, they  have a 15 year old son but he doesn't need a babysitter) so she basically just TOLD my husband that the custody dates are changing to every Friday and Saturday instead of every Sunday and Monday. For more information- When this custody arrangement was made (after divorce), she had a normal 9-5 job and he has had this same schedule for years, even when they were married. 

My husband and I have an 11 month old but I tend to go to my parents house on Friday nights to hang out with them and they can see our baby. Husband is not thrilled at all with custody schedule but feels he would rather them be at our house, even if I won't be there all of the time, than alone at her house. Plus their 9 year old daughter doesn't really have a bed time on weekends/summer so it's not even like OK well I just have to do this until bedtime. There are times she will probably (and has in the past) stay up until he gets home. I have told my husband this is the hill I will die on and I have actually slept the last two nights at my parents house. The BM does not allow me to have a more ""bonus mom"" role, we get yelled at anytime I try to correct her (ask her to say thank you, etc). 

Sorry, I know this is all over the place but I just don't feel like it's my responsibility and the fact that he and I weren't even asked we were told is not OK. He just doesn't feel like dealing with standing up to her because she will scream and cuss etc. They have gone through mediation for child support which lists what the custody right now is (the Sunday and Monday nights.).",AmItheAsshole
AITA because I won’t give my brother daycare for $25/day?,"I (33f, recently divorced mom) operate an in-home daycare with my sister. For the last few weeks, we have been caring for our 10-mo nephew, our brother’s son, with the expectation that my brother will eventually start paying us, including back pay. We have cared for my nephew 14 days so far, about 4-7 hours per day. My brother wants me to charge only $25 per day, whereas we usually charge $60 per day. When I made a case that $30 per day is reasonable, he responded:

&gt;1- I am not a client, I am your brother and he is your nephew first off. When you and \[ex-husband\] were considering selling your home I was going to do 1% commission instead of 3% because you’re family, which roughly would have been about and $8,500 pay cut. \[This was never discussed.\]

&gt;2- I did pay hundreds for a daycare, and I have no problem doing it again. The difference is a daycare I know 100% I can always take my son there, with him going to y’all, we have to figure out a solution using leave hours anytime the house is down with sickness or y’all go on vacation.

&gt;3- I am compensating based on the amount of work you have to do for the 3-4 hours he is there, actually hourly it’s more than compensating. It is not my fault you chose a route where you don’t make a lot of money, but that damn sure doesn’t make it my responsibility to make up for it.

&gt;4- I think your mindset is a little twisted. You have the opportunity to see and build a relationship with your nephew and get paid for it separately where we don’t count toward your attendance. That is either $400-$450 a month for seeing your nephew or if you want to be petty it can easily be $0.

&gt;5- y’all are the ones that said over and over again you wanted to see \[nephew\] more often and wished he would go there. I am not by any means strapped for money where I can’t easily put him back in daycare full time… but y’all wanted to watch him and I knew it would bring some extra money your way at the same time so should be a win/win. Where you have it f--ked up is you think I need to take him there and you want to talk like he’s just another kid or I’m just another client. I’m not the one to be getting in a back and forth with. If you want the money every month to see your nephew then you need to check yourself, or I’ll keep him the rest of this week and he will start somewhere else next week, I’m not here to play “you’re hurting my feelings games”.

&gt;Let me know, but this isn’t a back and forth. I thought it was a good way for him to spend time with his family and to put some money in your pocket, if it’s a problem already, just say so and I’ll gladly make other arrangements.

After that, I responded that I thought his message was entitled and disrespectful, and I think it’s best we do not continue a business relationship. My brother says I’m “entitled,” my mindset is “twisted,” and I should “say less.” AITA?",AmItheAsshole
AITA for telling my in-laws that I found money the government owes them?,"I recently read an article about unclaimed funds held by the state (usually uncashed checks, forgotten investments, etc.) and decided to search my name on my state’s comptroller website. I found a couple of checks in my husband’s name and when he claimed them, our state mailed him a check for $400. We were so excited, we told a lot of people about this program. 

I didn’t find anything in my name, but under my surname, about a dozen or so checks came up in my father-in-law’s name, so I texted to let him and my mother-in-law know what happened with us and how easy it was to claim the money. EDIT: I did NOT go looking for my in-laws info. I typed in MY name and that’s what came up. 

FIL sent my husband (32M) a series of angry texts accusing us of violating his boundaries and stirring up trouble. Right before the pandemic, my husband got into a huge fight with his mother over boundary issues that led to us being estranged from MIL and FIL for two years. MIL and FIL were very controlling and tended to infantilize my husband, which significantly impacted his mental health and confidence in himself. We tried to reconcile and apologized, while asking for an apology and changed behavior. They were not interested and were ultimately uninvited from our wedding as a result. 

In late 2022, MIL and FIL seemed interested in respecting my husband as a grown adult, and we slowly started talking and getting together for dinner once every 1-2 months again. FIL seems to be respectful except when I trigger him. At one dinner I asked “how’s everything going with you?” and he told me I wasn’t allowed to ask him that. MIL recently offered us FIL’s recently deceased mother’s home, which we couldn’t accept for a few reasons (it’s a no dog building and we have two dogs, for starters). When we later asked if they had decided what to do with the apartment, FIL berated us for invading his privacy. (I wouldn’t have asked if they hadn’t brought us into it, but whatever.)

With the missing money, I guess I just thought of it as equivalent to saying “hey, you dropped your wallet.” FIL seems very resentful of the estrangement and doesn’t seem to understand why his boundaries feel less like actual boundaries and more like a revenge tactic. 

AITA?",AmItheAsshole
AITAH for asking parents to pay their kids?,My kid is having a birthday party at a zoo. We picked a package that will cover up to 10 kids. I usually don’t make people pay for their kids to come. However my friend wants to bring all her kids. We only factored in 3 of them (she said only 3 would be coming at first) she has 6. AITAH for asking her to pay for the other 3? ,AmItheAsshole
AITA for kicking my father out after he made “harmless” comments”? ,"My father is a typical guy for his age group. Never lifted a finger to do housework. I can’t remember him doing housework once in my childhood memory. My mom and him both worked and she would do all the housework and childcare. My brother and I were raised by my mom and my dad would hang out with us for 1-2h on weekends before disappearing to his man cave to watch TV. She complained to him a lot about it when I was a younger and he didn’t take it seriously until she filed for divorce the second we were off to college. To this day he claims she gave him no warning and divorced him out of nowhere. 

As an adult I made sure who I dated knows how to do housework and splits it with me. We have a todo board where we list chores and who will do them and time it will take. That way we don’t do the same things and no one does too much. My father came over to visit from another state as part of work and was suppose to stay off. He was looking at the board and asked what it was and when I told him said “you realize it’s not long to last right?” I was like what? And he said it’s just natural that women want to do all the housework and take care of people and if I keep pushing it my bf will leave me. I was like WTF and told him the reason mom left was because he thought that way. 

He got defensive and said “well I make the money so she does the housework”. I pointed out she worked as well and he said “well she chose to work, it’s her own fault”. I was really pissed at that point and told him to leave. He was supposed to to stay over but I said he needs to find a place to stay but he wasn’t coming back. He left and I’m pissed he was so disrespectful. He texted later “apologizing” I got offended by his comments but they were harmless and for my best interest. ",AmItheAsshole
AITA for not adding a guest on Facebook?,"In customer service I(27,f) get A LOT of weird  requests. I work in a gift shop, a guest, Justin (45??m) He comes in once a week and tries to make small talk with me. I’m always polite because I’m the manager and he’s a guest. He buys something every time and shows me photos he takes of animals at our local zoo. 

He’s always pleasant and nice but I cannot shake this feeling that there’s something wrong. A few visits ago Justin came in and was showing me his photos and asked my name. I told him my first name. We don’t wear name tags. My name is spelled differently than it’s said. My employees are all trained to give out first names only and not disclose anyone else’s schedules to guests for safety. We’re mainly women over here.

Once he asked me what city I live in, I told him the one I grew up in, not the one I’m currently residing in. He asked me how my vacation was, I was unsure how he knew I went on vacation. Strange things that didn’t sit well but were not alarming enough to say anything about.

The next time I saw him I was running from one location to the next. My heart sank as I heard him calling my name from a few stores down. I reluctantly turned around. He was very excited to see me and rubbed my upper arm in his greeting. In work mode I just stepped back and continued the conversation. 

He asked me where I was coming from and that he was just in my store, I told him I would talk to him next time. He pulled out a business card and asked me to add his photography business on Facebook and add his personal one. I said I would check it out and sprinted into my store then office.

A couple days passed, I forgot about Justin. I did not look him up or do anything with the card. Suddenly I have a friend request from him. My heart sank.

I’m very private online. The only things you can see are my name, current city, cover photo and profile photo. My name is spelled very differently than how it is spoken, my city is different than what I told him, my job is not listed anywhere, my cover photo is me kissing my girlfriend where you can’t see my face, my profile photo has me looking away in the dark, we don’t have mutual friends. 

I have no idea how he found me. 

It was alarming, I did not respond to the request. I saw him in my store, he asked a supervisor if I was there and she said I stepped out. This happened twice. 

The other day I looked in my spam message requests on Facebook messenger and I had 34 messages from him. Tons of photos of animals, him saying hello multiple times, asking me why I’m not adding him back, telling me he’s on his way to my store. 

My cousin said I’m the asshole here for thinking the worst and Justin probably just wants a friend. The manager in me feels like an asshole for denying my guest. Am I the asshole?",AmItheAsshole
