title,post,source
AITA for getting my niece disqualified for a job?,"Disclaimer: I am Indian, we refer to our cousins children as “niece” and “nephew” in our culture. 

I (26f) have 4 aunts. My aunts all have grown children in their 40s+. About 15 years ago, my parents divorced. Might seem  like no big deal, but **this is extremely taboo in our culture**, especially 15 years ago. Everyone in our community was gossiping about it - I remember walking to school one day and 2 grown men walking ahead of me were talking about how evil my mom was for leaving my deadbeat dad. 

3 of my aunts live outside of the country, 1 of them live in the same city, my mom helped them immigrate here in the early 2000’s. My aunt who lives here, has 2 adult children, and 1 of her children “Crystal” (40something) has 2 children herself - a 16M and 22F. 

My cousin Crystal, along with my Aunt, were not really there for us while growing up. My mom was a single parent, working 12-16 hour days, 6 days a week, and had no support from anyone. In our culture, generally aunts and uncles help raise children, it’s very much so like a village. However - my mom had no help. Every time she asked for help or babysitting or anything (never money), they would have a million excuses on why they couldn’t help (they both stayed at home full time, never had any job). They treated us poorly growing up - with my sister and I always the butt of the joke because we were the fatherless girls with no family. My childhood was very lonely, and nothing like the childhood my friends from the same background/culture had. It made me sad when I was younger, but I got over it as I got older. 

Present day - I don’t have a relationship with Crystal, her children, or my aunt. My mom still has a relationship with them, they see eachother a few times a year and talk on the phone every week or two. 

I work for the government, and the area of government I work in is very hard to get into. Theres a lot of “nepotism”, and positions generally go to those who know someone that works there. I joined during a busy time and took a job at the very bottom and have worked up to more senior roles, and now make over 6 figures. 

Crystals daughter “Emma” recently applied to work at my job, and in her application, indicated she knew me and I referred her. When asked by our Talent dept, I said I didn’t know her and did not refer her. I don’t know Emma, I haven’t seen her since pre covid. I guess since Emma lied on her application, she will no longer be considered for any government roles. News got back to Crystal, and she was incredibly angry that I “banned” her daughter, aka my niece, from working in government and is going around telling other family members how could I do that to them, after their family has done SO much (??) for us. 

I don’t think I did anything wrong - but some family members said I should have just gone with it and said I referred Emma because “that’s just what family does.” 

AITA for getting my niece disqualified from a job?",AmItheAsshole
AITA for being responsible of my manager's new nickname (Peter Pan) ?,"Hello Everyone,  
I 33M (and French), everything in that post happened in french but I'll translate everything for y'all.

Background :  
My company has two offices, one in the US and one in France. I'm the only Social Media manager / community manager / content creator for that company. It's a lot of work but I usually don't complain. When I joined the company, that role didn't exist and it's by creating things on my personal time and showing the results and number growing that the CEO decided to trust me and officially give me that title and the responsability of all the social media for her company. The way my contract was made is that it's Me, Myself and I: I have full creative control and as long as I don't F up, I have a job but if would F up, it's Game over; I pack my stuff and go look for another job. I just have to have a manager due to have the company built.

So, I switched teams and went from being at the bottom of the corporate ladder to join the ""Marketing and Communication team"". And while I have a good / friendly but still very professional relation with the CEO, I can't say the same for the relation I have with my new manager, the chief of my new department. He sees himself, the people working for him and what they do as the ""ELITE"". Everyone has one or multiple degrees, on very prestigious university and cursus (like Beaux-Arts, High Commercial Studies, ...) and he describes me as ""The rotten fruit"" since I don't have any diploma in my domain. And let's also add that He is not the most liked or popular human in our company, even from the point of view of people that are part of his inner circle.

So the issue :  
With the Olympic Games in Paris getting closer and closer, Everyone in the company works a lot more than usual, including me. For me it looks like around 40h of work (my whole weekly hours) done in 3 days, but I still work 5 or 6 days a week. I also need to change my sleep schedule so that I can work with the US and French employees daily.

Monday, we had a meeting, and several people were connected, including my manager, the CEO and other peoples. The conversation was about who should take on a new project. My manager said ""Give it to OP; he does nothing"". I didn't think for more than 0.2s before I said, ""Well, ImaginaryLand it's second star to the right and straight on till morning. But here, it's the reality, and that won't be happening. I'm already at 250% of my workload; so that's a no"" (In the French version of the Disney movie Neverland, it has been translated to something like""ImaginaryLand""). Everyone except my manager and I laughed when I said that.

Several days later, the tail of that meeting spread like wildfire in our company, and now My manager's nickname is Peter Pan. Most People think it's funny (most of them didn't like him before that), but My manager and some people in his inner circle think I've been disrespectful, that I'm an asshole, and I should apologize.

So, Reddit, tell me, AITA ?",AmItheAsshole
AITA for calling my cousin an idiot?,"I (30F) am taking care of a family dog alongside my cousin (24m). We divided the dates and I felt like everything was planned accordingly. I went Sunday and Monday, he was supposed to go Tuesday and Wednesday. I find out today that he forgot. The dog hasn't eaten, hasnt drank water. Long story short, I insulted him for this. My entire family is pissed at me? Like I should have been nicer to him about the situation.  
I feel strongly about being in the right here but because I called him names am I the asshole?",AmItheAsshole
AITA for saying I don't see why my sister always has to be included but I don't?,"Me (15f) and my sister (16f) are only 11 months apart but we're really different. She was always the prettier one, the more outgoing and popular one. She was always surrounded by friends and loves all things makeup and fashion. I'm more introverted and shy and I never really fit the way she did. Though I always wanted to have friends. I like video games and baking and reading. I'm not into beauty stuff like she is. I don't really ever wear makeup. So we've never had much in common.

I have tried to be close to my sister but it never worked out. We're just too different. And she resented my attempts for us to be closer. She'd let her friends say mean things about me like calling me a freak, a weirdo, saying I was lame and dumb. Sometimes they'd be in our house and they'd kick me out of the basement, which is set up for games and movies and stuff like that. They'd tell me I couldn't hang out with them and they wanted to watch something. My parents would always tell me to find something else to do. And a few times her friends split up at our house and some were outside and some in the basement so I really only had my room as a refuge. I told my parents about what the others would say about me and they really didn't care. I think once they said they'd deal with it but it didn't stop. My parents just let them kick me out of spaces or tell me to stop doing what I was doing so they could do it and it was never a problem.

When I started high school I finally found a group of friends I fit in with. There's five of us and we're all really close. I even have a boyfriend now. But my sister hates that she's not welcome in with them and the reason for that is before I was friends with them she and her friends were really awful to them and she would mock them or make fun of them for their appearance or for being weird. So none of them like her. My boyfriend is the only one without that history because he moved to town right at the start of high school so never knew my sister before we got close. When my friends are over my sister will try to insert herself and she's tried to do that by making fun of me or pushing me out but my friends actually like me.

The problem is my parents are not okay with my sister being excluded and they said if I want to hang out with my friends, we have to be open to her hanging out if she wants. She has more free time now because her friendship group had this big fight and now there's so many splits and smaller groups and nobody has the time so she's around more and wants to be involved. I tried to stop inviting my friends over but if they even came to our neighborhood to hang out it was a rule my parents put in place. Saturday I got so frustrated I told the three of them that I don't see why my sister always has to be included but I don't. I told them it was clear she's the favorite and everyone in the family thinks I'm just some freak who should be alone for the rest of her life.

My parents were furious. AITA? ",AmItheAsshole
AITA for giving my parents the silent treatment for outing me?,"Some backstory before I start, me and my dad have the best relationship, he’s like one of my best friends and biggest supporter in all my achievements, however my relationship with my mum isn’t the greatest due to her own personal issues which negatively reflected on me in my childhood and for that we aren’t as close. Now on to the issue,  In 2020 I came out to both my parents, my Mum was very supportive as her best friend is a lesbian, my dad wasn’t really bothered and said it wouldn’t change how he saw me, however whenever it came to pride things I never really went to him about it just because I knew he probably wouldn’t get it, but that didn’t bother me.

 Fast forward to yesterday, my dad and I were in the car coming home from McDonald’s for our dinner and as we were waiting at a red light I brought up the fact I wanted to come out to the rest of my family (I have quite a large family and only my cousin knew as she and I are very close), and without a pause he said to me “they already know” I got extremely confused and said back “what do you mean? I haven’t told them” to which he said “no, your mum and I told them” at this point I was getting very panicked, frustrated and upset and I was finding it difficult to put my words together, so I told him “why didn’t you ask me? You had no right to do that without telling me” and all he said back was “I’m allowed to talk to family about things” this made me cry because I had never felt so betrayed before. 

As soon as we got home I had a go at my mum telling her “you had no right to tell people my sexuality without telling me” and went to my room. Earlier today I got up and ignored both my parents when they tried speaking to me and I went straight downstairs to get breakfast, when I tried to go back upstairs my dad blocked the door and told me to sit down, he pretty much told me over again and again about how he’s “allowed to talk to family about me” and how “my sexuality isn’t just about me” I was now sobbing sat on the sofa as I just kept repeating “you outed me” and  “you had absolutely no right “ because that’s all I could get out, I was so angry that they had taken something so personal away from me because I now couldn’t come out to my own family when I wanted to, and he had the nerve to say “I didn’t out you, don’t use that word it’s very negative” like I was a child.
My mum seemed to understand my frustration and apologised for taking that away from me.
I quickly got up and barged past my dad and locked the door to my room, I haven’t and refuse to speak to him… AITA?
",AmItheAsshole
AITA for not changing the activities planned on a trip to ones everyone likes?,"More like are we the assholes. My friends and I, all guys in our early-mid 30s, planned a guys trip for last week. Its been in the works for 6 months. Before anyone asks, yes those of us with wives our wives get to have girls trips and time with their friends regularly.

Five of us have been friends since high school. One guy, Brent, joined our friend group sophomore year of college when he started dating our buddy Mitch. They're still together to this day. I mention them because this is where the issue started. My wife and best bud's wife had no problem with this trip until they learned Brent was going too. At that point they argued that it wasn't fair that they were being excluded when a couple would be going on the trip. We argued it was still a guys' trip, they saw it otherwise. Ultimately we budged and said if they wanted to come, they could.

Our original plan was traditional camping- tents and sleeping bags the whole time. We found a cabin to rent for most of the week at their insistence. We had our activities planned in advance and licenses for fishing. We did do a nature trail walk our wives wanted to do (the kind that has fences, posts, wooden paths) but other than that we told them they could take one of the cars to go do what they wanted or do what they wanted around the cabin while we did our thing. After a few days they stopped asking us to change plans.

When we got home my wife let me know how mad she was and called us inconsiderate assholes for leaving them out. I told her it was a guy's trip they insisted on joining, not a family trip. We have one of those planned for later this summer. She's been curt with me ever since. My buds' wives feel the same way and we're getting it from all angles. So were we assholes for not changing our activities to things they enjoy too?",AmItheAsshole
AITA for not distracting wife's best-friend's new boyfriend?,"OK, this is a bit of a weird one, but my wife and I are still arguing over this.

We have a friend, Bertha, who has been divorced for a few years now. She’s more my wife’s friend than mine. She and her son would come over every other weekend to play with my kids (my wife and her were pregnant at the same time with our first child). She was pretty lonely and it was a nice distraction for her. My wife and her would hang out and I would play with the kids and be expected to cook for everyone. She never invited us all over to hers but would occasionally invite my wife and oldest, excluding me and our youngest because her son was an only child and wanted “alone time” with his best friend. I, obviously, would spend the day with my youngest. I was a bit annoyed about the imbalance, but it wasn’t a big deal and my wife seemed happy.

A few months ago, Bertha got a new boyfriend, Steve. He’s nice enough, polite and really seems to be keen on her. I’ve tried to engage him in conversation or in some activity but he only wants to sit with his new girlfriend, Bertha. The last couple of times they’ve been over we’ve sat in the garden and they’ve spent most of the time touching each other up. The last time, after sitting with them for a while, I left my wife with them and played with the kids.

My wife has been very upset with me and said I should help her out and distract Steve more. I told her that I tried and he’s only interested in Bertha. She insisted that next time I try harder because she misses talking to her friend. I said that it wasn’t my job to a be a dancing monkey. I said that I’ve cooked for them and babysat for them for years with no reciprocation and that I wasn’t interested in babysitting her boyfriend as well, especially when he’s not interested. I said that if Bertha wanted so spend time alone with her, then she wouldn’t bring Steve everywhere they go and it’s not my responsibility for me to stop him touching her all the time. If she doesn’t like it she should bring it up. If Bertha doesn’t like it then she would stop it, but she has not.

Somehow this has turned into something that is my problem and my fault. Honestly, I wouldn’t care if Bertha didn’t visit for a few weeks. I think she and Steve are excited about their new relationship and will probably calm down in a month or two. My wife thinks I should ‘try harder’ with Steve, but he’s like Michael Scott in The Office when he was dating Holly. I told her to wait a while but she somehow thinks I can solve this. I don’t see how I can. I don’t even think there is a problem to solve but my wife thinks I’m being an asshole for not trying anymore. I’ve already tried and I’m not going to force something with someone who is uninterested and is a bit obsessed with his new girlfriend. 

Amitheasshole?",AmItheAsshole
AITAH for telling my Dad I don't care about his company after he accused me of creating a fake Twitter account in his name?,"I'm a 38m and my Dad and I have never really had what I'd call a healthy relationship. Without going too deep into family history, he was mostly an absent father due to drug use and addiction. In the rare instance he was around, he was physically/verbally abusive. Recently, the past 3 years or so, our relationship has gotten to a place where we can communicate without it leading to arguments.

I received a call this morning in an accusatory tone. Mind you, we haven't spoken in months. No pleasantries or how's everything. It started with ""let me ask you a question"". I said ok, it's 7:30 am and I'm half asleep. He asks if I have a Twitter account. I said that I do have one but I'm not an active user. I ask why he is asking me these questions. He said that his social media manager at his company (he's the CEO) mentioned that he had some other accounts listed and we share the same name so he thought it may have belonged to me. At this point I'm too tired to care and he starts feigning interest in my wife and kids. It's my Wife's birthday, which he doesn't mention. I'm not all that concerned but he did spell out the username he was worried about. We hang up.

I kept thinking back on our conversation so I looked up the account. I found the account with his picture as the profile pic and a bunch of posts purporting to be him. The account was also focused around his company and had a bunch of updates claiming to be written by him. At this point I figured out why he was actually calling and I'm really upset that I would be his first suspect as someone masquerading as him online.

I called him back to say that I thought it was really messed up that he would suspect me as the person that created this account. He disputed my findings and said his social media manager brought it to his attention but didn't mention that his pictures and posts were on there. I asked why he would call me without this information and why was it such a concern if it only had his name. A quick Google search would list many accounts sharing our name alone. He apologized but refused to admit he suspected me which I thought was unacceptable. I continued to press him about why he would believe this to be the case and he only kept apologizing. I told him if he refuses to admit that he was caught to just leave me out of it and I don't care about his company.

That made him absolutely lose it and he said I crossed the line. He also said he was a man and he wasn't going to put up with being called out by me. His voice was shaking in anger and I mention that he has always cared more about his company than his family. He kept repeating that I have so much resentment and that I can't stand being called out. I let him know that he was free to say what he'd like and I wouldn't react. He started stuttering and didn't say much of anything that made sense after this. We hung up and we probably won't speak again for a while. We've gone years without speaking before.

AITA?",AmItheAsshole
WIBTA if I take my sister’s room while she’s at uni?,"In September my (17F) sister (19F) is going to to uni 3.5 hours away from home and will be living in student halls for five years. 

I have always had the box room, which has barely enough room for me. While my sister has a much bigger room, enough room for a double bed and extra space. When September comes, I really want to take her bedroom because I need more space and as she won’t be living here I thought it would make sense otherwise that space would go to waste. A double bed would be really handy for some of my medical needs which I can’t have in my own room and I’ll also be taking care of her pets whilst she’s gone.

My sister is saying that she won’t come back if I take her room. As she believes that it won’t be home if she comes back and doesn’t have her old bedroom.

WIBTA?

",AmItheAsshole
AITA For going on my deck at night?,"So apologies for any formatting. I'm a longtime lurker on Reddit but I've never really posted. 

So here's the situation at hand! 

I (24F) have lived in my current apartment for around 3 years. Recently I've began cleaning my deck and laying out the furniture again as a form of ""spring cleaning"". I get all this done during the day while it's still light out. However, I like to go and sit on my deck with the light on during night to just to get some fresh air occasionally while enjoying my new deck furniture and setup. This hasn't been a problem in the 3 years I've lived here; However recently I've had one of the neighbours come onto his deck and start SCREAMING at me for being on my deck. I can say for certain I am not being loud. As a matter of fact I never even speak on my deck or watch videos. Just sit and scroll on my phone or I'll read. During the daytime I decided to test wether I was somehow being to loud and I got my fiancé to sit in various different rooms while I talked, Played videos, slid chairs, etc and he said the only thing he could slightly hear was the chair sliding so I know for certain I am not being to loud. The light also shouldn't be the issue as there is a road about 20 feet away with streetlights and cars passing by at all hours and even without the light on it's very bright.  

Almost every time I go out on my deck after sunset within 5 minutes the neighbour is on the deck screaming at me. He has never once been nice and just slammed open his door and screamed ""Can you GET THE F\*CK OFF YOUR DECK?? YOU'RE BEING SO INCOSNIDERATE AND SELFISH"". He has not been kind or asked politely literally a single time and has only ever resorted to what I call the ""Grand tantrum fit for the brattiest 4 year old"". Because of all this I've decided to continue using my deck as I see fit and sitting quietly with the light on. 

I've recently told a few of my co-workers about this story and although most are on my side and have said that if he's not paying my bills he can't dictate how I use my space as long as I'm not hurting anyone or being disruptive, Other co-workers have said I should be a bit more understanding and maybe he has some issues or something so here I am asking, Reddit, AITA for using my deck at night?",AmItheAsshole
AITA for not buying my boyfriends family dinner?,"Me (17) and my boyfriend (16) live between each others houses. (Sometimes we go to his mothers and sometimes we go to mine)

Anyway we both have issues with our families but decided to stay at his mothers because mine is giving me trouble for not going the education path she wants me to, so won’t let me back there unless i do.

My boyfriend stayed at mine for months at a time over the course of a year and my mother fed him 3+ meals a day for that duration and didn’t make him pay or ask him to spend his money in anyway that benefitted her.

Currently we are staying at his and i have hardly had one meal a day because i usually am not that hungry.

Today i bought me and my bf a takeaway from the pizza shop over the road, she is trying to say if i was going to spend (my only ten pounds) my money on food it should be for the 7 people in the house. 

I don’t have a job and currently can’t as i am waiting for my passport which takes atleast a month in the uk. 

She is also trying to say that i eat twice as much as my boyfriend, which i dont, because i only go to the kitchen if it’s with him, and we are out most of the day. 

She also spends a lot of her money on c0k3 and she also gambles too, which means there isn’t a lot of food in the house anyway, which is why i spend my money on it (my dad gave me for helping him clean) 

AITA for not buying everyone food when she makes most of us go without food most of the time???

",AmItheAsshole
