title,post,source
AITA for embarrassing my SIL? ,"I hate it but I’m a mom that’s overly sensitive about my kids…to the point where I would get more emotional about something more than they would and I’ve been trying to work on it. But my twin girls they were NICU babies so I’m sometimes over protective about them plus they did have some developmental delays because of that. So if I’m the AH please tell me. 

But twin A (F7) she’s my talkative one and the most outgoing one between the 2…however  twin B (F7) is the complete opposite she’s my loner one and more reserved…which I don’t have an issue with that…especially if it’s just her personality. But with them having such different personalities, friends and sometimes even family members would treat them differently from the other. Some I’ve even seen ignore twin B completely and just focus on twin A. Even though it doesn’t seem to bother Twin B..I still worry about her psyche. 

But recently my ex-SIL , she sees my kids quite a bit because they’re in the same gymnastic class and she always wants a hug from my girls and usually they do but Twin B doesn’t like to most of the time..she likes to hover under me mostly. But SIL tried to get a hug from Twin B obviously she was not into the idea..so she grabs Twin A and says right in front of Twin B…see this is why she’s my favorite because she gives me hugs and obviously Makes twin B feel bad so to prove to her aunt she would then go hug her.  When the girls went into class I asked politely please don’t tease her with that. I don’t want them growing up thinking they have to compete with each other and I thought she understood. Until yesterday we had gymnastic class and  the same thing happened, but this time Twin B got more upset and went to go pout in a corner. I was pissed and I checked my SIL in front of the whole den of other parents and she obviously got embarrassed. I don’t remember what I exactly said but I know I said something of the lines that she’s mean spirited…But I wasn’t done with her yet after we left the class I sent her text and told her I don’t want her hugging my kids anymore if she’s going to have that entitlement for a hug when she sees them.  Clearly it upset her because I get a nasty voicemail from the ex MIL about how I embarrassed SIL in front of everyone..making her seem like she was a monster in front of these parents…I’m starting to think if I was maybe being overly sensitive..because Twin B is fine and does not seem to care about the incident. So AITAH? ",AmItheAsshole
AITA for trying to postpone my sons wedding?,"My son (23) and I (F47) have always been very close. About 3 years ago, me and my family went to a new church and it was there that my son met his now wife. At the time, I thought she was really sweet and I really wanted them to get together. I was very excited and supportive. We saw them every other day for dinner. After 5 months of dating, they got engaged and I was very happy for them. They began preparing for their January wedding and my son bought a house 2 weeks after their engagement.   


  
Everything was fine, until one day, 7 weeks before the wedding. My son's fiancee came over and it was clear that they were fighting. They went to our family room where they proceeded to sit in silence while I made dinner. I served dinner, and they were both not talkative. My son's fiancee didn't even talk to me! Shortly after dinner, they left with only a few short exchanges of conversation. I was furious. Me and my husband told our son that she was never allowed in our home again because she disrespected me. After a few days, we agreed to meet with them, and I made it clear to her that she couldn't behave like that in my house. I expressed that she hadn't been raised right if she wasn't even going to talk to me in my own house and that we didn't raise my son like that. I expected this to fix things, but it got worse. My son's fiancee was often upset ever since and acted like she didn't want to be there.

&amp;#x200B;

&amp;#x200B;

3 weeks before their wedding, they changed church pews under the pretense that ""they wanted to have their own row because they were getting married."" I felt so abandoned, because I my son told me he'd sit with me at church forever since he was family. He then moved out completely, and he didn't want to come over as much. I didn't know what to do, so I texted him and told him that I wouldn't pay for/host the wedding rehearsal. He said that he wanted us there, but I didn't believe him. My son came over the next day and I told him exactly how I felt. I told him his fiancee was a changed girl since she got a ring on her finger.  I tried to show him that she was manipulating, they were unhappy, and should postpone the wedding for his own good.   


  
After he pulled even further, we went to our son's house one night to talk to him. My husband begged my son to let me light the unity candle at the wedding, or else it would destroy me. My son told me he wouldn't replace me. 2 days later, I got a text from my son saying that that I couldn't light the candle since I did not support the marriage. Instead, he was going to have his MIL light both of them. I was heartbroken, so I just stopped responding to his texts and calls. I went to the wedding to show my son I supported him, but we did not talk to him or his new wife. To this day, he still believes he made the right call in banning me from the candle, even though he knew it would destroy me. I don't want to talk to him until he apologizes for picking a new mom. AITA for this?",AmItheAsshole
AITA for telling my south asian parents not to kiss my 2 months old daughter on lips,"My parents are not from US and I was also not born here. However, I’ve been away from home country for over a decade and I am having to deal with issues related to cultural differences
On a daily basis with my parents. It is worse when they are visiting us. 

No matter how hard I explain things that are done differently here to them, they don’t seem to try to acknowledge it. 

Very recently, I let them know about what our daughter’s Pediatrician told us; not to kiss the baby directly in her mouth. My mom did it anyway today. 

I was upset and mad that she didn’t respect that. In fact, there are other things they just listen and ignore. I feel like my words mean nothing to them. I burst into anger today. 

In my parent’s defense, “It would be an unbelievable thing to say back in home country. I was raised by feeding from their mouth (making food softer by chewing). I acted as if the baby is going to get a disease from them.”

I am exhausted from these kind of incidents with them. I can’t stay quiet because I can’t unsee them disregarding the things I request them to follow.  I am not sure what to do. I have already tried explaining things when everyone is calm. However, these things keep happening. 

My mom told me that she feels like I don’t treat her close to our puppy. Another thing they don’t like is the request I made to not post our daughter’s picture in facebook. Dad did it anyway and when I was upset about it, obviously it didn’t go well. 

Guys how do you deal with these incidents in your family if it applies? Sorry to bother you all, I am not fully sure if this is the right community for my story. Happens to be my first post so please go easy on me. Thanks all! ",AmItheAsshole
AITA for telling my step dad I don’t want to have movie night with him anymore ,"I(17f) have and my step dad(47m) have had a tradition ever since I was little where we would watch movies every weekend. My bio dad isn’t in my life as he left when I was at a very young age. So me and step didn’t have to worry about me going to my bio dad’s house because he didn’t have custody at all. 
            However ever since I was at the age of 9 my step dad had started to put his hand on my thigh, which thigh depended on which side of he was siting at, but usually sat on my right side. Then it wasn’t really that high but as I got older he would start moving it upward. I found this really weird especially when ever my mom would walk in the room/ watch a movie with us he never did it, but since I didn’t know that it was bad I never said anything.
     At the age of 12 I had gotten  through a very traumatic time with some boys at my school which involved them putting their hands on my thighs. After that my Step dad never touched me again until now. He did it again it was basically on “that” area I got so uncomfortable I told him to stop but he didn’t. I yelled at him saying “ I’m not going a move night with anymore if you don’t stop.”
       He said he wasn’t doing anything wrong but never told my mom why I yelled at him, to which my mom called an asshole and I was being a bratty Teenager. I haven’t had movie nights with any of them anymore 
    
        AITA?",AmItheAsshole
AITA for not wanting to give emotional support to my mom?,"(English is not my first language, I'm sorry in advance)

I'm F, 21, and since I was a child I've been serving as emotional support for my mom, every single time she had a minor inconvenience in her life. She used to call me the ""peacemaker"" of the family. I've got a slightly older brother, who is not very close to her since they argue 65% of the time. and a father, who died 4 years ago. Ever since my father died, I became the only source of happiness for my mom. She has no friends and has no interest in finding love again.

 She used to work a lot, after my dad passed away, so our family did not get into financial difficulties, which I am very grateful for, but I also helped her in every way I could, I worked hard and studied hard. Since I spent all my time wanting to help her, I did not have time to make close friends or get a boyfriend, my only worries were to get good grades, get into a free university, do all the housework and cooking, and work hard. 

But now my mom complains to me all the time about me not having a boyfriend, she even questioned if I was lesbian (which I don't take any offense in, but she is VERY conservative), and she worries about my future and me all the time, and every single day she has anxiety episodes where she will say her entire source of anxiety is my future. She did a bariatric surgery and her emotional state is even worse. now. And, since I'm taking care of her the entire day and night, it's been unbearable to handle her numerous mental breakdowns because of these worries that she has.

 I'm doing the best I can, I've never been a trouble-child and always did my best to be well-behaved, but it's been some years since I've been under that pressure, and that mental burden is making me way less productive, revenge procrastinate, and depressed. Since we're having to spend way more time together, every single little thing I forget to do (like washing one plate) has been a reason for us to fight. Every single time she calls me to her room to lay down on her bed and ""talk about life"" (which ends up being the same complaints about me), I simply refuse to go and I really don't want to talk to her about her emotional state. I'm very burnt out and I'm struggling with my own mental health already.

I've tried everything to help her with therapists, and psychiatrists, but she has a lot of stigmas about getting mental help from a professional and refuses to see one online or face to face. AITA for refusing to listen or help her by myself with her own problems?

",AmItheAsshole
AITA for not letting my stepdad sleep in my room?,"Hi this is my first time posting on here and I honestly don’t have anyone to talk to about my problems so I just want to see if there’s anything I missed all feedback is welcome 
Ok so on Monday afternoon me (18yo) and my stepdad (45yo) where sitting in the living room watching tv and having a good time while he was drinking a couple beers (on a Monday afternoon might I add) after a couple hours we decided to go to our rooms and sleep before work, (we work night shifts so we sleep during the day) and when we entered my parents room my mom was taking up the whole bed. My stepdad told my mom to move so that he could lay down and my mom jokingly says “no get out of my room” joking and fighting like this is pretty normal for us we play fight all the time and it’s just how we bond I guess so I didn’t take it seriously so my stepdad said okay fine and humorously stormed out of the room and went to mine and told me to stay with my mom and that he would sleep there in my room. Here’s where I may be the asshole, by the tone of his voice I figured he was still playing around so I said no and tried pushing him off my bed (I will admit part is f me didn’t want him to sleep in my room not cuz I have anything to hide just cuz it’s my space and I feel like it’s an invitation of privacy to me) and since we where both laughing I was still thinking this was all a big joke after a while of this happening and him insisting on sleeping in my room I kept saying no and i managed to push him off my bed when he hit the ground (my bed is like a foot off the floor) he got up and said “okay since you just basically kicked me out of your room I won’t let you into mine ether” in a slightly more serious tone and now actually stormed out of my room I ran to his room thinking he was just acting rlly well but he was actually upset and he actually kicked me out of their bedroom the sudden change of attitude shocked me to say the least and I was overwhelmed with emotion so I went crying to my room. Flash forward to today it’s Thursday and he still hasn’t spoken to me and at this point I don’t know what to do it’s a nightmare to work with him like this since he’s my boss so I kinda have to talk to him from time to time and at home it’s the same thing so I’m at a loss at this point. So am I the asshole?",AmItheAsshole
AITA for not making my daughter work or move out?,"I'm a single dad of a 19 year old daughter. Her mother passed away when she was 4. Ever since then I've been raising her alone. I haven't dated anyone since my ex passed, I've had a few casual hookups here and there, a few ""friends with benefits"" but nothing serious. I was too busy with my daughter, managing my company, renovating my house to even consider dating. 

I grew up poor, I first started working when I was 16. When I was 18 and finished school I was working 60+ hour weeks. I eventually started my own logistics company which meant even more hours. I always promised myself that if I had a kid they wouldn't have to go through what I went through. I tried to provide for my daughter as best as I could. I always paid for her hobbies whether it was horse riding when she was 9 or guitar lessons when she was 12. She's 19 now, she doesn't officially have a job but she works part time as a ""social media manager"" at my company, she basically manages the pages for my company. Makes new posts, replies to comments etc. On top of that she's taking photography classes and has done a few paid gigs. When she finished high school she said she didn't want to go to college which I supported. All I ever wanted was for her to have the chance to follow her dreams and passions, something I could never do. Yes I know she's a bit spoiled, she lives for free with me, I pay for everything, her car, phone, her photography classes. But I don't have an issue with that. 

Anyways, six months ago I started dating this woman I met through online dating that my daughter helped me set up a year ago. This whole thing was her idea. We don't live together but she spends most weekends at my place. But recently she started having an issue with my daughter. She doesn't like the fact that my daughter is ""spoiled"". It all started after her car broke down and she had it towed. It turned out her transmission failed and the cost to fix it was too expensive. She asked to use one of my cars to which I said no. And since then she's been really negative about my daughter. She keeps starting fights about her and I honestly don't know how to feel. This is the first woman I've loved since my ex died, but the constant fighting and her criticizing my daughter is just too much. I'm honestly just confused. She makes me feel like a bad parent for raising my daughter this way. So AITA here in this situation?",AmItheAsshole
AITA for telling my friend my honest opinion,"Burner



I'm 29F. My friend A, is gonna get married in a few month. She's from a euro country, but her boyfriend is from here.



They're gonna have a mixed traditions wedding. I am a bridesmaid and i've been fully commited w/ organizing and planning.



She was looking for the perfect wedding dress, she went to lots of salons. She had 3 final picks and brought us to the salon to hear our opinions.



She asked me and the other bridesmaids to give her our honest opinions, she wont get mad. She picked the dress, and we moved on.



She had told us in her culture the bride changes into a traditional wedding dress at midnight, and her hair is braided and stuff like that.



I thought it's gonna be an actual wedding dress. Then she sent us the picture of dress last week and it's a hot mess.



It's short, RED with flower embroidery, it has a weird matching headpiece w/ pearls. It's honestly inappropriate to a wedding. Especially since she's gonna wear a normal wedding dress before that.



I also think braiding her hair cuz she's a ""married woman"" is outdated and misogynistic from the time women were treated like properties. There is no reason for a woman to that in 2024. So the whole thing is wrong IMO.



At first i said it was nice, but then i remembered how awful it's gonna be for her to show up in that circus costume. It's short as i mentioned, I am against sl.t shaming, but i believe people should wear appropriate dresses (including the bride) to a wedding.



Since she had asked us to be honest, I called her and told her the dress is not fit for a wedding, and the midnight tradition is lowkey misogynistic. I told her i do not mean to be rude, but it's gonna be ridiculous in a normal wedding.



She told me it's a beautiful dress and they've been doing this tradition for centuries, and the change is about the women entering a new phase in life not about the men.



I told her traditions are pointless and we follow old dead people's beliefs with them. and regardless of what she believes it's gonna look like a circus not a wedding.



She called me cultureless and told me to use my energy on real feminist issues and called me a fake feminist.



Things got heated I told her ugly things too and I hung up.



I hadn't heard from her but my intentions were not to offend her or her culture, i just really think she is gonna make her wedding ridiculous.



She hasn't responed to me and now I am conflicted if I was too harsh.



AITA?",AmItheAsshole
AITA for ditching a friend at the airport in Mexico?,"I take frequent trips to Mexico for vacation. Last couple trips down there have been solo. I've been trying to get friends or family to join me but the timing never lines up. I've stayed in contact over the years with a buddy from my hometown that I went to middle school with. On one of our recent conversations he mentioned he had just got back from a trip to Peru and really enjoyed it. I figured he's familiar with traveling internationally and he's always been a good guy whenever I return to my hometown for visits, why not invite him to meet me in Mexico? He had never been there before and I thought it would be fun to show him around and have a travel buddy on this trip.

He agrees and we arrange a time and place to meet around the airport in the Mexican town we're traveling to. The day of our flights my flight is delayed by two hours. Getting through immigration takes FOREVER. My buddy arrived about 4 hours before I did and spent that time drinking at the airport bar. When I finally catch up with him, he's completely wasted. He begins accusing the bar staff of stealing his money. He's making really inappropriate comments to other tourists about how hot their wives/girlfriends are. I inform him I'm contacting the Uber and we need to meet him on the street outside the airport as Ubers aren't allowed on airport property. Arrival time for the Uber is 6 minutes, exactly enough time to make it to the street. My friend begins chasing women around the airport trying to get their phone numbers. I finally get him outside and close to the street. He spots a small group of female airport employees on their break on the side of the airport. He begins harassing  them and trying to get their phone numbers. He's not taking ""NO""  for an answer.

When they try to walk away from him, he grabs one of them by the arm and refuses to let go until she gives him her phone number. I plead with him to leave her alone and apologize like crazy to her. I get the notification that the Uber has arrived. I don't want to end up in a Mexican jail so I tell him we have to leave now! He refuses and says he'll kill me (jokingly...I'm pretty sure) if I interrupt his ""conversation"" with this airport employee. I informed him that I'm leaving right now with or without him. He ignores me. So I hop in the Uber and leave him stranded at the airport. I started receiving texts and calls from his friends and family about not hearing from him. I inform them of the situation and that I left him at the airport. They tell me I have to go back for him and I refused. Am I the asshole?",AmItheAsshole
"AITA for telling my sister she was being ""scammed""","Well, not exactly scammed but don't know how else to describe it.

I'm 25. My sister is 40 something. She is living in the US since about 10 years and everything is going well for her and my nephews. We don't really get along because of the age difference and we never actually lived together, except for when I used to visit her city as a child with our mom. Basically we have nothing in common, I have more in common with my first nephew. I'm still living with our mom in out country (Venezuela)

So, as many Venezuelan immigrants she sometimes helps my mom with something, mostly groceries, and there are a few businesses for just that, selling packages of groceries and the person living in the US pays them in dollars and they deliver it to the family member.

However, we had bad experiences with those businesses, because they are ALWAYS late, and not like, 1 hour late or something, I mean DAYS late, in some cases, they say will deliver in the morning and arrive at night, and we had spoiled or near spoiled fruit, broken cookies, smaller meat that expected, and other issues. And those packages and delivery fees are EXPENSIVE. Of course, she pays it, but my mom could by MORE and better in a nearby grocery store with just the delivery cost.

About 2 weeks my sister paid to deliver one of those packages and they were 4 DAYS LATE! According to my sister, their excuse was ""they had no electricity"" We instantly called it BS because yes, we had many power outages, those are programmed to have 4 hours of electricity, and 4 hours without, this is because this year is so dry the dam we use to have energy is DRY. But we gave it the benefit of the doubt until the delivery guy arrived. We reviewed the groceries, everything seemed fine, and we asked where they were located. They mentioned a central location near a hospital.

It was definitely BS because they don't cut the electricity near hospitals. And if they had left that area 4 full days without electricity would be a DISASTER! It was actually offensive to say that to our faces.

I said to me sister that there was no way they would have been 4 days without electricity, but she defended the business. She rather believes a bad overcharging business than us, who are actually LIVING HERE!

This became a discussion, because she started to say ""YEAH SURE, YOU JUST REPEAT WHAT THE GOVERNMENT SAYS, THAT EVERYTHING IS GOOD AND FINE"" She always does this when we tell her that things are not as catastrophic as she thinks wants to start talking about the Venezuelan government. I called her out on that and told her that is their word against my living reality.

This had upset her and then complained to our mom, and my mom told me that I should have just stayed quiet, so AITA?",AmItheAsshole
