title,post,source
AITA for not wanting my ex husbands baby mama near our children.,"So for a bit of background.. me 26f and my ex husband 28m spilt up in June and got divorced in December of last year, after finding out that he had been having an affair with my best friend 28f. 


She had been going through a divorce herself and i really didnt thank that they would stoop so low, but it happened and i found out on the day of our youngest daughter's birthday..

However she would gaslight me into thinking i was imagining things and telling me she would never want to be in a relationship with him, while telling him they needed to go look at houses together while I'm in the same room as them(i was getting the rest of my belongings). 

They started their relationship within a week of me moving out... During the months from June to December, both of them were incredibly nasty towards me and threatened to take away my daughters 9f and 3f because I'm unstable because of my depression. 


I found out the she was pregnant after them being together for 5 months, and then they split up because she attacked my ex husband in front of the children. Although she claimed she was certain my ex was the father there was a time in which she wasn't sure and wanted to raise the baby on her own. 

But about a month ago she got back in touch with my ex husband and they have become close again... 

So where the issue comes in is i dont want her around my children as she has often told them that she will be their new mommy because she is pregnant with their baby sister and that daddy loves her more than he loved mommy and she will be a better mommy for them when they get married... 

She has also had my children lie to me when they are spending weekends at their dad's place by telling them to tell me she wasn't there and that i will lose my temper with them if they told me she was ( I've always assured my daughters that i wont be angry with them if they tell me the truth in regards to that and that my ex and his baby mama is in the wrong)

I dont want that woman around my children regardless of her being pregnant with their half sister yet my ex husband thinks im being unfair towards her because she has ""changed"" 

Am i the asshole for not wanting her around my daughters?",AmItheAsshole
AITA for wanting to cancell plans with a friend?,"I (F27) made plans to go on a weekend trip with my friend (F25), and two other people (her friend and her mum). The main event will be a concert that she is super-hyped about. This city-trip is about 3 months ahead. The tickets are already paid for. We were about to book a hotel, however I found out the other trip that I have planned will be moved to another time and collide with my weekend plans.

The other trip was supposed to be 10 days long, to another country, with my dad. My dad always wants to go on any trip really, and was delighted to go together there. I always wanted to go there, but I never really had a chance. First, as a student, I had no money, then my ex bf didn't want to go with me, and last year I booked that trip but it got cancelled. This year I hoped I will finally go there, I booked it via travel agency, but they decided to change the date. 

Now I told my friend that I really want to go to the other trip, that I am really disappointed about the changes and that I would love to go to the concert, but if I have to choose, then I really want to go with my dad... And that of course I will pay for whatever costs were already made in connection to the city-trip. She is upset with me now...

For context: she knew about the 10 days trip before and that I have been planning it since last year really. We visit each other regulary, we used to be pretty close as kids and got closer again in the last two years. We went together on a trip only once, a really long time ago. She didn't leave the house since her child was born about a year ago and that weekend city-trip was important to her. That weekend trip won't get cancelled just because I won't go there. In the (close) past we had some really loose plans to go to together somewhere, but she always cancelled due to being sick or her child being sick, and I completely understand that, it is not within her control. I just think it adds to her frustrations. There are other weekends and trips that we can go to, but I think she might be a bit too angry at me to even consider.

AITA?",AmItheAsshole
AITA if I don’t want to delete acc with dead friends messages ,"So as the text states my gf (17) and me m(17) are at the breaking point of our 1+ yr relationship over my old fb acc. 

For context at the beginning of our relationship she would feel that I’d prioritize my friends over her, which admittedly I did. I felt like I was balancing my personal life and relationship by separating them a bit. I would spend the majority of the time with them and stay out late. In doing this I was also poor at communicating to her what I was doing at the time. Only telling her I was “chillin”, wouldn’t tell her where I was going, or who I was with. In hindsight this was absolutely the most stupid thing I could do. It’d be the same 2 guy friends and I’d assume she’d know but this just led to a huge amount of trust issues. I no longer hangout with them. It’s gotten to the point where I cannot talk to my female coworkers other than a nod or mhm. If there’s any female on my feed even if it’s just them with a chunk of text or their opinions it’s a still a female. If I don’t ignore my coworkers or hit uninterested then she takes it as disrespect. She only takes it this way because of how big of an clear she’s made it. I understand that these are her boundaries only because of how I’ve fucked up in the past. 

I don’t want it to seem like I’m painting her as this control freak for no reason, I’ve kind’ve forced her into this position. These aren’t all the examples just a few. 

The title of the post is where I’ve felt the most conflicted. My friend passed 5 years ago today and my old acc has their messages on it. I got a notif from my old acc that I am not logged into about some mutual posting a picture. She immediately saw it and left my house (already about to leave anyways). And texts me about how I only have that acc to follow bitches. I had made a whole new acc just to have no one on it and so she knew I didn’t have anyone else. I thought this would be enough, but it wasn’t above and beyond as she needs to be shown and what she’s done for me. I should’ve unfollowed every girl I had on that acc previously but it didn’t cross my mind because I was never on it. 

This was the ultimate sign of disrespect atp in the relationship. She’s given me an ultimatum now if I don’t deactivate the account then we’re over. She’s suggested that if it was really the messages I was worried about then I’d just screen shot them to save. This just really irked me. I love this girl and I want her to be able to trust me again. Is this the way?

Edit: I wanted to add that at the beginning of the relationship I was completely in the wrong. I’d talk to people she didn’t like, I wouldn’t prioritize her, and do things to make her feel disrespected. It wasn’t my intent at all, but it came off that way. In my head I had my own way of balancing my personal relationships and my relationship. We’ve had history for years and we fell off for about a year. During this time I was confident that I learned from my mistakes and wanted to be a more open and friendly and open. I was carrying this sentiment early into the relationship I didn’t want to cut people off because of my relationship with her. I’d already done this and ended up isolated after we had stopped talking. I think this is why she feels so insecure in the relationship. If I’d known these actions would have this much impact I’d do it no hesitation now. ",AmItheAsshole
AITA for refusing to watch my niece for a week?,"I (31F) have been with my partner Nolan, (32M) for 4 years. We have a 2 year old daughter Maria, and live together. He has a brother Dario(21), that also has a 2year old daughter, Rene with his girlfriend Kelly(20). Recently they came to me to ask if I would be willing to babysit their daughter for a week during the school holidays as their normal babysitter (Renes maternal grandma) is going on holiday and they don't have the funds for a babysitter.

I told them I don't feel comfortable looking after Rene as I have never babysat her before and only ever spend time with her at family gatherings,etc. They tried to convince me by telling me I have the time and it would be good for the girls to spend more time with one another.

I still said no. I am planning on going away for two weeks including the week they want me to babysit to visit my sister in a city 4hours away. They said I could take her with. I still said no, I will be staying at my sisters house and although it has the space I am not inconveniencing her by bringing a child she doesn't know to her house. She also WFH so I would be going to other family members nad friends I haven't seen in a year the first 3 days we are there since she will be working those days.

Having my daughter to travel with will be exhausting enough, I do not have the energy for another child. They have been blowing up my phone and included MIL in the argument. She is taking their side as Dario is her golden child and Rene is definitely her favourite grandchild.

I got fed up and said maybe MIL should take some personal vacation days to babysit her grandchild instead of forcing me to do it.

They tried to get Darios aunts and uncles involved but they are all on my side as I am closer to them and told them exactly why I didn't want to babysit.. I am now being called an a\*\*hole who doesn't think of anyone else by MIL, BIL and his girlfriend.

I really don't think I am TA. I am very strong minded and refuse to be forced into anything. But am I wrong? Should I help them?

  
Edit:

My partner agrees with me, he has also been wanting to go to my sister's for a while and even took the time off to go as my brother who is he close friends with also lives in the same city.

He has told his brother, mother and Rene to back off. He told me to block them but I dont want to as I feel there are better ways to resolve this. I asked him if we could possibly help them pay a babysitter as we are able to but he doesn't want to as he feels its time to cut the cord and let his brother figure things out for himself.

  
We came over today to have lunch with all of them. 

SIL and BIL were still adamant that we help them while MIL has now changed her mind. 

Apperently she didnt know we're planning on going away. She has told them to make other arrangements or take leave if need be but to let me and my family enjoy our time together. ",AmItheAsshole
AITA that I exploded to my mother? ,"Haii, good day! This is a throwaway account and English isn't my first language my apologies for any mistakes. 

An hour ago I left a family dinner with my younger brother after I exploded to my mother. She kidnapped us when I was 6 and my younger brother 5, eleven years ago. To this day she believes this wasn't kidnapping because we're her children and she's our mother. Also very stubborn. 

We were arguing about something unimportant I was trying to get done for my younger brother when he told me to drop it, so I did. Immediately after, my mom told me we must just 'listen to their mother,' to her new husband. It sparked another fire in me that, this time, I didn't manage to hold in. I asked her 'We have to listen without being allowed to offer our opinions?' in which she repeated we must just do what she says.

After, I retorted to my mom,' You want us to be your slaves?"" She got defensive, whining about how she was doing so good and great as a mom for us and how we should be more respectful, so I nearly screamed at her: ""Then why do you keep pressing on about issues I've told you many times I don't want because it makes me uncomfortable?"" she always keeps asking every single visit I have with her about when I'm going to sleep over at her house. When I didn't have her phone number yet about when she'd get my phone number. She only gives 50 a month for childcare, too, for each child.

While I had my eyes mostly focused on her as I kept demanding her for an answer she kept trying to deflect back to the previous issue about the small argument, I did manage to see the reaction of the others. My two cousins couldn't understand a thing but looked worried at my mother, her husband (previously tried to keep butting in to help my mother  until my Lil bro told him to shut up and keep out of the argument) was glaring angrily at me, and her husband's friend did too albeit not as furiously. My Lil bro really wanted me to shut up at the beginning too but then let me continue on, probably because this was the first time I refused to listen to him. After we left he told me he was on my side.

But since the other adults were on my mother's side, even though the cousins didn't understand a word I'm like 100% sure they're going to stand by my mother's side, I was wondering if I went too far. My father told me to be kind too (for the last 10 days because we're on a holiday with my mom, another thing I only agreed to because she just kept on asking and asking) after I told him about the situation. I mean, she does try I suppose by gifting us 70 a month and some clothes when we go to her (which is usually once every few months). She tells me often how she cries every time we left her again, and especially when we were angry at her. Back when we were young, I especially wasn't the kindest. I'd often run away from her.

I guess this is more like a: AITA for not being sympathetic to my mother? ",AmItheAsshole
AITA for not taking down an instagram story?,"I (18F) had my high school graduation 3 days ago. After the ceremony we all stay at the venue to have dinner and take pictures together. Last year I came out as a lesbian to basically everyone at school. This year, there are 7 people in my chemistry class and one of them (17M) hates doing experiments. He sits right behind me so I would always help him out. From the first experiment we did in September, it started a running joke of calling the other our lab partner for life. So after graduation we took a selfie together, where we are just standing and smiling at the camera. We aren't even touching shoulders.

One day and a half after graduation, I posted our selfie and captioned it ""lab partners for life"" and tagged him in it, and he liked the story and replied ""fr"". An hour later, he asked me to take it down because his girlfriend was mad. I told him to tell her that I'm gay and he said it wouldn't matter to her and asked me to just take it down. This whole time, I was getting ready for my sister's wedding with the other women in the family so I asked them for advice and everyone said I shouldn't delete it if I don't want to. I told him I'm sorry but it's my graduation too and I don't want to take it down, but I won't include it in my feed posts and I'll be happy to talk to her and try to sort it out. He asked me to crop him out of it but I got caught up with the wedding and now the story has expired, but I think he's mad at me.

For added context, I didn't even know that he was dating anyone until he asked me to take the story down, and I don't know who his girlfriend is. If he had asked me not to share the picture when we took it or at any point in the day and a half before is posted it, I wouldn't have posted if in the first place. But the story has been up for an hour and he had already reacted well to it. He has also been posted and tagged in small group pictures on the feed of another classmate (19F). So AITA for not taking down my story?",AmItheAsshole
AITA for standing up for myself and hurting my parents,"I married a guy my parents didnt like 10 years back. My parents hated it, then grew to love my husband over my other inlaws and they even helped in the wedding financially. My Dad's cousin and family did not come to the wedding citing their opposition. They berated me in my chats, to other relatives and were downright hostile, not locking eyes with me for public events. This hurt my parents too, but they have since forgiven them and used to attend their partys.  
Me and my husband stay away from toxic family members. Although one or two in the family had become cordial in the recent years, I still do not like them for the way they treated me and my family.  
Recently due to family pressure I invited them to my kids birthday too, which they didnt come for, since we didnt go for one of their functions either. Now they have invited us for another one of their functions which my Dad is emotially manipulating me to go for. In addition other family members have also called to ask us to join, since they feel I should be the one to break the Ice. I have asked them why should i be the one to break the ice, considering they were the ones who stopped talking to me and berated me. They said someone should stip this drama for the sake of the family and it should be me who should be initiating contact. I have been fighting with my family daily over this as the date approaches.  
My dad is now really hurt that I am not forgiving them and not taking the first step in Amends. Me and my husband think they should be the ones talking to us first and making amends, since they were hostile not just to us, but to our parents too years back.  
AITA for refusing to make amends with a toxic family and hurting my parents because of that?

1. Me and my husband decided to not to go a toxic family members function even though my parents and other family members have been calling to make us attend it. In addition in the multiple calls i had with my family, i set my boundaries, that i do not appreciate the way they are guilt tripping me to take the first step, when the issue was with the toxic family member.
2. Usually if we set boundaries and do not say yes to our parents , this makes us assholes in our community. Being Asian is being a people pleaser. I had to go to therapy to break out of my people pleasing tendencies. Now I am questioning if I am actually an asshole for not listening to my parents even though i worked hard during therapy break out of my people pleasing tendencies",AmItheAsshole
AITA for wanting to move from our home town for a better life for our kids? ,"AITA I want to move North, Wife refuses to think about it. 

I (34m) talked to my wife (33f) about moving north from our current town. 

We currently live in southern England, on the coast. We have 2 children M (13) and F (10).

They currently share a room as we have a 2 bedroom flat, rented, for £900 a month. The flat has no outside space or parking. 

I recently started a new job, completed my probation and got a pay rise to £28k per annum. My wife doesn’t work and we get some benefits worth around £1100 a month on top of my wages. 

The kids can’t share forever. I want to move to a 3 bedroom. But the prices in the area for those are £1400/£1600. Even with my wages we would need a gauruntor for the remaining and we would be barely scraping by after food and car costs. 

My work has a secondary office up north, outside Sheffield. I looked up the price for a 3 bed up there, with a garden, driveway and close to local schools and found a lovely one for £750 a month. I know work wouldn’t care which office I worked from. Even remote. 

We can’t afford to live in our home town. So I spoke to my wife about it. She shot the idea down straight away. Her reason is her ‘support network’ as she does have anxiety issues. She does choir practice, has a few friends, and all our family live close by. She doesn’t want to leave and I understand that. But the quality of life for our kids and ourselves will be better, a bigger house with more space, outside area for the summer, a drive for the car, extra money for holidays etc. 

When we moved to where we are now she hated it as she was further from her mom. By 30 minutes. We only see her mom once a month if that. The drive is around 4 hours each way from where I want to move. A lot but doable in a weekend each month if we wanted to. 

The last words my wife said on the subject before I went to do the weekly food shop, was if you want to go with the kids, go! 

AITA for wanting to move? AITA for thinking about what she said at the end seriously? ",AmItheAsshole
AITA for refusing to take my nephew's girlfriend out for pizza?,"I (35F) invited my nephew (18M) and his girlfriend (21F) over for dinner tonight. I do this with my niece and nephew and their SO's every few months just because it's a good way to catch up on things, I like to cook and they enjoy home cooked meals without having to lift a finger or do dishes :D . (Young people with full time jobs I get they don't cook every night)

My nephew has a new girlfriend and I invited her along, since she is an extremely picky eater (not because of mental health issues or ED's or anything just extremely picky) I asked her before hand what she liked to eat and catered a full meal to her liking with her food preferences.

I spend the whole day doing groceries and cooking today as it's my only day off from work and like I said I enjoy cooking so I do not mind this at all. And I also invited my mother so she can see her grandson and I always make way too much anyways.

I had just finished everything in prep work that I could when my nephew calls and I can tell he's sort of awkward in calling. I ask him what's up and he very carefully asks me if it's okay that we just go out for pizza instead tonight. I explain to him I rather not since i've been cooking all day and it'll just go to waste and he explains to me that his girlfriend only likes the foods she told me she liked when they come from fast food places and she's worried she won't like it so she'd rather either not come at all or go out for pizza (implied that i'm paying for all the pizza as well).

I can tell he's sorry for the drama but I inform him that im just not gonna budge on this and I won't be springing for pizza when i've been cooking  all day and that she doesn't have to come then I'll just see him and my mom. But she would prefer him staying home as well if I won't cater to her needs. And since the car is in her name I would have to go pick him up which is half an hour back and forth for me at this point and not ideal.

At this point I was annoyed and told her she was kind of being disrespectfull and entitled and he said he agreed but just couldn't deal with the drama of her right now.

I told my mom this and she said that it's financially no problem for me to spring for the pizza's and I could just portion out the food and put it in the freezer and it's about  all of us being together not about  what we actually eat and that I was being an asshole for not accomodating my guest?

so, am I the asshole?

UPDATE: Wow this blew up more than I thought it would :)!

I ended up following the advice given here and texted my nephew that if he still wanted to come by himself over I'd spring for an uber for him. He basically just texted me a bunch of hearts back so he also loved the idea!

I also ended up telling my mom the dinner was off, that way I could have the alone time with him. As he is also my godson we're very close. He said girlfriend wasn't happy he was leaving her for the night but apparantly he had told her to stick it because he was over her drama. We had a great dinner together the two of us and he talked a lot about his doubts in his relationship and is concidering breaking up with her not just over this but many other things.

It ended up being a really fun evening just the two of us, and I send him home with a big batch of Auntie's special brown butter brownies (just yummy special not ""special"" :D before you all ask LOL!)

So thanks everybody for all the great advice &lt;3

Small Edit: Since people keep asking me, I got the Brownie recipe off of Tiktok about a year ago and the creator's name is BromaBakery Enjoy guys! ",AmItheAsshole
AITA for asking my little brother to voice-talk at videogames less?,"I live with my family (I'm still quite young) and there's my little brother (he's 15) whom plays videogames voice talking with his friends for several hours a day (at least 5/6 hours a day). The walls of our house are thin and you can hear ANYTHING from a room to another.   
I told him kindly to cut a bit on his call time like doing 2/3 hours but he's not caring, I also talked with my other co-familiars and he keep not caring or the co-familiars tell me it's my fault I hear it loud or just find a way to tell me I'm the actual asshole for not letting him play and that I'm pretending too much (because ""don't try ever to say families should just accept and respect everything everyone inside them does"" basically their words).  
Keep in mind I'm also diagnosed neurodivergent which my family knows really well so it's extra hard for me to deal with noises. Also I'm often at home studying.  
My brother's been voice talking like this since he was 10, he stopped for a few months recently and he just started again like nothing was.  


AITA for pretending my lil brother to voice talk a bit less?",AmItheAsshole
