title,post,source
WIBTA if I told my boyfriend to be more mindful of his meal/snack portions?,"My BF and I eat most meals together when we're not at work. When I cook I like to make several servings worth and save for leftovers. But unless I proactively separate and put away what I want to save for later, BF ALWAYS will eat whatever is left after I serve myself, even if it's multiple servings.

I'm not necessarily mad because I think he's eating too much. He's a grown up and can make his own decisions about his diet. But it is annoying when, say, I'll make 6 servings worth of pot pie, take one serving for myself, and watch him load the entire rest of the dish onto his own plate.

I will say that he usually asks me if I've taken all I want first, and since I usually don't go for seconds I'll say yes. So I guess I do technically give him the go-ahead. Sometimes I'll respond yes, but I wanted to save some for lunch tomorrow. He'll reply along the lines of ""Oh...well, how much did you want to save?"" and then take the rest of whatever I don't section off to save for later. Which isn't a big deal, but it feels weird to me that I have to physically put away the extra portions instead of him just not taking All Of It every time.

Another issue is when I bring home a treat/special snack and offer some to him, if I don't specify exactly how much I'm willing to share he'll inevitably end up eating most of it. Like a couple weeks ago I brought home a loaf of banana bread my coworker made, planning to make it my breakfast for the next few days. But BF took my offering him a slice as permission to eat 90% of it within 24 hours. What I was planning to make last several days was gone in less than one!

I said something for the first time with the banana bread, and chastised him (mostly in a joking tone) for barely leaving me any and could he please make sure he saves more for me next time. He apologized and seemed like he meant it, but the next night when I made dinner he once again took the entire rest of the dish after I served myself one little portion of it. I almost made another comment but I worry that anything I say will come across as a judgement on how he eats so I held my tongue. 

I'm thinking my best solution is just to continue being proactive about putting what I want for leftovers away ahead of time, but it's annoying to feel like I have to essentially hide food away in order to ensure that I actually get to have my fair share of the dish later on. I want to say ""FOR GOD'S SAKE STOP EATING EVERYTHING!"" but I know it will sound like fat shaming and his feelings will be hurt.

WIBTA for saying something?",AmItheAsshole
AITA for exposing my in laws?and telling them how much upset I am?,"AITA for telling my in laws about how upset I am?Am I over reacting to my SIL?

My young  BIL got blessed with a baby and his sisters and mother accompanied him in the hospital while his wife was getting a c-section,
Although I gave birth before and they were never there for me,they would come the next day to visit me at hospital but they never stood with my husband while I gave birth.
(Although they never liked his wife and consistently would fight her)
I saw this as extremely disrespectful and I have told my In-laws about how extremely upset I am for sticking with her and never with me.
I got a call from my sil later and she apologized 
And said she never favored anyone,but her brother called her and asked her if she could come to the hospital and stay by his side,and because he called her she couldn’t find it in her to say no so she went and her sisters tagged along.
Although at my first born child my husband called the same sister crying telling her how hard was it for him at that time, because I was in extreme pain ,and because he couldn’t endure staying in the room he went outside to catch his breath and called her, but she never showed up but why is it different when it comes to my BIL.
Note: they would go to my BIL house while she was pregnant and would clean for her while she’s asleep and would even take the garbage out and mop the whole house for her and they never did that for me never checked on my well being while I was pregnant never came by to help me clean I would do everything on my own.
Am I over reacting?
",AmItheAsshole
AITA - for arguing with my wife about hair removal,"AITA for arguing with my wife that hair removal doesn’t make your hair grow back thicker.
 
This is what happened:
-We were watching something on YouTube and the person said that shaving doesn’t make your hair grow back stronger and it’s an old wives tail
-I said yea obviously…
-She was adamant that shaving makes it grow back stronger. 
-I made a annoyed facial expression (so I have been told) and told her that is ridiculous. 
-She got mad at me and said that I’m trying to push my beliefs onto her
-I said it’s not my belief, but that it is literal scientific fact 
-she refuses to listen and I feel like I’m listening to someone say the earth is flat…",AmItheAsshole
AITA for banning my friend from our gaming group after he spoiled a game’s ending?,"So, a bit of background: I run an online gaming group where we often play through story-driven games together. We coordinate our playing schedules so we can experience the plot twists and endings as a group. It's a great way for us to bond, especially since we all love discussing and theorizing about the stories as we go.

Recently, one of our friends, let’s call him Dave, decided to play ahead of the agreed schedule. Not only did he play ahead, but during one of our group chats, he blatantly spoiled the ending of the game we were all invested in. Everyone was pretty upset as it ruined weeks of buildup.

I confronted Dave about it, and he just laughed it off, saying it's just a game and we were taking it too seriously. Given that this isn't the first time Dave has shown a lack of regard for group rules (though the first for a major spoiler), I decided to ban him from the group to prevent future disruptions.

Now, Dave is upset and some in the group think I overreacted by banning him entirely, suggesting a temporary ban would have been more appropriate. However, others support my decision, tired of his casual attitude towards our group norms. AITA for banning him instead of giving him another chance?",AmItheAsshole
AITA for sharing my poetry after a school tragedy,"Edit: I guess I should add that she told me she was angry with me sharing those poems two months after the tragedy, so there was a bit of a space between the event and the conversation we had.

I (F24) wanna talk about a weird conflict I have been going through recently. I am an aspiring poet and several months ago few of my poems got published in one of the most important poetry magazine in my country. Unfortunately, the publication happened a day after a huge tragedy took place at my university during which several people have died.

I wondered whether it was appropriate to announce the publication on my fb page because of what happened the previous day, but I came to the conclusion it was harmless, since the poems were already out and the ppl who didn't want to read poetry at that moment did not have to. However, the post got me in a conflict with a friend of mine (F25).

The friend is a photographer and  took a couple of photos as accompaniment to the poems. She got very angry with me, because she felt the post was disrespectful to her as a co-creator. She was in the school during the tragedy and although she was in a completely different part of the building she felt quite traumatized by the event.

I told her I wanted to look at the silver lining of the situation and focus on a life moving on rather than dwell on the tragedy (it was quite painful for me as well, two of my friends got severely injured). I also liked having a distraction from the dreadful event. I did not asked anyone specifically to read it, I just felt like it was okay to post after the event about other things than the event. Three of my classmates told me that they found the distraction pleasent as well.

I asked her what did the post mean to her. I was okay with apologizing to her and looking for a solution, but I just could not  (and until this day cannot) grasp why she was so angry about it. She did not gave me any reasoning about it or an explanation, she told me it hurt her a lot.

She also mentioned several other ppl being insensitive to her and I felt like she was just expecting to much from ppl. She was angry at one person who wrote to the school group chat ""gee, I'm glad I skipped a class today"" and at her boss because she did not approach her to make sure she was alright (this caused my friend to quit the job). I told her I thought she was overstating the harm. it just felt like she was pissed at everyone who did not react to the situation in the exact way she wished them to.

After this she essentially ghosted me. She stopped replying to my messages. When I meet her in the school she avoids looking at me, she does not reply when I say ""hello"".",AmItheAsshole
AITA Baby Shower Registry and In Law Drama,"I’m 8 months pregnant and had my baby shower recently. When I was throwing around the idea of having a shower my friend offered to throw me one. I got married less that 2 years ago and am showered out (I had 4) but I agreed to have 1 and was happy my friend was throwing one for me. I told my friends and family I was only having one but they were more than welcome to come. My mother in law kept texting me asking when we would set a date. The second we set a date for it I told her. I also created my registry after lots of time and research on what I will be needing. I in NO WAY expect people to buy anything for me honestly and feel guilty when people do. I more so use my registry as a list and full expected to purchase what I needed off of this list, it’s just a perk if someone gets it for me. 
Fast forward a couple weeks and my registry is pinging (I haven’t sent invites out yet). When I look it’s my husbands cousins who I don’t know that well buying stuff off of it. The venue I booked for the shower was small and I had my guest list set already. My mother in law then texted me asking if my husbands cousins could bring their kids to the shower. (I sent gifts to all his cousins that send me baby shower invites. I wasn’t going to send them invites and in no way expected any gifts from them.) we had a awkward conversation that they weren’t invited and it was going to to just be my MILs sisters. No one from her family marked anything else as purchased from the registry so I assumed maybes the auntss would bring the purchased stuff since it was marked as purchased on my registry or maybe they’d just return it. 
We had my shower and it was great. I mentioned to my husband that his cousins purchased some stuff off my registry I needed and didn’t give it to us so I was going to just buy it. But I was kinda bummed I wouldn’t get the completion discount and wish they would have waited or just not gotten me anything. 
He then called me all excited and said his cousins have his mom all the stuff for her house. I told him the toys were for 0-6 month olds and I wasn’t planning on dropping my child off with his mom when I’m home in leave and it’s annoying they marked it on my registry that I created. He said I’m being ungreatful but I just mainly feel 
A.) irritated they mucked up my registry 
B.) mad my MIL assumes she’ll be watching my kid so much that she feels she’ll need a house fully supplied.

AITA for being mad that my in laws marked things as purchased on my registry then gave them to my MIL? ",AmItheAsshole
AITA for telling the teachers that my daughter’s bully being a foster kid isn’t an excuse to be a brat?,"My (36F) daughter (11F) has a close knit group of 5 best friends with whom she does everything together. At her school students have to sit in the same seat for every single lesson, and my daughter and her best friends all sit together at one table.

There is another little girl in my daughter’s class called Winny. Once, Winny came to sit at my daughter’s table when one of her friends was off sick. That day, Winny constantly knocked my daughter’s books and pens off the table on accident, and borrowed her stationery only to snap one of her rubbers, stain her highlighter with black ink, and was even found with my daughter’s pens in her pocket.

One morning Winny came to school crying non stop. The teacher was very sympathetic and asked if there was anything she could do to help. Winny said she wanted my daughter removed from her seat so she could have it, and the teacher agreed. The only empty seats left were all the way in the back corner of the classroom opposite her friends, and the only students sitting there were a girl who was known to be a delinquent and two older boys who had been held back.

The teacher refused to give my daughter a real explanation for why she had to move seats, instead saying some generic stuff about being kind to those less fortunate. My daughter cried for a week straight. In our country, the school year ends in December, so that’s over 7 months of being isolated from her closest friends. She’s also starting highschool next year and will be attending a private school, while her friends are going to a public school, so this is the last time she can hang out with them everyday.

A few days ago, I was called into school because my daughter had gotten into an argument with Winny. Winny had confided in my daughter’s friends about how she had gone into foster care after her parents overdosed. Winny was always a loner at school and wanted some girls to sit with during this time, and the teacher sympathised with her so she agreed. The only reason my daughter had to move was because there wasn’t enough space for 7 girls and my daughter was simply the one Winny liked the least, and she admitted to lying to the teacher about being uncomfortable around my daughter to get her moved. When my daughter found this out, she told Winny she didn’t understand why she had to pay the price just because Winny’s parents were a bunch of insane criminals who didn’t want her anymore.

I know Winny’s had a hard time, but so has my daughter. Her older brother passed away only months ago. I told the teachers that Winny isn’t the only child going through a tough time and I didn’t understand why my daughter had to be punished for another girl’s struggles as if she wasn’t suffering herself. The teachers wanted me to make my daughter apologise for her remarks, and I said it was their fault for punishing her and forcing her to sit with the problem kids despite doing nothing wrong, and they were downplaying my daughter’s grief and trauma to cater to a brat. AITA?",AmItheAsshole
WIBTA for putting myself first?,"I'm using an alt account as I didn't want this on my main. I've been struggling with anxiety and depression for nearly 20 years now and most of the time, I am fine. However there are periods where it declines and I end up in a bad state.

For background, I've recently started a new job in an unfamiliar sector as the pay and benefits were unmatched by any other company, and it's causing me severe anxiety (think panic attacks; throwing up; unable to sleep; not being able to eat full meals etc...) and this has been going on for about two weeks. 

I was signed off sick by a doctor after I told them everything but am due to return to this job in a few days.

My doctor has extended my sick note by another week however my partner wants me to go back as I'm not entitled to any sick pay as I am new to the company.

I know we need the money and I get that at the moment he is stressed regarding finances as well as everything else going on in our personal lives and that I've been working unpaid for the last few years running his business (he has a full time retail job so I run it at home whilst he's working) so he's sick of being the only one who brings an income into the household and I completely see where he is coming from and respect his point of view. 

My issue is the fact that this job really doesn't suit me, I used to love my old job but I was made redundant due to the company taking a hit on sales due to the cost of living rising. I'm freaking out everyday and I'm dreading going back. I'm sick of being physically ill because of the crippling anxiety and it got so bad in my brain that when he was at work over the weekend, I wrote a note incase he ever found my body. 

I want to continue to live and to make something of my life and I love him more than life itself but it's getting unbearable with my mental health. He's of the mindset that I just need to get some willpower and get over it and honestly, between therapy, medication and my own self determination, I'm trying so hard and I don't want to live the rest of my life this way. I just feel like I have no choice but to go back to this job and suffer health wise because of it.

I want to put myself first but the only way I feel like I could do that would be to either run away or end it and I don't feel like I can do either as I'm putting him in an even worse situation financially but I really want to put myself first and get better whilst finding a job that suits me.

I'm sorry for the long one but I'm at the end of my tether and I'm struggling.",AmItheAsshole
AITA for asking my brother not to let girls stay in the house by themselves?,"My brother and I share an apartment together and each of us got our own room and bathroom but share the living quarters. He is single and likes to mingle, I got no problem with that and he brings ladies he's met at bars or online back to the house often, most of the ladies I've never met and will probably only meet once. My issue is there has been a few times where he would leave the house and let these ladies stay in his room when he is away. 

My job allows me to work from home so there has been a few times I'm working in the living room and these ladies will just wonder about and leave, other times I am just at home chilling and these ladies appear out of nowhere and I am shocked to see a stranger in the house not knowing they were there beforehand. I am not sure how many ladies there has been when I am not in the house. 

AITA for asking him to not leave strangers in the house? He says it's his room he can do whatever he wants and he pays half the rent so he has the right to do so. 

I don't think its asking too much for him to not leave strangers in the house is it? IF this was his long-term girlfriend or someone I am familiar with I would not mind but they are usually ladies he is having a one-nighter with. 

",AmItheAsshole
AITA For Getting Pissy When My Wife Ate My Food?,"My (M30) wife (29f) is pregnant with our first kid and I think it's been going pretty smoothly. She's due in August and if you're lazy like me and don't want to do the math, 5 months pregnant.

My wife, as any woman, has her pregnancy cravings, which was ice cream and potato chips. After work i would just run out to get them, not out of my way or issue really. Yesterday, after work I was heading to get takeout from a steakhouse, and asked my wife if she wanted anything. She said she was cooking at home and was fine. Note this is at around 5 p.m.

No problem, so I get my food and I'm ready to EAT when I get home. Upon first sight, my wife immediately started asking for some, which annoyed me it was whatever. I gave her a few bites, and gave myself a few bites before heading to shower (I know its weird to have some food *then* shower, but I didn't finish it, so it's okay).

10 minutes later, by the time I'm back to the dinner table, the container is basically fucking ravaged. And my wife said (May i add, sheepishly) she ate it because she was hungry, even though I specifically asked if she wanted anything. I was actually kind of annoyed by it and said ""you're not funny,"" before just making something else.

After I made my Plan B dinner, my wife came up me apologizing, but I was still bummed out about that steak and just said ""whatever."" I guess she was upset that I was upset because she gave me a face and walked away. 

I eventually told her it was no big deal, and I think that made her feel better, but I still feel bad, so im asking if the ass.",AmItheAsshole
AITA for not wanting to give my best friend tampons anymore?,"I love my best friend. We have known each other for 10+ years since high school. But she is really irresponsible. She forgets her backpack, her headphones, etc, at home all the time. She’s the same way on her period. Every period she asks me to borrow a pad/tampon. She always forgets them.

I’ve gotten to the point where it annoys me. Like she asked me to borrow one today. She starts her period at this time of the month every month. 

I asked why she didn’t remember to bring them and she looked shocked. She said she forgot. I told her to use toilet paper. She told me she can’t she’ll bleed through it. I said I was tired of giving her tampons, I’ve loaned her out a bunch. I always remember to bring mine,
why can’t she? 

She said I was being a shit friend. She asked if I was seriously not going to give her one, I said I was serious and she’d figure it out without me. I’m not always going to be around, she can’t always rely on me. It seems to me she forgets her stuff on purpose because she knows I’ll always bail her out. 

She ended up buying tampons and I watched her do it. I said she has to understand, they’re expensive and she asks me almost every month. She said I was a terrible best friend and left her high and dry.

AITA?",AmItheAsshole
AITA for not wanting my prospective brother-in-law in my house?,"I don't want my girlfriend's *sister's* **boyfriend** visiting my house.

My girlfriend wants to have a pizza night at my house (she has been living with me for 9 months).

She wants to invite her friends and sister, who I of course would want to come. 

The problem is that I don't want her sister's boyfriend to come, and would rather we just go to a restaurant to avoid this situation. However, this is something that would quite likely come up in future, so I want to resolve it now.

Reasons:

* He is (in my opinion) emotionally abusive to my girlfriend's sister.
* He disrespected me for no good reason in front of my girlfriend's family. Specifically, I asked the waiter if we could add a chair to our table at a restaurant so that he could join us - he then mocked/mimicked me...
* They very recently broke up (for the 3rd or 4th time), and are now back together + expecting everyone to act as though this didn't happen.
* My girlfriend and her entire family do not like him.

To clarify, I have never treated him badly, and accept that I will have to see and interact with him at other family events - I simply do not want him in my home.

In future, if they were to get married, and my girlfriend and I also got married, I would certainly accept him into *our* home, regardless of my feelings towards him.

AITA?",AmItheAsshole
WIBTA for not inviting my ADHD cousin to my graduation?,"I, f18, have an annoying, entitled younger cousin, m12, we'll call Darwin (not his real name). Darwin and his sister's mom died 3 years ago, and they've had everything handed to them since. 

I live with my grandparents because both of my parents live 30 minutes out from the school I've attended since freshman year, my dad moving away end of junior year. Since I'm autistic and resistant to change, my grandparents let me stay with them. My grandparents also let my cousins stay with them as opposed to living with their dad. 

Darwin has always been a pain in the ass. He has ADHD, and in the beginning, I got it. But now he uses his ADHD as an excuse for every shitty behavior. Disrespects his grandparents? ADHD. Breaks expensive stuff? ADHD. Ordering stuff he knows isn't a safe food, hence wasting $12+ every time we go out? ADHD. My grandpa tries to be a disciplinarian, but my grandmother cuddles him. It's gotten to a point where me, my grandpa, and his sister refuse to go on trips if he's going. The trip we took this past March told us everything we need to know. As soon as I vote in the next election (the polling location is right down the street from here), I'm moving in with my dad and his gf, as moms house is already packed. 

However, there's one key thing coming up: my graduation. I seriously don't want him or his sister there. However, his sister has agreed not to be glued to her phone while I graduate already. Darwin, however cannot sit still, shut up, or behave. It's not even ""typical ADHD behavior"". It's just him simply misbehaving. I've already told my grandmother but she's just brushing me off. So would I be the asshole if I uninvited my cousin from my graduation? Even if it means uninviting my grandmother, my grandpa and I are closer anyway. ",AmItheAsshole
