title,post,source
AITA in this relationship argument?,"Long story short. I have a recurring argument with partner.
They say my way of commenting is rude and insulting.

I think I was trying to flatter them, and that they understand it wrong, and I've been pushing this viewpoint obstinately.
Here's an example: a comment from me after they got a haircut: ""oh, you're planning keep it like that?"" and after confirming, I said to the effect of ""Ok, nice."" 
I feel like I was not being rude, but after several arguments over the fact -  I was asked to post it here for peer review.",AmItheAsshole
AITA for being toxic towards my 72 y/o grandmother who pays for everything I do?,"I (23F) just moved to Greece with my grandma (who is from there originally). We have a long history together; she raised me and has practically paid for everything that I do as a single parent. I've never had a job before because ""school comes first,"" and seeing as I am applying to a masters program, I have no money to do so. She has given me a 24k budget for tuition, housing, food, travel, etc for an entire year total. Which, in retrospect I should be grateful for (and I am... incredibly). But at what cost? I never noticed it until I left for college, but our relationship is very toxic and at times she can be very emotionally and verbally abusive when she doesn't get her way. I feel like she always holds the fact that she is funding me over my head, and that nothing I ever do will be good enough unless it's exactly how she wants. (Here is 1 of the many examples) I have a very estranged relationship with my mom, but in an effort to mend things, I invited her to my senior dance performance, my grandma thought I was paying more attention to my mom and spending more time with her, so she called my dad behind my back and told him some elaborate story, which made him call me and biitch me out that I ""hurt her feelings."" Which I can acknowledge is true, but was was completely unintentional. Thus, then I tried to rekindle things with my mother, again in college (by inviting her to my graduation as a first gen student) I was shut down and told that it would be a bad idea because my grandma would throw a fit behind closed doors, and it would only just stress me out on a day that's supposed to be about me. But as I graduated, I realized that I HATED my degree and wanted to get a masters in something different. Seeing as I have no money and live at home with her, I would either need to take out a loan or have her pay. Only, she now wants me to stay in Greece with her and attend a more expensive program, because it would be better and more convenient for her if I stay near by. Two of the top programs I want are in Barcelona and cost less tuition than the American school in Greece. We had a HUGE blow up fight about it and now everytime I see her I get practically enraged for seemingly no reasons, or for small things that I wouldn't normally get worked up about. Like recently, she broke her arm and she needed help and when I didn't clean the litter box exactly when she wanted me to, it became a huge thing because she needs help. to be fair, I have been helping her but at my own time. It's just so infuriatinig to have to/want to help someone who never respects my boundaries, makes fun of my mental health issues, comments on my body size and appreasnce, and keeps me around to use as someone to control. I once told her that the second I got the chance, I would leave and I meant it. I could tell it hurt her feelings, and I feel bad but at the same time I just don't want to have anything to do with her, even though I am living off of the funds she gives me.",AmItheAsshole
AITA for telling my best friends ex fling that she’s talking to his best friend?,"Throwaway. I (21f) and my bestfriend (22f) have been friends since our freshman year of highschool. I later made more friends that were added into our group. During our sophomore year, we met these 2 guys that went to a neighboring high school. They were both in the grade above us. She ended up talking to one of the guys (We’ll call him Johnathan) and I ended up talking to the other, Johnathan’s best friend, (we’ll call him Connor). Since they went to a different high school, and both mine and my best friends parents were strict, we were on and off talking to them.

 Although, throughout the years, Johnathan stayed in love with my best friend. She liked him back but not in the same way. Whenever we would get chances to hang out with them once in a blue moon, they would rekindle their little fling and as would Connor and I. Connor and I were never as serious as my friend and Johnathan. Johnathan ended up staying in our friend circle but Connor drifted off.

Fast forward to now, I go to college abroad and haven’t talked to Connor since high school, however, we somehow got in contact and started talking again. Talking about living together once i come back to the states. It was never that serious though.

I came to visit for spring break and saw him a few times and things were cutesy and flirty between us. However, once i left. They all had a big falling out with Johnathan. Apparently, he was shit talking everybody idk. I wasn’t there. I know i should take the side of my friends and cut Johnathan off, but my brain couldn’t really process everything i guess. Terrible excuse on my part. Connor ended up joining the friend group and distanced himself a bit from Johnathan too. 

Connor stopped talking to me and I noticed him and a few friends (including my best friend) were getting weirdly close, to the point i could tell something was going on. I’m a very understanding person and I would never intentionally put a man over my friends. If a friend wanted to talk to an ex fling, go for it. Just don’t hide it from me. Well, I found out that my best friend and Connor had started talking and sneaking around behind my back. Everybody in the circle knew, but nobody told me. Finally, she told me. I was hurt to say the least. Mainly because she kept it a secret from me for a couple weeks. I would have never done that to her. That’s girl code. I was pissed enough to text Johnathan and tell him everything. 
 1/2
",AmItheAsshole
AITA for not wanting a relationship with my “sister”? ,"For context: I am a caretaker for an elderly woman and my brother in law and boyfriend do property work on her husband’s property. Now I wouldn’t say it’s been perfect but it’s been okay. Now the issues didn’t start until their “daughter” moved in after she lost her apartment which she shared with her fiancé (the reason why they lost it is because they both kept quiting their jobs after only been there for 3-4 weeks, basically enough to get one check and then stopped going in atleast from what I heard from her on video chat and the stuff her mom has vented to me about.) 
Anyway, she moved in with us and she hasn’t done much of anything, she complains and uses her mild case of back issues as a reason she can’t pick up something that weighs 10-15lbs. (I have two rods and 18 screws in my back and her own parents say I do more than she does). Now we (my brother in law and boyfriend) has already told her parents that she makes them very uncomfortable and does thing that either piss them off (her attitude or the way she speaks to people or the fact that she will ask them to do tasks that she can do example: she asked one of the boys to get her a water bottle! That was 20ft away!!) so in the last month I have told her mother I am done and don’t consider her “family” like I do her and her husband but she (the mother) tells me that her daughter needs me because “everything you tell her she tells her councilor” 🤨🤔 and I brought up the fact that she could be twisting my words and make herself to be the victim (which she does very often example: she asked someone to help her carry a tote box to a shed, the tote box weighed five to ten pounds and when the person said “you asked me for help with this? (Drops item) you can carry that.” (Walks off) and the daughter runs to her mother and father  saying “she screamed at me do something before I snap!” (Now mind you we all saw the situation and the person she asked to help her didn’t yell or anything but literally just talked to her) 
But anyway back to the main point, I told her mother I do not like her attitude, I don’t like how she think she runs each household on this property like she’s paying any bills or doing anything for anyone, BUT helping the dude she’s flirting with, oh yes! She’s engaged telling everyone she and her fiancé (from above) is getting married at the end of the year blah blah blah BUT is up another guys ass! And when I mean up his ass, this women follows this man around like a dog! Everywhere he is, she is. AND EVERYONE SEES IT! BUT NOBODY SAYS ANYTHING! 
But when I tell her mother like hey if she expects me to be her “sister” then she needs to come spend time with me too! Her mother confronts her and all she says is “I’m trying to divide my time between everyone” 🤨🤔 everyone looked at her mother when she said that. We all mutual said “how is she spending time with “her sister” when she’s always over there? (The guy she’s flirting with is living on our property along with his family) 
 ",AmItheAsshole
AITA for telling my wife I don't like my wedding bands ,"15 years ago, in total spur of the moment, my partner asked me to marry her. A month or so later, she asked again, on bended knee and with a ring. I said yes (obviously) and proceeded to hint at the style of rings that I liked. I circled rings in magazines and conveniently left them around the house or gushed over rings I'd see on TV etc.  The one thing I had asked or hinted at while we were dating was no diamond rings.  I would prefer a Sapphire. 
Christmas Eve 2008, on a starry she asked. To my utter surprise, it was NOT the style I expected. Mind you, it's beautiful, with a Sapphire center, with diamonds and sapphires encircling the band, gorgeous. 
 However, I'm a really simple girl, and the ring is way more flashy with thick bands and large stones. Opposite my style and personality.  

I didn't have the heart to tell her at the time I didn't like it and have chosen to wear it for the past 15 years. 
In the past few years,  I've made comments to change my wedding bands into more of a style. better suited to me. 
I've explained it doesn't really suit my style, and if I'm the one wearing it, it should be what I like. 
When I mention it to her, she gets defensive and assumes I'm criticizing her and being ungrateful, and we end up having an argument and I drop it. 

I don't want to hurt her feelings. I also don't want to wear these anymore. 

AND

I don't want to be an asshole. ",AmItheAsshole
AITA for not appreciating camping gear as a graduation gift?,"For context, I have always hated camping. Since I was a child this was a well documented fact and routinely the butt of family jokes. On the other hand, my mother loves to go camping/hiking/backpacking and has trips planned almost every other weekend until September. 

She’s recently expressed that she wants camping to be something that we do together after I graduate from college in a week or so. Last summer, we went on a camping trip with extended family in which I borrowed a sleeping bag and mentioned that it was comfy. When asked if I would want one in case of future trips, I said that I by no means needed one but would be happy to have one if it went on sale or something to that effect.

What started as a sleeping bag has now become that, a blow-up mattress, a tent, a backpack including poop shovels, and various other things. Not only do I have now a bunch of camping gear but more recently I have received the news that this gear is in fact my graduation gift. 

I’m not saying I don’t appreciate the sentiment nor that I don’t acknowledge the money that went in to getting those things, but every time my mother brings it up I can’t help but wish she had thought of something else. Not only does she know I don’t care for camping but as my mother who I am close with I feel overlooked and misjudged on the things I actually like. I’m graduating from film school and have always especially adored photography. When I was asked a while back if I had any ideas for graduation gifts, my first answer was a camera as I have never had one of my own. This is the only thing that I have consistently wanted (and expressed wanting) for several years.

Now my best friend has mentioned that their parents, who historically don’t gift well at all and aren’t the greatest in general, are giving her the camera which I have wanted for years. My mother knows this, and when I heard I expressed doubly that I would love to have something along those lines. I am the first in my family to have achieved a degree, and while I wasn’t even expecting any graduation gift in the first place, I do feel like the one that I’m being given is not one that is really for me - rather, it is something which my mom got for me so that she could guilt me into staying at home longer in order to camp with her as opposed to moving away for work. 

Even then, those camping trips that I mentioned? The ones that she has planned through the next year? I’m not going on any of them. Instead, my mom has decided that I have PROMISED her (never did anything of the sort) that I will stay home for the year so that I can watch the house and pets while she goes off and does her soul searching. I’ve been told that to get a job and move away before they are done is inconveniencing her and causing her stress, so if I want to stay in her good graces I need to be her house sitter and wait to actually get a job until it’s convenient for her. 

AITA for being upset about this?  ",AmItheAsshole
Update: AITAH for not supporting my sister’s engagement?,"https://www.reddit.com/r/AmItheAsshole/s/4htqqV9Guo

Thank you all for the advice in the comments of my original post! I’m sorry for taking so long to post an update for you! Btw the sister is NOT pregnant! 

I spoke with my sister on Tuesday of this past week and it was not a very positive conversation. I was still extremely hurt and she was angry with me for ruining her excitement. I ended that conversation by telling her that at the end of the day, she would have to make her choice on wether they would go through with this engagement and wedding or wait until after my wedding based on what felt most right to her. She left me on read and I didn’t reach back out because I felt like the ball was in her court. 

Last night she reached out to me and apologized for hurting my feelings. She said that she doesn’t want things to be bad between us over this. She then started asking me more questions about how I felt. After some more explanation I asked her if she had talked to her boyfriend about our phone call. She said that she did and when I asked how it went she said that he told her she needed to reach out to me and try to make things right. She said it took her awhile to reach out because she was still trying to process her emotions but ultimately she knew he was right. 

I asked her what they decided to do and she said that after several days of talking it over they have decided to postpone the proposal until after my wedding in September. She said that their new plan is to get engaged soon after my wedding and plan their wedding for early 2025. They have not said anything to our family about the engagement and my family has been blissfully unaware of the state of my sister and I’s relationship. 

I guess you could say that this is the best case scenario for this situation. There is still quite a bit of tension between my sister and I but hopefully that will get better with time. ",AmItheAsshole
WIBTA for no longer doing the bare minimum at home? ,"I (20sF) live with my best friend (20sM). I'm a student and usually only scheduled to work about 8 hours a week, however, that's because I'm basically on call every day. He works full time. 
Most of the time, with him finishing at midnight, I tend to do most of House work. I clean the kitchen, the bathroom, I buy or cook food, and make sure the fridge is stocked for when he gets home, and when he gets home, I often massage him. When I notice that his bed sheets havent been changed, or his dirty clothes are piling up, I stick em in the wash and make sure he has fresh sheets. All I ask in return is that he cleans the dishes when we eat food. 

We recently got into a fight, with him saying HE does most of the cleaning and that I'm basically useless. Sure, occasionally when I'm depressed, I don't do as much, but I always show him my gratitude and appreciation when he picks up the slack. He very rarely thanks me for everything I do for him. 

So WIBTA if I stop being his maid and only cleaning up after myself? I hate the thought of it just coz I know the house will become filthy but I'm already so overwhelmed by everything. ",AmItheAsshole
AITA for asking my friend  for the money for a thing of mine that he broke?,"I (32 M) was in a road trip with some friends. My friend ""G."" (29 M) was arranging the luggage in the trunk of the car with some help from the rest of us, we were bringing the stuff to the car basically and he was getting everything inside.

He then closed the truck and we all heard something broke. It turns out it was the buckle of the waist belt from my backpack.
This feature was one of the reasons I bought the specific backpack. Since it's very useful and even necessary while hiking.

G. then proceeded to say a not very convincing ""sorry"". I said I understood it was am accident and we went on with the trip.
I was honestly expecting that he would offer me to fix it / pay for it (only the buckle) but it never happened. 

A few days latter I bought the replacement in Amazon, it was quite cheap, just 7€. I then put this expense in an app we were using to track expenses and debts yo each other.

G. got a little mad about it and said hopefully I never brake anything of his by accident. In the end he refused to pay for it and that was it.

This was not really about the money but about the attitude. I was raised to make myself responsible for things I brakeI, even if by accident and I thought this was common sense.

In the end I did not press further because the friendship is more imprtant to me but I still think about it sometimes.

So AITA for asking for the money for something my friend broke by accident?",AmItheAsshole
AITA Telling kid she cant go to Prom because she got drunk and lied.,"Hi,

Trying to figure out how best to deal with a situation and think I need some outside opinions. **Would I be the AH if I told she cant go to prom as a consequence of these decisions?**

Back story, 16 year old sister in law who lives with us due to irreconcilable differences with parents got drunk in a public place and blacked out at her friends house later.  Friend called us in a panic and we had her taken to the hospital where her BAC was dangerously high.  This is not the first time this has happened.  She is in weekly therapy.

My wife and I are at our wits end with her.  She is combative with us any time we fuss at her for doing things she isn't supposed to do.  She has brought weed vapes into the house (I have three of my own kids and I don't want them around that).  She brought Oxy into the home once.  She is dis-respectful to us.  She lies to us all the time.  Argues every time she doesn't get her way.  Again this is not the first time with drinking.  First time it was at a friends house, the mom of all people gave it to her.  Second time was at a school football game where my son is in the marching band.  Third time was on the BUS ride to school.  Blacked out in the hall way.  This time was at a different friends house.  Obviously we cut off contact with these people that enable her.  She always finds new people.  Her therapist tells us we need to give her some freedoms as a sign of trust but ever time we give just a little bit she does things like this.

Now really looking for advice to deal with all of it, its not yall's job, but any advice would be considered.  In any case would I be the AH if we denied her prom this year as a consequence of the bad decisions?",AmItheAsshole
AITA for cancelling the home internet since the roommates don’t want to pay their share?,I hardly ever used the internet since I only go to the house to sleep. Every month it was some lame excuse why they couldn’t pay. Finally had enough &amp; cancelled the service. Now they’re all complaining that internet is a basic need &amp; they can’t do anything without it. They had their chance. I only wanted $10 each month from each roommate.,AmItheAsshole
AITA didn’t tell mum about my wedding,"Throwaway for privacy.

I (22F) got married to Matt (22M) last weekend. We met in university, same course, and we’ve been inseparable ever since. He’s my best friend and the best partner one could ask for. We both live with my parents or rather they live with us since my dad got an opportunity for work in our city and they have not been able to rent somewhere yet. Matt’s family are quite well off so bought him a big 3 bed flat in our city when he started university which I moved into when we got serious and now my parents moved into the spare room which we used as a workout space. 

When I was a kid, my parents seemed largely disinterested in me. Over time, I stopped telling them about my life hoping they’d become invested as I grew up but it never really happened and our relationship was what it was. I guess I’ve carried that sentiment into adulthood too - they don’t know anything more than my job title and that I’m in a serious relationship. They’ve never once offered to take us to dinner or try get to know Matt which I don’t expect them too but it would be nice.

When it came to the wedding weekend, we invited our friends and my older siblings (I have 2 older sisters) and Matt’s family. I’m very close to them, basically a daughter they never had. I get invited to their family trips all the time and I’m in their groupchat. It was only an intimate wedding, Matt’s parents hosted the ceremony and we all went out after for dinner and drinks to celebrate. Both of us didn’t want anything too extravagant and were more than happy with this. We had dinner at the restaurant we dined at for our 1 year anniversary. We told my parents that the flat was theirs for the weekend because we were going out to eat and celebrate with friends and staying in a hotel. I did not mention our wedding at all. I wanted them to ask more if they wanted to but they didn’t. 

Come today, I put up a framed photo of everyone in our wedding attire on the wall in the living room along with some other photos. My parents saw, asked and flipped and told me I should have said something. I wasn’t in the mood and told them they never asked. My mum told me I should have said something and they would have come but I just repeated myself and walked away. I’m now getting texts from my older sisters that Mum is really upset she missed out watching me get married and I should apologise. Am I really an asshole for this?",AmItheAsshole
