title,post,source
AITA for not wanting to listen to my friend's troubles all the time?,"One of my besties has a lot of issues (so do I tbh). She decided about three months ago to date a red flag parade. So did I. I dumped mine like three weeks ago. 
Well, she's still with hers. And unlike me and my ex, they're not official. Let's call her new dude...Richard (cause he's a real Dick).

 Well, Richard made his stance very clear this weekend to everyone, by shouting it drunkenly at her; ""I'M NOT YOUR BOYFRIEND!"" 
Now, I have to note that Richard is a jobless bum who lives at my besties house rent free. He cooks, cleans, buys food and takes care of her pet, but that's the minimum for crashing there, no?
She took him back last night, after he got into a fight and humiliated her in public. Yes, he was very drunk. But c'mon. She also didn't give him the ulitmatums she said she would. 

I told her I never wanna hang out with him again. I also told her that I wish her good luck but no longer will listen to her crying. And I mean it. I've said everything I had to say on the topic. 

Should I still support her and listen to her troubles? I want to be a genuinely good friend to her. But I'm also so annoyed. She's being effin stupid. But she's an adult and she said I should respect her decision. And I want to but I also don't wanna listen for hours and hours about this guy. We all told her. I feel like a Richard just typing this. AITA?",AmItheAsshole
AITA for pushing financial literacy on a friend after she called me cheap?,"I’ve (F 28) had a friend since college. I am a high earner in a HCOL city. She is in the same city and makes around half of what I make. We both grew up middle class but as the relatively poor kids at schools where the rich sent their kids. Ever since I moved to her city she has called me cheap, because I do things like make us bus instead of Uber and say no to buying drinks at clubs. Other than that, she has been a great friend.

She was unemployed a few months between jobs and I noticed her relationship with money start shifting. She started wanting men to give her a “princess treatment” and on LNY she spent her red envelopes on clothes as soon as she got them. At the time I did say it would be financially wiser to save them. She was embarrassed to have to start financially depending on her parents again. She normally is super independent.

Things came to a head for her birthday. A few weeks before she texted me asking for a gift that’s over $100. It’s from a brand that’s very hyped but poor quality (both of us have bought things from them before), and the item isn’t on sale. I thought this was delusional and said nothing. A week later she asked for something else that was $85, and since Sephora was about to have its insider sale and I forgot her gift last year I bought it feeling like it was a good purchase.

We met up for a free corporate lunch days before her birthday as we’d be in different cities the actual day. She said every time I do/say something cheap it makes her hate me a little.

When we got back, to celebrate a new job, she started doing a few things I was concerned was living beyond her means, like buying expensive clothes and ordering delivery (normally fine, but after a few months of unemployment seemed like a lot). After years of being called cheap, I called her spending financially unwise and asked if was still able to return what she had bought.

It escalated today when she sent me a book with a titled, “Why We Hate Cheap Things.” I wrote back “At least my ability to retire won’t be dependent on me marrying a rich man.” She wrote back she’s her own sugar daddy and I was putting her down. To her credit, before she was unemployed she was super independent.

I decided to be thoughtful about it and explain I don’t mean to put her down, but I am concerned about her financial literacy. I explained to her I know we do things differently. I invest or save half of what I make, and offered to share with her some resources that helped me gain financial literacy to take money being fun to a tool. I know she makes less than me, but all income levels can benefit from having more financial literacy.

She wrote back saying I was judging her lifestyle and she rather live in the moment because the future is not guaranteed. She pointed out health is more important than money, which she has a point, I’ve skipped Drs appointments I could afford because they are $500 an appointment with insurance. That said now she is angry at my judginess. AITA?",AmItheAsshole
AITA for only visiting my in laws for a week this year?,"My MIL is only 60 but has a lot of health issues and hasn't traveled since June 2018. So the only time my kids see that set of grandparents is in the summer. We're taking our first family vacation in five years this summer, so we're only flying for a week to my in laws and then a week to my parents. I understand that this is disappointing for everybody, but especially my in laws because they don't get to visit us during the school year due to not traveling. They asked my husband if he could leave the kids with them longer, but he said no and said they could visit him. I feel very guilty.",AmItheAsshole
AITA for not wanting to invite my mom's boyfriend to her mother's day dinner?,"Myself (19F) and my 4 siblings have a difference of opinion about inviting our mom's boyfriend to her mother's day dinner.

Yesterday, my mom messaged on our family group chat to ask if we would invite her boyfriend to her mother's day dinner. Every year for about the last 5 years we've taken her out for a meal on mother's day. She separated from our dad in 2015 and she raised us on her own since then.

She's been with her boyfriend for a little over 3 years but they still don't live together full-time. He stays at our house on the days he doesn't have his 3 kids. Obviously, on mother's day his kids will be with their mom and his own mother has passed away. My mom thinks it would be nice to invite him this year as we haven't in the past. 

3 of my siblings (20M, 17F, &amp; 15M) agree about wanting to invite him. Myself and my oldest brother (22M) don't want him to come. Our argument is that it's supposed to be a special evening for us to celebrate our amazing mother. I like our mom's boyfriend and have nothing against him, but is it wrong for me to think it'll be nice to have some 5 on 1 time to celebrate our mom.

My 20M brother feels quite strongly about inviting him. His argument is that he's basically apart of our family now and it feels right to invite him. He'll probably bet at our mom's all weekend so we would just be leaving him at home alone to go out for dinner. He also tried to guilt trip me into agreeing to the invite by bringing up that our mom's boyfriend's mom died when he was 12. He feels it's wrong to leave him alone on mother's day for this reason.

Another point I've brought up is that on father's day last year none of my siblings were included in the boyfriend's outing with his kids, despite the fact our dad's not involved in our lives. I didn't care about it then and I only bring it up now to compare the similar circumstances.

I think my siblings and I's differing opinions comes down to closeness. My 2 brothers (20M and 14M) are particularly close with the boyfriend whereas the rest of us are still less so.

Am I being the asshole? Or should I change my mind? ",AmItheAsshole
WIBTA if I refuse my friend's request? ,"Hey everyone! 

I (21M) have the following friends which are relevant to the story- Sarah (21F), Jake (20M), Adrian (20M), and Stella (20F). Some background, Sarah and Jake have been in a relationship from late 2022; Adrian and Stella have been on-and-off since around May last year (9 breakups and getting back together 10 times). I have known Stella since the start of our time in our university, then I got to know Adrian through mutuals, and I've known Sarah and Jake closely for the past year. 

For some context, Sarah and Jake are good academically (both having 2 tech internships under their belt), as well as being quite fun, as we've been on trips, and have partied together. This has made me develop a close bond with both of them, both socially, and academically, even though we've known each other closely only for a year. 

On the other hand, Stella is someone who needs constant emotional support and we've been there for each other whenever the other has needed it. Adrian was someone whom I considered very close till the last year, but his regular breakups with Stella, and his tendency to drag me between their issues, as well as constant lashing out and emotional outbursts over several of his breakups on me has made me a bit distant. As of now, I consider all four equally close to me.

So now coming onto the main issue. Sarah and Stella were put in the same dorm/room this time around and things have been going okayish between them. Adrian and Jack chose to take a dorm/room together, despite Adrian knowing that his interests and habits don't align well with Jack, and me warning him of the same. Slowly, they started bickering over nothing which usually turned into huge arguments, and Jack came back at Adrian with ""yo mama"" jokes which made him lose his temper multiple times. 

With time, issues between Adrian, and Jack and Sarah rose till the point they were all fed up with each other, and Jack and Adrian trying to remain civil as roommates. Adrian and Stella had another patchup-breakup cycle and they got back together again recently.  Stella also has some problems with Jack and Sarah but they're not as apparent, or major. 

Recently, Adrian has told me (and Stella), that he won't take it well, and stop talking to us if we were to hang out with Jack and Sarah. I told him that it's unfair, as they are also my good friends. I ensured him that I can make it work such that I can hang out with Sarah and Jack, as well as Stella and him in a way that they won't have to hang out with each other. He claims that he knows he's unfair, and he wouldn't have done it usually but he's just too annoyed to deal with them, and it'll effect our friendship if I were to hang out with them.

I understand their might be deeper issues than I know of, but Adrian has been cutting off people over small things recently since his last breakup with Stella, and I don't want to choose one over the other as all of them are important to me.

So, WIBTA if I refused Adrian? ",AmItheAsshole
AITA? Planned a weekend away for my husband…,"Husband is turning 31, and I last minute planned a weekend trip for him, myself and our two little girls (2) and (1) to a farm stay. 
Initially we spoke about planning a ‘adult’ weekend where we leave the kids with the grandparents and have a weekend to just chill out. Or, try and round up our friends to go out for a drink in the city however, that is harder nowadays as we all have young children.
Anyway, I didn’t get around to asking grandparents to baby sit and I thought a cute family trip would be a nice way to celebrate. I found a really nice farm stay with lots of activities to do.

When I told my husband I had planned that, he seemed disappointed. 
He said yeh, sounds fun for the kids…implying that it isn’t really for his birthday.
I feel down because he doesn’t seem excited by it, but I also feel annoyed because I still feel like it is a nice way to spend a birthday….
I feel like addressing it with him, but it will lead to an argument…am I an asshole or is he being a sook about it? 
Should I bring it up or just push forward and make the most of the weekend with our little family and hope he makes light of it at the end. 

——&gt; update
Overwhelmed with responses that IATA. I see it now, and I will be more attentive and approach this differently for next time. 
Thanks to those who saw this in the lens that my intentions were good. 
To those saying I should have just call up the help, there’s such thing as hyper independence that I struggle with, something I need to learn to work through. 
",AmItheAsshole
AITA for not wanting to add my dad’s fiance to our Facebook group announcing pregnancy? ,"My husband (23M) and I (23F) found out we are expecting and recently announced it to all of our family and close friends. (Just a side note, when we called and told my own father [56M] had the worst most unenthusiastic reaction of literally everyone we called to tell the news. I.e we spent 30 minutes on the phone, and less than 2 were talking about us or the baby- the other 28 were talking about my dad’s cow farm and work.)
We decided to make a private Facebook group to add all of these said people to in order for us to have a more private way of sharing updates with a larger crowd. My husband and I did not immediately add my dad’s fiance, C, (60F) to the group bc neither of us are crazy about her and she has treated me like crap in the past. 

A bit of background, C and my dad started dating 1 month after my mom passed away when I was in high school. They were engaged less than 3 months after my mom’s passing, and prior to my dad ever even introducing her to my brother and I. She then would come over every weekend and practically every holiday and act like she was the queen of the house and whatever she said went. For the most part, my dad still enables that despite how my brother (17M) or I feel about her. 

Anyway, after my dads reaction (or lack thereof) to his first grandchild, in conjunction with the fact we aren’t keen on having C involved in our child’s life based on how she’s treated me in the past, we didn’t send her an invite to the group immediately. Plus, I was sending out invites as I scrolled across peoples names on my friend list. 

My dad then sent me a text 2 days later angry asking why or if I didn’t invite C to the baby page. It ruined the rest of my day as I stressed about whether or not to invite her and I broke down and did it anyway. He has done this on several other occasions, (our wedding, my HS grad, etc) basically guilting me into including C. in everything despite how much I don’t like her, bc I cannot seem to want to completely cut off my relationship with my dad. He has always created these situations where he is allowed to be mad that we don’t include her, but we cannot be angry or show any emotion contrary to liking her.

AITA?

TLDR: I didn’t invite my dad’s fiance to our pregnancy announcement group right away and my dad sent me an angry guilting text to get me to add her to the group anyway, despite my bad history with her; and both my husband and I not wanting her involved with our children. ",AmItheAsshole
AITA for asking my boyfriends not to post pictures of organs from his hunts?,"I was not exposed much to the hunting community prior to meeting my boyfriend so I’m not sure if this is an unreasonable ask. I have no issue with him hunting because he does it ethically, and for the purpose of eating. I personally won’t join him in hunting, because I’m a huge animal lover and feel uncomfortable with the idea of killing the animal myself. But I will eat what he catches.   The only thing that I am not a fan of when it comes to hunting is seeing the insides of the animals he hunts. He likes to post pictures to his social media of the animal and sometimes mid harvesting. It makes me really uncomfortable seeing the blood and organs of a dead animal. I’ve asked him either remove the organ pictures or make a separate instagram specifically for hunting. He says that he doesn’t want to hide who he is and that’s what my ask feels like. There’s one picture that particularly gets to me, and I really would prefer him not to have on his page. Two years ago, on Valentines Day, he posted a picture holding a mountain goat heart. It makes me feel weird to see that on a day that love is suppose to be celebrated, he posted a picture of a heart from a kill. He explained that it was just a dark humor joke, and didn’t think too deeply into it. I get that, but the reasoning does make me think differently about feeling uneasy by the post. Idk maybe it scares me a little bit? Please, I’d love to hear other perspectives and opinions. Is asking him to not post any organ pictures overstepping and hiding who he is? I feel like the separate instagram is a reasonable ask. Thoughts on the heart picture? Am I’m overreacting to this all?",AmItheAsshole
"AITA for calling my brothers girlfriend ridiculous when she said my brother painting my nails was ""creepy""?","I (33F) met my brother (30M)'s girlfriend (29F) at a family dinner last night, they've been dating for six months and now things are getting slightly more serious he wanted her to meet me and our parents. Things were going well and we were all having a nice time, after dinner when we were all having drinks my brother told me my nails were driving him nuts and jokingly asked me if i'd  painted them blindfolded. Now I felt i'd done a good job with them but I have shaky hands and of the two of us he's always been better at painting nails as he was a goth in Highschool. 

He stated he couldn't take staring at them and went to our parent room to raid our Mums makeup. Then at the dining table he removed my polish and began to paint them afresh, this is nothing new to our family and basically summed up our teenage years. Our parents laughed and joked about it and all the times we'd gotten nail polish on various tables. My Brothers girlfriend seemed uncomfortable and was quiet and just drinking her wine, I asked her if she was ok and she mumbled she was fine but as my brother kept painting my nails she seemed more and more uncomfortable. He picked up on it and checked if she was ok pausing in painting my nails.

His girlfriend then shrugged and said it was just odd to her and honestly seemed creepy to her, as it was just so strange. This had us all a bit baffled and we laughed a little uncomfortably unsure what to say about this, she seemed to get upset by this though and and stressed it was creepy and normal families aren't like this. I got a touch annoyed at this and told her she was being ridiculous and there is nothing at all creepy about painting nails.

The mood dipped a lot after this and she asked my brother to take her home, he complied but clearly wasn't happy. In hindsight i'm worried maybe I took it too far calling her ridiculous, I just didn't like her calling what was a bonding moment for me and my brother in our youth ""creepy"" but I perhaps should have read into her thinking it's not normal for families to be like this, perhaps her home life wasn't as nice as ours growing up. I just worry I was too harsh considering it was our first meeting. Maybe I should reach out to her to try and apologise? I texted my brother today to see if things were ok on the drive home and he said it'd been mostly silent and she hasn't talked to him today and he's just honestly confused by her reaction.",AmItheAsshole
AITA for Scolding my husband,So I came home one day looking for some cleaning products and asked my husband where it was and he said “under the sink” as I go to look under the sink I found a toilet paper roll. As I reached out to grab it I noticed it was soaking wet. Confused I asked “the hell is this?” And he replied “oh I dropped it in the toilet and I’m going to dry it so I can use it still”. Of course I was disgusted and very upset so I scolded him telling him that “that’s just not done! Throw it away!” His father overheard our argument and asked him later what was wrong. My husband told his father what happened and how he was trying to save money by drying it out. His father agreed and said I shouldn’t have gotten so upset about him trying to save money. So I’m confused AM I THE ASSHOLE?,AmItheAsshole
WIBTA for not inviting my sister-in-law to My Son's Graduation Party?,"A little history... I do not have a relationship with my in-laws. 

When my husband and I started dating I tolerated their jokes (about my culture), jokes that is sometimes below the belt, their passive agressive comments, unsolicited/condescending advise, etc.

After our wedding, I started seeing a therapist as I had panick attacks whenever we are going to see my in-laws (couldn't breath panick attacks), I was also going to grief counseling as my mental health was taking a toll on me at that time... 

My therapist suggested to communicate to my husband what I was feeling towards his family. 

It did not go well. It took years of marriage counseling before my husband can understand where I am coming from, and REALLY respect my boundaries.

We decided and he laid out our boundaries to his family. I was no longer coming to family events at his hometown. The family events we are hosting, they are welcome to come unless they are uncomfortable and we respected it.

It did not go well with the inlaws. My sister in law will call her Marcie threatened that if I don't have a relationship with them, then I shall not have a relationship with her children.

Honestly, it is the bed I made, and I was happy to lay in it.

I told my husband I understood and I will not stop any of my inlaws to have a relationship with my children.

Through the years, my husband always invites his side of his family whenever we have an event at our house. My children's birthdays, and other occasions. My inlaws never come aside from my husband's mother, but rarely. 

For the record, I always encourage my husband to visit his parents/family. Mother's day, father's day, etc. I just don't feel comfortable around them but i don't want to be unfair to my husband and children.

Through the years, whenever my inlaws send their invitations or cards, it is only addressed to my husband. 

I just look it as... Well it is not like I am going anyways. So I did not really care. 

My son is graduating high school this year. I was doing the envelopes last weekend when my son made a comment. ""Why are you inviting Aunt Marcie? She's not coming anyways and she's drama, don't waste your postage"". 

I talked to my husband about it and he was surprised with my son's comment. When we talked about it with my son. He simply said, he does not care, if his Aunt will come or not. But, he rather not have a drama at his graduation party. If that's gonna be the case then he rather not have it.

I agreed with my son and decided not to invite my SIL. My husband said I would be an ahole if I don't invite his brother's wife.

I am not sure where my son is coming from as I have not seen my inlaws for about 15 years so I am not sure what they have become, and don't want to take a risk to humiliate my son in front of our family and friends.",AmItheAsshole
AITA for telling my friend to rest instead of hanging out with us,"So basically I have two friends one of them applied to a college that’s out of the city and I have not seen her for 6+ months, the other one is in the uni i attend to so we have seen each other ALOT , even without going to uni we meet in just regular hangouts, so the friend who is in a different city on Wednesday suggested that the three of us meet on last Saturday and I was so happy about it because I haven’t see her for ages and i immediately agreed but the other friend said that she wasn’t sure about it , next day which is Thursday i asked her on our private chat if she is coming she said “ I’m mentally exhausted “ so normally I told her “ oh shit man if you can’t come on Saturday it’s alright I won’t push it” and I said “ maybe your mood will be better on Saturday “ and she replied with “ If you wanted me to come you wouldn’t accept my no that fast “ AND IM A PERSON WHO STRUGGLES WITH MENTAL HEALTH PROBLEMS AND I WONT APPRECIATE SOMEONE FORCING ME TO DO SOMETHING I DONT WANT TO DO WHILE IM FEELING DOWN AND I DON’T PUSH ANYONE INTO ANYTHING THEY DONT WANT TO DO BACK!!! She also said “ I don’t think my mood will be better after what you said “ and also “ your reactions shows how much unwanted I am”! 

Did i do something wrong that I can’t seem to pick up on? We didn’t hang out on Saturday none of us met and I haven’t received a message from that one friend.",AmItheAsshole
AITA for asking my sister to knock before entering out shared room?,"Me and my younger sister live at home at my parents house in a shared space. I have recently become slightly insecure and wanted a bit more privacy. So I decided to ask my sister if she could knock before entering the room out of politeness. She was outraged by this and got very angry. She said that we were both girls and it didn't matter if I was changing and if I was worried about it to stay behind the door. Mind you the space behind our door is small barely enough room to move and she has stuff all over the floor there. We've had many fueds over our small shared space, she likes to read out loud and late into the night or listen to podcasts and I like to play on my phone or listen to asmr to sleep. She wants light, I want darkness, she wants to sleep in. I want to get up early. It's gotten to the point where we fued every night. As the eldest of 5 children in a 3 bedroom house I'm great full for the decent space and what privacy I do have but I've become rather frustrated over this privacy issue... am I really in the wrong for asking for more space?",AmItheAsshole
