title,post,source
[DC] Question on the Legitimacy of Civil Courts ,"As a lawyer do you agree with how a civil claim only needs preponderance of evidence in order to decide a claim and not hard evidence without a doubt?

To me it logically and morally doesn't make sense.  Yes the civil penalties are just monetary but they can still be significant and be fairly equivalent to imprisoning someone.  Can they not?

OJ Simpson was found not guilty in criminal court.  But then was found 'guilty' in civil court and was ordered to pay millions of dollars in damages.  So if he's not criminally guilty than what was OJ fundamentally charged with?  Is the crime that he was found 'probable to commit the murder'?  I think the difference between not guilty and innocent is irrelevant here.

In a more simple example

If person A punched person B 2 years ago and person B civililly sues person A and has a picture of a bruise and proves he was at the same location and it turns out that person A has a charge for domestic violence then will person A be found 'guilty' (civil) just because it might be true or could logically happen?  I don't get it.  Couldn't everyone just sue person A knowing they don't need any evidence?
",AskLawyers
[NY] Corporate Disclosure Agreement,"Hey everyone question,

If a defendant gets caught lying on a Corporate Disclosure Agreement and you bring this information to the court with proof will the court do anything? I know they should but what are the chances? And ethically will their attorney disclose this to the court in an admission that their client lied? Federal District court",AskLawyers
[CA] Possibly Fired for Asking for my Pay.,"So I have been waiting for my pay for almost a whole week after I was supposed to be paid. I have reached out multiple times to the proper people who handle my payroll. I have just been pushed to the side over and over, after constantly asking for them to reach out to the higher ups. After half a week I finally got a hold of one of the higher ups and have finally been told I am getting my pay. I come into work today and Instead of being let into the office they’re having me wait in the lobby for my boss who I had asked to reach out to the higher ups but was met with no response. It is a cannabis distribution and production company so things are still kinda shady due to unregulated laws and such. I however have signed a contract and everything but was denied a personal copy. Is this legal?? It can’t be, right?",AskLawyers
[KY] Epo dismissed. Two days later arrested for violation. How is this possible?,"[KY]

So my ex ended up filing a protective order against me after I found out she was pregnant but due to alot of lying and cheating I told her I didn't want to stay with her but would be there as a father. We'll she said she wouldn't let me in the kids life if I didn't want to be with her. I tell her I will take her to court if I had to. I leave she then files a restraining order and somehow gets it when there was no abuse whatsoever. We go in front of the judge and the judge told her straight up she had nothing. She then goes downstairs to the clerk and files an affidavit for violating epo and I get arrested two days later after it was dismissed. Is this legal and what can I do?",AskLawyers
[MO] Landlord says I can’t move in until a week after the move in date? ,Hi! Sorry this is a weird question. I live in Missouri and my partner and I are about to move into another apt. Our potential landlord says that the apt we are looking at (and all other places they own) won’t be available to move in until a week after the lease start date because of cleaning. There would be no rebate for the week we would not be able to stay there. The landlord owns about 75% of all places in town and really are the only ones who have availability in our price range and our current lease ends on the 31st. Is this legal? Is there anything we could do to essentially prevent being homeless for a week? ,AskLawyers
[NY] real estate tax question ,"Hello lawyers of reddit. My dad wants to gift my mom a property, its market value is around 800k, he has about 600k in equity. We live in NYC, how will he go about doing this? And is this a taxable event? If so how much should he expect to pay? Thank you all for your help.",AskLawyers
"[CA] - is there anything illegal about a bumper sticker that says ""I &lt;3 SHOOTING COPS""",tasteless sure but is it illegal? or is this fall under freedom of speech?,AskLawyers
[CA]collection agency,"My daughter and I went to Verizon about 10 years ago as that was my daughter’s carrier … she wanted to buy me a phone since I watched took care of my granddaughter and she wanted me to have a reliable phone as well as payment for taking care of my granddaughter and all her animals…. I don’t remember if I signed anything or not but I never received a bill or any letters or email from them …. Well, my daughter and granddaughter moved out this past December since she wanted her own place at 35 years old and teenage granddaughter… I told my daughter that I am changing phone carriers since I was no longer going to be doing any more with her animals or granddaughter… she said ok … well, on Feb 16 I received a collection agency letter from Verizon for 1,570 dollars that I owed them … I don’t understand if my phone was under my daughters account all these years and she pain the bill why I was receiving this…. I tried calling Verizon but it doesn’t show my account with them …. What should I do … why do I owe this when my daughter has me under her account and paid all these years ….. I’d appreciate any insight … don’t be too harsh …. I’m old … 🤗",AskLawyers
[TX] Buying an inherited property,"The owner of the property died. There is no surviving spouse. There is no will.
The house is in a bad shape and worth around $80-100 thousand. 
There are 2 brothers who want to sell and a sister who does not want to sell. 
They do not have money for lawyers. What would be the best scenario to buy this house from them?",AskLawyers
[PA] Rental Security deposit,"Hello,

After moving out of my previous apartment My landlord has sent the itemized list of deductions for security deposit. It seems to be bull for a few reasons:

1. A steamer came and cleaned carpet the week of move out. We have the invoice which we sent to him as well showing date of cleaning.
2. I lived at this location for 5 years so the extensive cleaning seems absurd and above the normal wear and tear.

Please take a look

* Carpet in bedroom not vacuumed or steam cleaned.                          $200
* Kitchen floor, fridge, shower &amp; range needed extensive cleaning       $200
* Bedroom wall damage                                                                         $25
* Accrued late rent, Aug. 21', Sept. 21', April 23'                                    $310

**TOTAL:                                                                                                            $735**Total Security Deposit:                                                                                    $700

My biggest thing is if they can withhold the late rent even if late fees were paid?",AskLawyers
[MS] I have a question about 3rd party contact. ,"I moved away from my bio-mom because she was being really abusive towards myself and my family. I got a restraining order against her and that includes no 3rd party contact. With her repeatedly calling the police on me for ""well checks"" and calling child services on me constantly for ""over-feeding my son."" Is that considered 3rd party contact? I have copies of the reports from the police. I also have copies of the findings from the cps investigations. ",AskLawyers
[MT] Is This Dental Malpractice?,"I originally sought dental treatment due to a severe infection lying between a tooth that had previously undergone a root canal procedure 5-6 years ago and a separate tooth that had not received such treatment. 

When I arrived for my first appointment, they trimmed down the side area of the root canal tooth and partially on the top of the other sore tooth (which I later found out, due to going to the hospital, may have had, or still has, an infected nerve). However, the dentist's focus on the treatment shifted, and they opted to solely address the previously treated tooth, not the pain I was experiencing in between the root canal-treated tooth and the opposite one, by placing a temporary crown without fully resolving the underlying infection issue. 

As a result, I continued to experience significant pain, the worst I've ever experienced, and discomfort, necessitating the use of antibiotics and prescription medication. I lay in bed for weeks in absolute agony, unable to do my job or make time for friends or family. Despite appointments being scheduled, the dentist consistently rescheduled me and did not address any ongoing pain, only proposing corrective action after an extended waiting period. 

However, this ""corrective action"" I waited for through several reschedulings was simply to trim down the gum along the already root canaled tooth and place the new permanent crown in. Once again, a procedure I didn't think was necessary, but was willing to undergo since I was fully under the impression that Medicaid would cover the full extent of the infection treatment. 

Furthermore, now I’m being told that there would be out-of-pocket payments for the corrective procedure I originally wanted (which would be treating the infection and the root canal on the actually sore tooth) due to me reaching the amount Medicaid will cover for dental. 

Additionally, I want to emphasize that I didn't want to be on the prescribed painkillers as they were opioids, and I had experienced addiction with them back when I was 16. I was in the worst pain of my life for a solid two weeks and had a total loss of enjoyment of life. I was told medicaid would cover what I needed to be done, but instead received a different treatment and now can’t get what needs to be done. Given these circumstances, I am curious if I even have a case, and if so, what kind of case I'd be looking into (e.g., malpractice, negligence, etc.).
",AskLawyers
[CT] Can my boss at a smokeshop have me do training for almost 2 weeks with no pay and then not give me the job?,,AskLawyers
[NJ] Can one party of a contract continually tempt the other party to violate said contract?,"I’m interested in a lawyers opinion on this. I do rideshare driving for both Lyft and Uber. We are under contract as independent contractors with these companies. Part of this contract is that we are not permitted to transport minors without being accompanied by an adult. This is not the law but simply a contract requirement. 

However, the issue is that they consistently send us rides where it’s only a minor, which means we have to cancel the ride and lose money.

The first question is, do these rideshare companies have any sort of legal obligation to take all measures necessary to reduce or eliminate these sort of requests?  Since my agreement is with the rideshare companies and NOT the customer, am I correct to assume that although technically the passenger has obtained an account under age, that the rideshare company allowed this to happen by failing to verify their identity?  

The second question is, after these companies send us these requests over and over, does that create an argument on the side of the driver that this particular part of the contract is unenforceable seeing that the company refuses to uphold their end?

TLDR:  Can party A in a contract say “you cannot do X” and then continually tempt party B to violate that provision?  Does party A have a responsibility to ensure they are not tempting party B to violate their contract?

Third question. Seeing that my contract is with Uber and Lyft and not the passenger, am I correct to assume that if I arrive to find only a minor that these companies have essentially waived that part of the contract?

Should I do other things like send certified letters informing them to cease and desist attempting to violate their own contract?",AskLawyers
[WV] Why is some evidence disallowed due to being “too punitive”?,"This is for anywhere really. Is that the whole point of evidence? If a fact or proof exists to the detriment (or benefit, I guess) of the defendant, why wouldn’t you want it admitted?",AskLawyers
[FL] car repossessions ," I’m not sure if I’m in the right sub for this but I’m desperate. Last year I financed a car through Carvana I had pip insurance which covers nothing, apparently since I financed the car I had gap coverage. Fast forward to February my car went through a puddle after a storm and it totaled the car. My insurance wouldn’t even go to declare it a total loss wouldn’t touch it so I had to get the gap coverage insurance to go out and declare it a total loss. They sent the finance company a check for $4000. I still owe $10k on the car. I called the finance company because it’s still their car I can’t get the title to scrap it. Today I’m told my car is repossession even though I’ve never had one late payment and I’m still current on all payments, not only that I was told that I’m responsible for all auction fees and that the repossession it’s going on my credit report. Can someone please help me with this my car was in a puddle and now all this is happening thank you for reading if you’ve made it this far. ",AskLawyers
[NY] Exactly how illegal would it be to fly a drone in NYC? Is the airspace protected?,,AskLawyers
[TX] apartment complex neglect has caused us to live in hazardous conditions,"My unit's upstairs shower was causing a leak to occur above my kitchen light a year ago. The complex management sent maintenance over who just patched a pipe and put wood to block the hole. All was said and done.


I was cleaning my shower the other day, and a tile on in the bottom corner falls off, exposing a hole. No wall, no wood, just tile and hole. I alerted the complex management and they sent maintenance out a few days later. 


Maintenance comes by to investigate. They pull another tile off and scope out the former leak area in the kitchen. They decide it's a foundation/structural issue and they needed to call in a professional. 


Pros came today and showed me (about 20 minutes ago) where THE ENTIRE BATHROOM FLOOR IS BREAKING INTO THE KITCHEN. 


This is crazy liability and I'm genuinely afraid of being inside right now. 


Do I have the right to move units, free of charge? Side note, I'm in the process of switching units anyway (haven't signed the contract yet) but it's not scheduled until the 10th. 


As I'm typing this, they just told me how much mold we've been breathing in this entire time. 


What's my best move here? I feel like they've endangered my entire family's life and expect me to continue in these living conditions.


Should I stay in this unit any longer or get a hotel? I don't really have money for a room atm but fuck I don't like being in here. I have young child that I am TERRIFIED could have side effects from the mold we've been breathing in for YEARS.

 No one ever came back after the first call until I told them about the newer issue. 


I'm sorry if this post is all over the place. I'm livid and so concerned for our health. It's hard to think straight after being told there's a chance we all 3 could have cancer by now. ",AskLawyers
[PA] SA,"Hi so here's a preface me and a girl were in a very toxic relationship, we ended recently and she claims I SA'd her. And she has reported it to my job. However we called and I got her to admit to exaggerating as well as admitting to genuinely sexually assaulting me, I have recordings but I live in PA. I sent the recordings to my job, however I want people to know what she did without me getting in trouble for recording. What should I do? I considered meeting up in person with her school and playing the videos and just deleting them immediately and making everybody else delete them but I really need help!",AskLawyers
[CA] Is this legal? Sovereign citizen starts a “law firm”. ,"https://www.williamsandwilliamslawfirm.com/

Brandon Joe Williams has started his own “law firm” and basically offers services to “help” sovereign citizens with their bat shit crazy litigations. Is this legal? Anywhere he can be reported? 

Services offered: Mergers and acquisitions, letters on behalf your behalf to employer to eliminate taxation, “infinite money” (apparently in the works, debt/ tax discharge, etc.

https://www.williamsandwilliamslawfirm.com/services

Description of what they do:
“We operate as attorneys-in-fact through the Power of Attorney Act located at the Federal level and in each State. Due to the way that the laws are set up, we cannot file on your behalf and present on your behalf. So the way it works is we help you write everything and we help you present yourself. This is the only way we can pull this off. WE ARE VERY CLEAR AND TRANSPARENT ABOUT OUR INVOLVEMENT IN THE CASE (we will come to teleconferences, etc, as needed. We just can’t file on your behalf and run the whole show for you, legally).”

https://www.williamsandwilliamslawfirm.com/how-litigation-works",AskLawyers
[IN] - EX husband doesn't want to pay for anymore of minor child's medical expenses,"My 16 year old son had shoulder surgery last year and has had a lot of pain and issues since including basically the lose of use of his dominant hand.  Figuring out what is wrong has spilled into this year.   I was asked about what our divorce decree says and it has me listed as the custodial parent but we have joint legal custody.   There is nothing stating who makes the medical decisions explicitly just the percentage we each pay of the bills.  Per our divorce and child support agreement I pay the first $1,385 of the kids medical bills and they are split 43.23%/56.77% after that.  (don't ask why weird percentage, its what the child support calculations deemed).  I have a spreadsheet of all expenses and I track it all very well.  My Ex hasn't taken him to any appt this year but I have kept him informed of when they are and what new MRI/EMG or whatever was being done.  A few weeks ago I started needing payments from him.  I asked for the first lump sum and told him then there was one more big bill and then a few smaller ones before we hit our deductible and they would all be smaller.  Today I asked him for the $366.19 owed towards this bill.  I am a reasonable person and offered to provide him the online payment option to pay his part with a credit card if wanted.  

We have run tests to see if it was the suprascapular nerve or a pinched nerve in the neck.  It was neither of those.  The tests that have been done were not unreasonable as the doctors try to figure out what is wrong.  It is just unfortunate that it wasnt a simple answer.  We have been referred to a pain management and neurology for nerve issues.  There is still no guarantee this will work but I'm not going to allow my son to keep being in so much pain and everything.  

Here's where I am asking for legal advice....  His response to the bill was ""Holy Crap! I'm officially requesting that no more money be spent on the shoulder.  Everything keeps coming back inconclusive.""  Given his ""request"" can I still bill him for these future doctors visits?  I don't want to take him to court but I don't want him to bully me into paying for all this in full because legally he is responsible too. We live in Indiana if that makes a difference. ",AskLawyers
[TX] Swindled out of significant money,"For the last couple months, I've been helping a homeless veteran get back on his feet. Paid for a few nights at a motel until his VA benefits kicked in. Bought him groceries. Heard about his life. Saw paperwork. It all checked out.

When his VA benefits kicked in, he got an apartment near the base in another city. We kept in touch, and he ask for help with other expenses, and he assured me he would pay back all of it.

Long story short, I'm pretty sure he's been making up stories to ask for money ever since he moved to the other city. And I'm pretty sure he has no intention of repaying me.

What legal recourse do I have to get that money back? Does his word that he would pay me back legally bind him such that I could sue him for that money?",AskLawyers
[WI] Wisconsin Watts v. Watts,"Is there anyone that has experience being the plaintiff, defendant or counsel for either party in a Watts v. Watts case. Wondering if they're viable cases, overall. What was your situation and experience with it? Also if you care to share, what county did it take place in? ",AskLawyers
[VA] broken laws ,"I have about eight soft checks against my credit for someone to open a loan or credit card now. None of these have been approved as far as I can tell, but I'm wanting to know is that enough to say the law has been violated. Now this is important to me because the person that has been doing this has a domestic and a PO violation along with GPS tracking hanging over top of their head now based on good behavior. ",AskLawyers
[FL] Is it possible to get child support arrears modified? ,"CAN you get child support arrears modified, the amount reduced when children are grown. I have a friend that still owes 50 thousand and has been paying all along, the children are now in their 30's. ",AskLawyers
[DC] can I sue my college? ,"I attended an HBCU in Washington DC 7 years ago and they have listed one of my classes as in progress. For the past six months, l've been trying to get them to close out this class and just about every way you can think about and they have been unresponsive or unhelpful. I have been lead on goose chase of calls and emails to lead to dead ends. What can I do from here? This is stopping me from transferring to a new university currently in IL.",AskLawyers
[TX] Father wanting primary custody when he’s not been involved ,"I had a paternity hearing this morning. The father has requested primary conservatorship. He has never reached out to visit with our son (10 month old) and he has an attorney while I do not. I’m worried what could happen at my next hearing. His attorney requested an in person hearing because he said it will take an hour on their side so I’m unsure what to expect. I cannot afford an attorney myself and do not know what I need to prepare for. He also said he only makes 300 a month which I find highly untrue. Is there any way that I can request proof that is what he makes? Also what sort of evidence should I prepare to have ready for my hearing?
Thank you for your time",AskLawyers
[MI] former juror at sentencing?,"I was a juror for a murder trial recently and am strongly considering attending the sentencing in a few weeks. I’ve struggled with emotions from this case and think this might bring me some closure.

During the trial, I was seated most closely toward the families, and my appearance is unique so I’m certain to be recognized if I attend sentencing.

So for sentencing, where do I sit??? Obviously not the jury box, but I feel like I have to choose a side.

If any of my fellow jurors attend (I have had no connection/contact with any of them), should I sit with them regardless of which side they’re seated on?

I suppose I chose a side when I rendered my verdict, but… I don’t want my seating or presence to be a source of added pain for either family, who BOTH deserve compassion and support. 

Is there a standard for this?",AskLawyers
[AR] I want to sue my ex wife’s lawyers…,"My ex wife used three attorneys. Two had to withdraw after I proved to the judge they committed ethics violations. The third “authenticated” perjury by my ex wife. (Video evidence which she wouldnt hand over) she also knows my wife lied about key parts of her testimony. Yes I can prove she knows. Please don’t ask how. I just can. 

Anyways, this led to me receiving a protection order that never received final adjudication after 8-9 months. It stated ex parte. Then came the charges for violating said order. Which were dismissed. 

Now I want to sue the lawyers for their part in this. The lies they told the judge and the hiding of material facts. All which contributed to my ex wife engaging in malicious prosecution. 

However, nobody will take my case. Will lawyers not sue other attorneys? They arrested me, tried to lock me away for months. I spent 11 days in jail before I got a miracle release. I won’t Justice. Why won’t anyone help me sue these attorneys? One of them has significant assets and there’s no doubt they both violated several rules and laws. ",AskLawyers
[AL] Being molested by a school employee and wanting to sue the public school system ,"In 2014-2015 I was molested by a school employee. Went to trial about the molestation, won the case but he also  went to prison for CP charges. i was groomed on school property, he showed me nudes on school property, took me off of school property and brought me alcohol onto school property (i was a minor). the molestation happened off of school property. i have sever PTSD, lost all trust of everyone around me, moved out of the city it happened in, have anxiety about him getting out of prison and finding me or my daughter and retaliating. I have lost enjoyment of life and change my appearance exponentially. just to not be looked at the same way. i have lost all confidence and don’t trust older men. nightmares and insomnia. 
my question is what is the statute of limitations and would it be worth sueing. If it is worth sueing, what are my next steps. ",AskLawyers
