title,post,source
[TN] Order of Protection case dismissed with prejudice,"I have two sons. My oldest Son has been married to Beth less than 10 months. Beth stated my husband (His father) made a threatening phone call to our other daughter-in-law. Then DIL called Beth and warned her My husband was going to unalive her and also her four children. Three. Months. prior to filing 😑. 
We went to court yesterday. We had all our phone records. No such call was made to anybody. We had text messages and ring cam. photos of everybody coming over to our home multiple times the past three months. All smiles and happy. We have our other DIL that was named as the person who called plaintiff to testify the call never occurred and provided her phone records. We had our official phone records also. Nobody called any family to that stated day. 

The statement was completely false. She was angry because I told her she met my son when she was four months pregnant.
She should not have had or son sign the birth certificate and check mark the baby was a minority when the baby actually has two snow white parents. It’s was done to give the child affirmative action and minority scholarships, etc. 
That is why she went nuclear after us full force. She has multiple children each with a different fathers my son married her two weeks after he met her and she was already four months pregnant. They have been married since last summer.

In court yesterday. we did not see the judge. The attorneys put us ( my husband, myself, DIL who was there to state the call never happened and our son) in a room with our son who didn’t sign the order of protection, it was only his wife’s Beth signature.


We were talking back and forth, my son kept lying for his wife, despite mountains of evidence proving otherwise. The attorneys decided to have case dismissed with prejudice, and have our son pay court and attorney cost. They gave my husband no contact with our son and Bergman? It doesn't make sense because my husband done nothing wrong. We were able to prove the phone call never happened even our other daughter-in-law was there to state she did not call her and tell her anything like that and provided her phone records also.
We also have to attend Therapy?????

FYI—My elderly husband two days after being served and read the false statement has had a cardiac event and been hospitalized over this stress of this lies and false claims. I am terminally ill and on hospice my self. We feel like we were manipulated by not having the person who lied and stated all of this in the room. 

Do we have any legal recourse in Tennessee? My husband realized how he got shafted after leaving the courthouse. 


",AskLawyers
[DC] Why is only illegal for employers to discriminate/retaliate against employees of specific protected classes or those engaging in a protected activity as opposed to being illegal for them to do that to any employee?,"I am familiar with title vil as the statutory authority that provides this mandate.

I would like to understand more about the rationale and or push back (from who; on what grounds) there was regarding the reasonable obligations and expectation of the employer to (all) employees. Not just just those that fall in a protected class OR are engaging in protected activities. 

I am also clear (I think) that the law does not really seem to recognize 'discrimination' without the 'protected' component. 

However as I understand it, retaliation and/or discrimination are fundamentally hostile actions. What value is there to be gained in the law permitting that behavior within the employer/employee relationship?",AskLawyers
[OH] Is leaving gifts/items on someone's property littering?,"Is leaving gifts after you've been told to stay off the property (trespassing aside) considered littering? I'd assume dumping requires the items to be trash, but not totally sure about that either. Not sure if it would be harassment, but I have a feeling that it would be something. Couldn't imagine you would be able to just leave things on someone's property against their wishes. TIA.
",AskLawyers
[CA] Why are there no lawyers in Sacramento that represent tenants?,"I tried every day this week to get in touch with a lawyer to ask a question about contract laws and my new lease at my apartment complex. I called 311, I contacted all the legal help resources that came up when I searched online, the relative I live with contacted a local free legal assistance service for people 60+, I tried the law schools, I also called every lawyer I found on the first 3 pages of google results. For the both of us, as soon as we mentioned that we were renters, every single person we got in touch with immediately said they didn't help tenants and they ended the conversation. 
I don’t need a lawyer anymore because we ran out of time, but l'm wondering if something happened that made everybody stop helping renters? Or has it always been this way? Am I missing something? 
Thank you for taking the time to answer I appreciate it 🫶🏻",AskLawyers
[OK] photo for facial recognition required at every traffic stop. ,"I understand Oklahoma is a one party consent state, but what’s the legal aspect on this? Could you simply tell them and here’s my ID? Would I get drug out of my car for refusing to provide a facial photo? Everyday feels a bit closer to the CCCP. ",AskLawyers
[KY] Selling Legal Cannabinoids?,"I occasionally venture into smoke shops, and see all the vapes, edible, etc with legal cannbinoids like delta 8, hhc, etc, the list seems to grow longer every day. 

So my first question, is why are these allowed to be sold? I assume the analogue act must be in play here, but I guess not.

Two, what is stopping them from just selling individual grams of the cannabinoid concentrates versus the vapes, edibles, etc?

Three, what is stopping people from just selling legal cannabinoid vapes on the streets, advertised as the legal cannabinoids, not as illegal delta 9? 

I'm just so confused on how smoke shops are allowed to sell legal cannabinoids. I don't want them to stop, I'm more confused on the mechanics of how the law works in this area.",AskLawyers
[GA] Would I be responsible for damages if I bumped into this car's rear hitch?,"https://preview.redd.it/3g1zabui4ssc1.jpg?width=960&amp;format=pjpg&amp;auto=webp&amp;s=a316d2c7e8337b68a1f1cd17c7f7efe702dcbd46

For context: There was a car in a parking spot with their rear bumper slightly over the line, and I pulled into the spot behind them. There was a small, difficult to see hitch attached to the rear of the car that went far over the line. Luckily I did not pull in further, but if I had accidentally bumped into that car's hitch, would I have been responsible for the damages?

Edit: thank for the replies! I suppose I was wondering if I would have to pay to repair MY car, since I probably wouldn’t do much to that other car",AskLawyers
[WA] Health Insurance Cancelled despite on time payments of premiums,"Question : 

What type of lawyer do I see for unfair cancellation of insurance? Given ongoing care for serious mental illnesses in my family, can I sue for this termination aggravating these  conditions and no reasonable time frame or options by insurance company for which their doctors work for to transfer care ? Is it likely to win such a suit against a large HMO or settle out of court?  

Explanation: 

   I have a family plan that I bought with Kaiser over 5 years ago. I made on time monthly premium payments for 5 years  via bill pay for which I have evidence of cashed checks by kaiser. 

I was informed on Feb 6th, 2024 that our insurance for my family of five was cancelled due to lack of premium payments. After many hours of research, I figured out that Kaiser had changed the P.O. Box for our specific plan. However both P.O. Boxes are at Kaiser and accept payments for insurance premiums. 

Kaiser  did cash the checks at the previous P.O. box and were just slow (approximately 2 weeks) in forwarding the funds internally. They didn't notify me that this was being done.This had gone on for more than a few months, thus there is a precedent.  Again I figured this out on my own after many hours of phone calls. Kaiser did not inform me . They just took my money and terminated coverage for 'lack of payment ' . 

I contacted the Washington Insurance Commissioner who told Kaiser to reinstate us in early February. Kaiser said they would after I showed proof of cancelled checks,  which I did and Kaiser acknowledged. They reneged on their promise to us and the Insurance Comisioner to reinstate with no explanation, yesterday, 6 weeks later ! 


Potential Lawsuit: Breach of contract, damages, and patient abandonment 


I would like to sue for breach of contract and resultant pain and suffering. I believe our previous history of ongoing mental illness treated by Kaiser has made this unfair cancellation of insurance particularly egregious. Of note, I did some research and found out there was a class action lawsuit against Kaiser in California a few years ago for delay of mental health treatment. 

It was the months of February and March, and now April that despite payment we could not access our doctors. We originally paid out of pocket for medications but eventually I was told they wouldn't dispense an important psychiatric medication for myself (antipsychotic), even if I paid out of pocket ,  and other meds due to our insurance being inactive. 

 I have a significant history of PTSD; all three children battle depression . My daughter had an adverse reaction to an IUD that I diagnosed myself ( I am an MD) and we had to go to Planned  Parenthood  to get it removed ( the IUD was put in by Kaiser) . My daughter also suffered from significant gastrointestinal issues where the workup has been delayed. All of this has greatly impacted her previous history of depression. 

My son had to cancel a therapy appointment with a new psychiatrist that he waited for 6 months. My son has a significant history of bipolar disease / adhd for which he has been suicidal in the past. 

Recently he suffered an adverse reaction to  prescribed ritalin. Ritalin is known to potentially cause mood disorders in adults and thus is not the drug of choice for adults.  In his case, it likely  triggered  a minor mania so he couldn't concentrate, sleep and get organized. He had GPA of 3.8, and this is the first time he has failed a class. He is hoping to be a doctor for which Chemistry is a requirement. 

My youngest daughter had to cancel her counseling sessions multiple times. Her depression has gotten worse. 

For myself, the delay in getting meds which I eventually got from an outside pharmacy, paying out of pocket,  has exacerbated my PTSD. Also the stress of my family not having insurance and having no qualifying event to enroll in other insurance has taken a big toll on myself and wife. I attempted and paid for a 'cost sharing medical coverage plan and then realized the company was not reputable and withdrew. Being out of open enrollment, it was the only choice I had for my family. 

 I have spent weeks and multiple hours on the phone trying to resolve this. I will inform the Insurance Commissioner about them not following through on their promise to reinstate us . However , given the impact of loss of insurance on serious psychiatric illness, stress , and hours of my time I want not only reinstatement, but compensation for above pain and suffering. 

It is completely unethical to cancel a family's insurance due to Kaiser's inefficient internal mail system. I would also consider it patient abandonment analogous to being 'fired from a therapist' without oral and written notice,not given options of other therapists to continue care , and time to do so. Clinicians give patients a month to find a new doctor, if they fire them, (I believe) . As the treating therapists work for the insurance company that terminated our care, the insurance company and employed therapists are one entity bound to the same standards of patient abandonment 


Next steps , prognosis: 

I am wondering what type of lawyer to consult - Personal Injury ? And if you care to comment, does it seem like a reasonable case that is worthwhile going after. I do have the time to invest in it but would want a reasonable compensation i.e at least above  10k .  I live in the Seattle area. ",AskLawyers
[CA] Case against Ford?,"We bought a 2006 Ford E450 retired emergency relief vehicle when it had 48.5k miles. We converted it into an RV to travel and work around the US. Purchased, registered and insured in NY.

TLDR at the bottom.

In June 2023, at 67.8k miles we had a fuel injector break off into the engine and had to replace the engine. We spent $21,119.17 to get a complete engine at a Portland, OR Ford with a 2 year warranty. During that time we had to get a rental van for $2,339.73 and when that got too expense a motel using credit card points for $882.42.

In October 2023, while at an Ohio Ford service center, we replace 2 CAC hoses that connect to our turbocharger pipe that had fallen off. $982.22

In November 2023, while in NY getting an oil change with a local diesel mechanic, we are told that the oil fill tube was not connected and that the passenger side valve cover is damaged, meaning that we have basically had an exposed hole on our engine. He temporarily fixed it but that we should go to Ford to see if it is covered under our warranty.

From 11/28/24-12/11/23 it is in the shop back at that same Ohio Ford getting the new valve cover replaced under warranty and we also have them replace a reservoir and vacuum pump that was causing A/C and heat issues. $2,230.53

The next day while headed to California, we notice that the A/C and heat no longer work again. In addition we look under the hood to see Freon leaking everywhere. We tighten up the Freon leak while on the side of the road.

Jan 12th, 2024: San Diego Ford #1 confirms that it was a faulty vacuum pump that is causing the A/C and heat to not work. Charge us $200 for diagnostics and Ohio Ford says that will cover the diagnostics and ship a new vacuum to the San Diego Ford.

Jan 16th, 2024: We start having hot start issues where the van will not start if the oil/coolant temps are between 100-185 degrees. 

Jan 29th, 2024: We sit in the lobby of San Diego Ford #1 for 8hrs only to be told that the tech got pulled off for an emergency job and couldn’t replace vacuum. 

Feb 5th, 2024: We sit in the lobby of San Diego Ford #1 for 8hrs after being assured that the tech would be able to complete the job that day. At 5pm we are told that they would need the van overnight to complete. $123.34 for Motel 6

Feb 6th, 2024: San Diego Ford #1 completes the vacuum pump job, 2 days later the A/C doesn’t get cold anymore.

Van continues to have hot start issues and realize it wasn’t just a one time fluke.

Feb 20th-Mar 1st: Van brought to a different San Diego Ford for hot start issue, alignment/rotation, brake check, and oil change. Getting ahold of the service advisor was the worst we have ever experienced. Finally told that they couldn’t find the hot start issue. They replace the fuel pressure regulator to try to fix the code present and that it would be covered under warranty but that we also need ball joints replaced. With such a bad experience we figure we will go somewhere else for those. Upon receiving the van back, we notice the airbag light on and the tires losing air when the valve stem is removed. We are told to come back and they will fix the issues. The following day we hear the tire pressure equalizer that connects from our dually tires in back rattling and losing air. Also noticed our diesel heater exhaust muffler slightly bent. We notice the passenger bag connector under the seat unplugged so we plug that back in and light goes off. Stayed with family and $230.74 rental car out of pocket. $563 for repairs.

March 4th, 2024: We bring the van back for them to put the tires back on correctly and point of the slightly bent diesel heater muffler. We are brought into the service managers office of San Diego Ford #2 and told they want to make it right by doing the ball joints at a discount. We agree and bring it back the next day. Later that night we see the diesel heater muffler even more crushed than it was before.

March 5th, 2024: Bring the van back to San Diego Ford #2 for ball joints and get rental out of pocket for the day $41.80. At 330pm told that they can’t complete it and will need it overnight. We stay with family and extend the rental car.

March 6th, 2024: We receive the van back and assured that it is good to drive to Alaska. Ball joints replaced for $755.42.

March 9th, 2024: Van won’t start while hot still. 

March 11th, 2024: CAC hose that was replaced in November 2023 pops off while in the desert and have to reattach on the side of the road. We drive under 40mph to the nearest town. 

March 12th, 2024: We bring the van to yet another Ford service center to have them look at the cac hose that popped off as well as the hot start issue. We pay $199 for diagnostics and they say that the cac hose looks like it was attached well but that we have 6 different codes that are popping up and that we should have it looked at back when we get to San Diego. We get 5 miles down the road and the CAC hose pops off again. We bring it back that Ford and they say they could figure it out as they have “the best 6.0 tech west of the Mississippi”. We leave the vehicle with them, get a motel 6 for the night $90.43 and get a rental car through hertz to get back to our job in San Diego. 

March 13th, 2024: Spoke with San Diego Ford #2 and told that there were no codes present when we left their facility. 

March 19th, 2024: Told that we need to replace our engine again. Mileage: 79.7k Meaning that we got 11k miles out of that replacement engine. Started a ford pro case with a ford representative and emailed them our full nightmare experience with ford over the last 9 months. 

Terrible communication with service advisor on status of vehicle continues and continue to extend rental car at $40/day with no end in sight.

April 1st, 2024: Spoke with service manger and told that engine has been ordered but no ETA available. Spoke with ford experience specialist but told that she can’t do much because she hasn’t been able to get ahold of the service advisor. 

April 2nd, 2024: Told that the engine is coming from Charlotte, NC to California but still no ETA. Request that car rental be covered by ford but told by experience specialist that it’s not guaranteed and she would talk with the leadership team.

April 5th, 2024: No word on rental car reimbursement. After 25 days of having the rental car we return it because we cant afford it and borrow a family members vehicle. Hertz Rental $1,084.60
We stop at the ford service center and are told that the engine will hopefully come 4/8 but that they now think it’s turbocharger and not the engine causing the codes. When the engine and turbo charge come they are going to replace just the turbo charge to see if that will fix the issue.

This is where we are currently at.

TLDR:
-Spent $21,199.170 to replace engine to only have that engine need to be replaced 11k miles later

-Ford told us that we were good to drive the vehicle and then have 6 codes six days later at a different ford, including the code they said they fixed.

-Paid $1k for turbo cac hoses that are falling off

-Paid $2.3k for an A/C job that doesn’t work

-Since 6/26/23, the van has been in a ford service center for 80 total days as of 4/5/24. Thats 28% of the time.

-$1,328.61 for hotels since June 2023

-$3,696.87 on rental vehicles since June 2023",AskLawyers
[NV] Billboard Lawyers,I’ve heard lawyers on billboards are a red flag but why ?? 🚩 What do you guys think about Navqi Las Vegas ? ,AskLawyers
[WI] Is this wage theft?,"I work for a very small (4 employee) home care company and I’m paid hourly “per client”. 

All employees have to come into the office at 9am for a morning meeting and receive our assignments for the day. We are not paid for this time at all and usually don’t leave the office until 10am. We are also not compensated for time spent driving to clients houses (in our own personal vehicles), which are sometimes 30 minutes away. 

Is this wage theft? I’m in Wisconsin. 

EDIT: We are paid piecework at an hourly rate. I.e. client X should take 3 hours, so we get paid 3 hours regardless of how long we’re there. ",AskLawyers
"[OR] If my company uses VoIP on employees’ personal phones, can those personal devices be subpoenaed?","I’m a decision maker for a small organization that is looking to switch our phone system to VoIP. We have four phones purchased by the organization and were going to have the other four employees use their personal phones.

However, my dad told me that if the organization gets sued, or worse, there’s a criminal investigation at work, all personal devices with VoIP on it can be subpoenaed and all personal data unrelated to work would be exposed.

Is this true?",AskLawyers
"[UT] Confused on utilities for rental, land lord did not send a total for the month of February in an email like they always do and now they want it paid in arrears? ","State of Utah, lease ended on the first of April, and landlord has now (April 5th) sent me the last two months bills) we had another fourth person move in part of the way through march, seems like the land lord split the total for march (283.93) 4 ways for everyone else. February was $334.18 split three ways. (Names changed for privacy.)(I would be Jason)

John owes James $71.00 within 3 days please. 
Jason owes James $208.61 or it can be deducted from the deposit, let me know your preference :)

Jason, since the utilities are paid in arrears I need to avg the daily rate and prorate the rest of the month of March. I've added them up to be $137.61 total
Power would be $1.98/day x 24 days = $47.55. 
Water would be $.80/day x 23 days = $18.52. 
Gas would be $4.47/day x 16 days = $71.54. 

Is this right?",AskLawyers
[CO] Forced stay at rehab facility due to having good insurance.,"So i was originally planned to discharge last friday, but was told things weren't set up yet and it would have to be monday. On monday they said they still have to work out on getting the right equipment for my apartment in order for me to discharge, and would have to wait til this friday. the lead director of the facility came into my room yesterday and told me that they fired the lead discharge person and that he was going to be the temporary fill-in. He informed me i won't be leaving until monday now. 

I have good insurance so im fully covered and everything which makes me have more days than others to stay in the facility. Those days end on Saturday. I was informed that they won't be charging me anything for Sunday and that I'll leave monday. 

A therapist warned me in secret that they have been doing this to a lot of people due to lack of patients in the facility. aka. milking all the insurance money possible from patients before discharging them.

The major red flag is that i made my own calls to the home health company/home equipment company and they said that i was scheduled for last friday but it was canceled due to not being ready to discharge and in further need of therapy, which is absolute BS. The director told me that they just didnt have the equipment for me to go home that day. and now he is telling me the exact same thing this week. I made the same call to both home health entities and they still have a held spot scheduled for me tomorrow, but just need the directors go ahead and scripts, which would only be a quick phone call and fax/email.

I was warned that the woman that was fired was, in fact, doing her job and trying to get patients out at the quickest date possible and wouldnt go along with the scheme, so she was let go.

wtf is going on? is this legal?",AskLawyers
[PA] Medicaid Lookback,"Father entered into a purchase agreement for the sale of home with me over 10 years ago. The way the contract was structured is I'd pay a monthly sum each month until the purchase price was paid off. Price was significantly under FMV. 

My question: if my father needs to apply for Medicaid, is this subject to the look back (5 years) since the purchase price hasn't been completely paid off yet? Or not since the contract was signed over a decade ago. ",AskLawyers
[TX] Chacruna leaves in USA,"I'm really confused on this.

In the USA, DMT is a schedule 1 drug, but it occurs in nature all the time (even produced in the human body). Apparently, it is legal to buy plants that contain it, but is a grey area.

So at what point does this become illegal or sketchy:

1. Buying chacruna leaves online
2. Boiling the leaves in water
3. Posting a tutorial video of you making this ayahuasca on YouTube
4. Pouring it out 

From what I understand, all of this is legal in the USA. Is that incorrect? It just becomes illegal if you extract pure DMT or consume the plants. It seems like a weird loophole, like how people can by THCa flower with less than 0.3% delta 9 THC, which is legal until it is smoked",AskLawyers
