title,post,source
[CA] illegal medical reimbursements to company? ,"To make a long story as short as I can, my wife works for a company, where for 4 years they were not properly deducting medical costs for health insurance out of the employees checks and the company was still fronting the costs. Only after four years did anyone realize it and the owner has, sought reparations! He is telling employees ""sorry you got this freebie for four years but I need my money back"" and he's saying things like ""you signed a contract when you signed up for medical that you'd pay the cost"" well here it is four years later and he's coming to collect. One poor woman owes $15,000! My wife owes $1,000.00 not a big deal but at the same time, it's the principal of the matter. He let go of two years but he's still coming for 2023 and 3 months of 2024.

Legal or illegal? ",AskLawyers
[WA] How do I contest a chicken sh** speed trap ticket? ,"Recently, a camera was placed by a school to issue speeding tickets without needing a police officer. The school is in the middle of and bottom of a long steep street that on either end is 35 mph, but becomes 20 mph where the school is. I got a $150 ticket (by mail) for going 28 mph in a 20 mph zone. It’s literally impossible, going down a steep decline, to reduce your speed in time unless you know in advance where the school is and slow down to a slow 20 mph crawl in time. This was the middle of the day btw. with no kids around. I don’t even know if school was in session. The ticket has a photo of my car with a remote officer claiming I was driving 28 mph and Im officially contesting it. Any advice on what to do? ",AskLawyers
[CA] Can defense in a criminal case introduce police interrogation recordings/transcripts or is it hearsay?,"Can defense introduce police interrogation video or is it hearsay?

In a YouTube video, a Canadian Lawyer ['Runkle of the Bailey'] explained that in Canadian law the prosecution *can* introduce interrogation tapes because they meet the criteria for an exception to the hearsay rule (iirc they are statements by a party against their own interest) but defence *can't* introduce the tapes because they are hearsay. He was emphasizing how speaking in interviews can  only harm, not help.

Is US law simpler? 

If so, can the defense play any recordings already introduced by the prosecution? 

Can the prosecution pick just portions to introduce, or must they introduce the whole interview/tape/transcript even if they only play a small portion in court? If the latter, are there effective limits on cherry picking to the point it changes meaning?

Is defense limited to playing only the specific portions the prosecution has already introduced?

Hearsay rules seem simple but I find it gets a bit confusing at times.",AskLawyers
[PA] Can my landlord hold me to a verbal agreement? ,"Hi all, 

Not sure if this is a dumb question but in October 2022 I signed a one year lease for my current apartment. I communicated roughly 6 months later to my landlord that I wanted to resign when the time came, but I was never asked to resign a year later. I now want to move out sooner than expected. 

Can I be held to telling my landlord via text that I wanted to resign even if I never signed an updated contract? 

Thank you for your time. ",AskLawyers
"[GA] when I see people discussing law schools online, I see them using “$$$” or “$$”, in reference to their school. What does this mean 😅",,AskLawyers
[MD] Classes to take to know if I should be a lawyer?,"Can anyone recommend resources to read or watch online to see if law school/being a lawyer would be a good career move? Maybe take a practice LSAT?

I like to read and do research , and often entertain seeing situation from an opposite point of view than my own to gain a new perspective.

I know that law school is costly and a time commitment, so I thought it might be a good idea to take some online classes first.

Others have suggested to work as a legal assistant or get a paralegal certificate to work as a paralegal first.",AskLawyers
[TX] I'm from Texas and my ex wife is currently living in China,"How do I send divorce papers to ex wife in another country?

So I'm in Texas. My ex wife is Chinese and has been living back in China sense last year now. We separated last year. We agreed to divorce. I don't have a lawyer. We have no assets. No kids. We are both 26. She agreed to sign the papers. I have the divorce papers to submit to the court and I just need to sign my part and she needs to sign hers. I have paper copies. How do I get this to her? ",AskLawyers
[SC] Getting back at texting advertisers ,"My information was sold to a bunch of car dealers apparently who have been texting and calling me to come buy a new car. I replied to their initial texts something along the lines of ""By continuing this conversation, you agree to pay $4.99 per additional message to the account holder associated with this number."" Some of them have continued to message me after acknowledging that message. If I know which dealers they are from, am I able to send them a bill? I did this mostly because I was bored and am annoyed about getting unsolicited advertising text messages but am always looking for a way to ""stick it to the man"".",AskLawyers
[IL] Would a lawyer accompany me to State police HQ even though I do not have a case? ,House was raided a few years ago and they confiscated my firearms. No charges. The person who was the reason my place was raided also acquitted on all charges. From my understanding I just have to call to pick my firearms up. I just don’t want to do it alone and am afraid of harassment and rights not being taken serious(that’s what happened when raided). Would a lawyer accompany me to make sure everything goes smoothly? I’m in Will County ,AskLawyers
[TX] Question about mechanic lien,"When a mechanic puts a lien on your car because of unpaid repair costs, my understanding is that the lien does not add any expense. If you owe $100 and they put a lien on your car, then a week later you still owe just $100 to get the lien off. Is that right? Or are there additional fees? Or simply fees for late payment unrelated to the lien?",AskLawyers
[GA] car note/ repossession ,"A one point I was dating a person A. We decided to get a car together and put both our names on the title. We'll after a while we broke up, I kept the car. He moved to Michigan. 

Then I got into an accident and totaled my car. We had purchased the GAP coverage, but for it to go into affect we both had to sign a power of attorney. I signed mine and sent it in. From what my insurance agent said she had gotten in contact with him, got his address, sent him the POA, then never heard from him again. He also blocked me on social. 
Well the car ended up getting repossessed.

Just got out of court, the company who we financed the car from is suing us both for the money. He never showed, never filed a response, nothing. They said he is being given a ""default judgment"" (whatever that means) but also ruled that I have to pay the remaining 3grand myself. 

They told me i could try to speak to a lawyer in that state to get the money from him, but I was just wondering if I could have some advice on what type of lawyer to try to get in contact with, if it would be worth my time, and if I would even have a case.

Because personally, I don't understand how the only party involved that's trying to resolve this has to pay for everything while the other party gets away with causing this issue and gets to not have any repercussions. ",AskLawyers
[NC] help with spousal support ,What do I need to do to prepare for spousal support court? ,AskLawyers
"[CA] If a police officer sees a milk crate in my home, does that give them the right to break in?",,AskLawyers
[MI] How can I exercise my disaffirmation rights on a Creative Commons license from when I was a minor?,"Forgive me, I am new to law and in dire need of assistance. This is also a throwaway to protect my identity.

When I was 16, I contributed art and animations to an online video game mod project as a volunteer. I am nearing 24 now. I have recently reached out to the head of said project, requesting alteration or removal of said art from the project, and offering to do all of the work needed to replace it with a new set of images and text. Unfortunately, the project head refuses to honor my request, citing Creative Commons SA 4.0 as their reason, ie:

&gt;By adding it to the mod, you consented to the license and all it entails. As per the CC-BY-SA license there are no limitations on how things are used, nor are we obligated to remove it under the CC4.0 agreement.

As far as I know, the project head is also located in the USA. Where, I am not sure at the moment.

I have been doing research into Creative Commons with some companions, and we have found a section on the FAQ website mentioning the ability for minors to disaffirm CC licenses once they reach age of majority. 

&gt;**Can children apply Creative Commons licenses to work they create?**  
&gt;  
&gt;*This issue depends largely on the laws in place where the child lives. In the United States, children can be copyright holders and are entitled to license their works in the same manner as adults. However, they may have the right to disaffirm certain types of legal agreements, including licenses.* ***In many parts of the United States, for example, children have the ability to disaffirm some types of agreements under certain circumstances once they reach the age where they are considered adults within the relevant jurisdiction****. We are unaware of any attempt by a licensor to exercise the disaffirmation right with respect to a CC license applied to a work.* 

[\[src\]](https://creativecommons.org/faq/)

Unfortunately, search engines are not very helpful in finding more information on such a situation, and with the lack of knowledge on attempts to exercise disaffirmation rights with CC, I have a few questions:

1. Is this project head able to hold my copyrighted creations under Creative Commons, ie hold it under license for me without owning my work?
2. If no legally binding contract was signed, does the Creative Commons license hold any ground here at all?
3. Does the Creative Commons license cover a project where the owner does not hold copyright to all of the material within the project?
4. Under what ""certain circumstances"" is a minor-turned-major able to express their disaffirmation rights, especially with Creative Commons?
5. Where would I be able to seek Creative Commons lawyers in a situation where I am able to issue a DMCA or pursue further legal action?

The last question is in regards to the fact that I am unable to locate lawyers for such a situation, [especially considering the Creative Commons wiki has only dead links for their US references.](https://wiki.creativecommons.org/wiki/CC_Friendly_Lawyers)

Any help at all would be really, really appreciated.",AskLawyers
[TX] Can you be sent to State Prison for Federal Crimes,"If one commits a federal crime will they always be sent to a federal facility? If not, when could you be sent to a state prison instead? Is that something the convict would have to move for during sentencing and hope for a kind judge or could the government unilaterally decide to sentence you to a state prison instead if they know you exclusively committed fed crimes this time because you prefer the food and company there to the state alternative?",AskLawyers
[GA] received a letter from the Solicitor’s office today,"My step-daughter was involved in an accident on 12/1/23. It’s been a complete nightmare and things are still not settled. The police cited the lady who hit my daughter, but her insurance company is claiming only 75% liability for their customer and 25% liability for my daughter. I don’t understand how they have come up with these figures since she was given a ticket. 

Anyway, today my daughter received a notice from the Solicitor’s office asking what losses my daughter has suffered as a result of the accident because they are reviewing the case for prosecution. I’ve never heard of this before and am just curious why they would possibly be considering prosecuting the other lady. Does anyone have any experience with a situation like this?

Thank you in advance for any insight you can give me. ",AskLawyers
"[NH] Asked boss for info on FMLA, now I’m watching my shifts disappear ","So unfortunately my mother is dying. She’s “stable” for now but things are progressing ever so slightly. I asked my boss for info on FMLA and she was like a deer in headlights. She told me I need to contact HR, which I did later that day. Since then, I’ve watched my 20 hour workweek dwindle into 2 shifts a week from 2pm-6pm. I’ve not even filed yet because I don’t need to just yet, but wanted info on what’s involved and what I need to do for it. I feel like my boss is retaliating? ",AskLawyers
[AL] Liability For Leaving Behind Things After Home Sell?,"I’m worried about personal injury liability specifically……

We’re about to sell our home and move out of town and we’re downsizing extremely. There is some shop equipment in the shop, a large powerful professional grade lawnmower, a big screen TV on the wall, and a bench with shelving in the basement I built. I just don’t have time before the move to sell it or otherwise get rid of it. I am wondering if there is any liability involved if I include it in the sell of the house as far as anyone getting hurt using any of it or something falling on someone etc., there is a couple of dangerous spots in the yard as well. I would list the items as included in the listing or paperwork of the house so they would know it’s staying and there is a separate shop the equipment is in.

Items include:

Tool chest full of hand tools

Power Tools

Welder

Shop Press

Drill Press

Bench Grinder

Lawn mower

Generator

Chainsaw

Miter saw",AskLawyers
[WI] How to remove an unwanted guest?,"We have a homeless woman living with us since the beginning of October.  She is not related to us.  She had been previously evicted (or served an eviction notice) due to not being able to afford her rent. 

While living with us, she found a decent job.  After she found the job, I asked her if she would be willing to pay a small amount (even say $100) in rent to us each month. I pointed out to her that she could use us as a rental reference to help make up for the eviction on her record.  She said “no” and told me that she didn’t need us as a reference because she was not officially “evicted”- she was served notice, but got out before she was removed. 

She is generally very quiet, polite, and cooperative- but we’re tired of having a freeloader and want her to move on. We think it’s odd that she does not want to contribute at least something to us.  

Again, she has never paid us rent nor agreed to anything in writing. 

How do we legally get her to leave? ",AskLawyers
[CA] Can FGM done in childhood be a ground for Asylum in USA? ,"As the title suggests, my girlfriend is in India and belongs to a community that follows FGM in childhood for young girls. Now my girlfriend has never bothered about this but I recently brought her attention to possibility of Asylum for FGM Victims. Can this work? TIA",AskLawyers
[MA] Hearing for homicide trial Tomorrow. What are possible outcomes? (More info in post),"Hello, tomorrow the person who took the lives of 3 people, (one of the victims was a family member of mine) is having a hearing. It's been many years. They were never found competent to stand trial. But I hear they may be ready now. What do you think they would hope the outcome will be?

They were literally caught red handed, and admitted it to police. Is there a chance they could be let back out into society? What could the defense hope for?",AskLawyers
Divorce Consultation Advice [VA],"I am getting a divorce. I've done my homework but have some case specific questions I would like legal advice for. At this point, I want to know what my options are. I want to go in prepared with reasonable expectations. I have the expected questions regarding child support, custody, assets, etc. 

To get my questions answered, is there any paperwork I should bring? 

How much billable time am I looking at for just consultation regarding typical issues?

How many meetings does it normally take to just get information and advice?

What should I look for in a divorce lawyer?",AskLawyers
[PA] Dealer Won’t Give Me Truck or Truck’s Title,"Dealer Won’t Give Me Truck or Trick’s Title

Hey all! Back in December, my dad bought a truck (Freightliner) from a dealer and paid him the agreed upon sale amount of $23,000. We did get a bill of sale saying that the truck was paid in full. Dealer said that he’d send the title for the truck in the mail. My dad was planning on going overseas for two months and didn’t have somewhere to store the truck. The dealer offered to store the truck in the back of the lot and my dad agreed. My dad understands that he takes full responsibility of the truck and whatever damage may have happened to it while stored. 

Weeks go by and no title shows up in the mail. I try calling the dealer since my dad can’t call himself and he doesn’t answer. After my dad gets back, he finally is able to get a hold of the dealer and the guy tells my dad that there was some problem with the engine starter and that his truck was with the mechanic. Mind you, nobody told the dealer to take the truck to the shop for us and we were NOT notified of the problem until WE tried numerous times to contact the dealer. The dealer tells my dad that the truck will be ready in a week.

On that Monday that the truck was supposed to be ready the dealer claims that the mechanic messed up the repair and the engine is totaled. My dad goes to the dealer and asks him to show him the truck and he refuses to do so. 

He also comes up with excuses for why the title didn’t come to the house saying he had to get it from New York and mailed it to his house in New Jersey instead of it coming directly to us in Pennsylvania. This all happened about 3 weeks ago now. 

At this point my dad just wants to guy to refund him the sale amount and we can move on from this.  Every time my dad tries to contact the guy he has some new excuse for why he can’t talk and keeps on trying the placate my dad by saying “I’m gonna find you a new truck” and “My son will talk to you about paying you back” but nothing has come of it. What are the possible legal steps that we can take. We’ve tried to file a police report however his dealership is always closed when we go over and there’s no way to know when the guy is in to be able to file a report. Any help would be greatly appreciated!

(Edited for clarity purposes)",AskLawyers
[IL] POA concerns regarding my terminally ill mother,"For the last 3 years my sister has taken a more active rolle with myself in helping our mother as has developed a lung disease that will only progress and get worse with time. That said, ive been in school for the past year and she has been taking my mother to and fro a vast majority of her doctors appointments. Prior to this, I had been solely advocating for our mother for about 15 years. Recently, our mother transitioned into a nursing home, where I discovered that my sister had become her medical Power of Attorney (POA), a role previously held by myself.

Currently, my sister and I have no communication, and it seems unlikely that this will change in the future. As the designated POA (which my mother was unware of) my sister has instructed the nursing home to provide updates on our mother's health exclusively to her. Despite this, I'm concerned that in the event of a serious situation, I might be left uninformed. This worry stems from the fact that both my mother and I were unaware of her placement in a nursing home initially. Additionally, the social worker at the facility refuses to engage in conversation with me, citing my lack of POA status as the reason.

Given these familial issues, and my understanding that there cannot be two POAs, I'm wondering if there's any way I can ensure that I am kept informed about my mother's well-being.",AskLawyers
[NJ]child support and waiting for ssdi approval ,"My husband was laid last year as a part of RIF.
Nevertheless he has been child support diligently until now about 1000$ a month. 
He also has been on short term disability for the last 7 months and applied for SSDI. 
SSDI approval could take a year, two or more. My question is can he reduce his child support while waiting for SSDI approval?
It's a touch situation to pay 1k monthly while not being able to work for years. I have another child with my husband, for the context.",AskLawyers
[NC] Malicious employer?,"Leaving the details spotty so y'all can ask questions bc I worked this job for 5 years and I don't really know what I'm going for right now. 

Former job has three major periods of the year. I was fired after one period after an investigation on me by the owner. I ran one of the owners stores and was the most experienced. I found out he's holding a competition for 200$ for his employees - whoever makes the best and most fake reviews, wins the money. I feel like that's highly illegal.

I want to go after my former boss for his malicious actions. He is a franchise owner. I don't know if I should go to his corporate owners, the BBB, or what. I also don't know what proofs I would need.

This isn't really a 'pissed off former employee attacks former employer' type thing, moreso a 'former employee was wronged and the current employees are getting into possibly illegal matters under/for the owner and I believe everyone should be treated morally right without having to do possibly morally questioning actions'",AskLawyers
[MA] Requirements to Run for Governor,"Hi! I’ve been looking through the laws on who can become governor of Massachusetts and I am confused about the residency requirement: Is it seven years in your life, or seven consecutive years prior to the election? Furthermore, how is it determined if you are a resident of the state?",AskLawyers
