title,post,source
"[CT] After 2 years, should I agree to a non-compete?","I work for a company, have for the past two years, I was hired as talent, and when onboarded I was told I could seek employment to expand and grow my craft outside of the company. I was informed after returning from vacation that I must sign a non-compete or lose my job. What advice could be given? Do I agree to the non-compete? Do I refuse and get terminated? If they terminate, would it be wrongful since I've preformed in the top 10 in all metrics since I've started. I'm lost and scared. 

Throw away account. 
",AskLawyers
 (CT) Need advice on a situation.,"I work for a company, have for the past two years, I was hired as talent, and when onboarded I was told I could seek employment to expand and grow my craft outside of the company. I was informed after returning from vacation that I must sign a non-compete or lose my job. What advice could be given? Do I agree to the non-compete? Do I refuse and get terminated? If they terminate, would it be wrongful since I've preformed in the top 10 in all metrics since I've started. I'm lost and scared. 

Throw away account. ",AskLawyers
[NV] Tenants rights to break a lease,"So im breaking my lease today in Nevada, my lease is technically up in August but ever since they removed all the sage brush in the lot next to my house we've had a mouse infestation. To the point where we found mouse poop in our newborns crib. In addition theres maintenance requests which didnt see proper resolution, nothing in the house work, gate is broken, its all fucked.

Anyway, per usual and by state law, i am obligated to cover the rent between now and when they find a new tenant, up to when the lease would have expired..my question is due to the circumstance, do i have a good enough case to not pay these penalties considering the house became inhabitable? ",AskLawyers
[IL] Chicago. I cut the boot off of a car with an angle grinder. ,"Chicago, IL how much trouble am I in for cutting a boot off of a car?

My wife and her friends went to a concert in downtown Chicago. Some private (non municipal) company put a boot on her friends car, and they didn't have the 170$ to get the boot off. She called me to come with cash. I live in northwest Indiana about 40 minutes away. I took my work truck (I own the company, so no disciplinary from a boss). By the time I got there and realized it was a security company and not an actual municipal organization, I just opened the toolbox and grabbed my angle grinder. I cut the boot off and threw it next to the security guys car while basically telling him that he doesn't make enough money to stop me. I was being threatening, not gonna lie. 

Afterwards, we all left. 

Good chance they got my plates. I don't really care, just curious on how much trouble I could get into? 

Again, it was a private company. Not like it was Chicago police or Chicago parking authority. No DOT number on my work truck or identifying logos or anything. 

As far as the threatening went, I just reminded the gentleman that 18$ an hour isn't worth it enough for him to do anything. I told him call his boss or call the cops, but his boss probably wouldn't be able to do anything either. I returned the boot cut in half by setting it next to his company car, and politely told him to have a safe shift before leaving. Dude was too confused and shocked to film me or walk around back of my truck to get plates. 

I live in Indiana. This took place in Chicago. Thanks in advance! 

Edit: the sign said no parking 6AM-8PM. it was about 8:30PM. they were legally parked. ",AskLawyers
[AZ] Kingman. Legal question about the limitations of an Order of Protection as it pertains to a custody battle,"Something very heartbreaking and unexpected happened to my friend during a custody hearing and I'm asking for some legal clarification on a ruling.
My friend is in the middle of a custody battle over her two kids with her ex-husband, whom she is also in the middle of divorcing. The husband was physically abusive to her, and she recently found out he was abusive towards her son as well. So she and her legal team asked the judge for an Order of Protection for her and her two kids, which was immediately granted, so he couldn't go anywhere near her except when picking up kids on the weekend, and his visits with them had to be limited and supervised.
So he and his legal team petitioned the court for a hearing to have the O.O.P. either appealed or upheld by the judge, which was expected, so a court date was scheduled. But it the meantime, he lied to the courts and the police and claimed that the mother was a danger to herself and her children, citing mental health problems she had several years ago, and he was granted temporary emergency custody of the kids despite the O.O.P still being in place against him.
This was shocking enough, because we didn't even know that was possible. But then the hearing on the Order of Protection happens and the judge finds the husband's credibility very suspect and decides to uphold the Order for the safety of the wife and kids. Which is great news... except the kids weren't released back into the mother's care. They're still in the abusive father's sole custody, despite an active Order of Protection against him still being in place. The poor woman has to wait a month until the next hearing, where she has to prove she's not crazy and deserves her kids. We have no idea how this is even legal. Can someone please explain to me how this even happened? We're both deeply confused, and so was her attorney.",AskLawyers
[FL]- Can I still charge assaulter after 13 long years? ,"As a MTF Trans Woman, how long do I have to press charges for sexual assault in FL? 

Hello. English is not my first language and I do not want to use translating appl. I am Swiss but my incident happened in the US. I was sexually assaulted by my lawyer and I was so scared to do anything about it in 2011 but I feel it is the right time to seek justice and money from him. 

I moved to US to become a dancer in Florida but I was not good and moved back to the farm in 2013. In 2011, I was live in Florida where I park my camper in grocery store parking lot. When I was younger I was very, very flirtatious and I made a fruit and vegetable employee feel uncomfortable with my advances and I was arrested, then charge, then release on minor crime. 

My parents buy lawyer for me and he is maybe late 30s and handsome. Sad for me (I thought at time) that he had a wife and two kids. He would make inappropriate and sex comments to me all the time. He would pretend that he was the fruit and vegetable employee and make me talk to him like I did before arrest. One day, he put his arm on my shoulder and it touched the side of my breast blouse when he pulled away. I was so in fear. He had all power and I had nothing. 

My case get dismissed after I apologize and I move back to Europe. Before I move back, I am so scared of him and just want to appease him so I ask if I can be baby sitter for his kids or cook meals for him and his kids. Parts of me still have fond memories of my assaulter. 

I dont want to ruin his life I just want to sue him and hurt his wallet. Can I do this from HVR? Has too much time gone by to sue? Do I need lawyer or will US assign me a public helper? 

Thank you!!

",AskLawyers
"[MD] Maryland, Employer is now refusing to allow me to take off for religious Jewish Holiday","Before I started working here and was speaking to HR I told them that if I am to work here I need Fridays off, and can't work Jewish holidays. They told me it wasn't an issue and the same when I spoke to my 3 supervisors. This was all 6 months ago. I notified my supervisor last month reminding them that I would need 2 days off towards the end of the month for Passover who emailed the head of the department regarding this and I was initially told shouldn't be a problem. I sent another email last week again reminding as I wasn't given a clear answer. Today I was notified that I would not be getting those days off. If I want to take those days off I have to use my sick time. I asked what about other holidays as I'm only given 20 hours of sick time a year and they told me to pick and choose which holiday I won't work. I've personally had 3 different situations with this place of employment regarding racial issues. I've had a coworker constantly harass me due to me being Jewish saying thins like ""If only Hitler succeeded in his mission so you and the rest of you dirty Jews wouldn't be here today."" Nothing was done about this employee. I've had patrons spit on me while cussing me out and again nothing was done. I have a written document signed by 9 other employees about how they were discriminated against in this workplace due to their race/religion as well. I'm thinking on going to a meeting with the head of the department Monday morning, recording the conversation (will notify of the recording) and if they refuse to accommodate or work with me on this to turn in my 2 week notice.

I was mainly wondering whether:  
A) Can they force me to use my sick time and have to pick and choose between the holidays or do they legally have to give me those days off even as unpaid?  
B) Do I have any legal grounds for a racial discrimination suit here?

Edit to clarify: I wanted those days off as unpaid. I'm fine not getting paid as long as I can get those days off. They are now trying to refuse giving me those days off whatsoever even if I were to use my sick time.

Edit 2 since people seem to be confused with people having Friday's off. I work Sunday to Wednesday so I still work a full 40 hours 5 days. We are open 7 days a week 16 hours a day. I am getting no special treatment whatsoever for having Friday's off.",AskLawyers
[AL] Why would multiple small law firms split in the middle of federal litigation?,"IANAL, but am involved in complex litigation with a couple dirty closely-held ""family"" businesses employing all the worst tactics. (Trump's legal playbook, basically).

If it matters, the litigation is in federal court and involves entities and shell companies spanning six mostly-southern states (so basically, legal hell).

The multiple law firms my opponents have enlisted seem to have little concern for even maintaining the appearance of good faith, which I've learned is par for the course with attorneys who take on these types of clients. (Side eye at you, Alina Habba). However I've seen something both in my case and in others that have attempted litigation with my opponents: the law firms split up/shut down or just the lawyer(s) involved in the litigation split off and form their own solo firm.

I wouldn't question it if this just happened with one attorney/firm; it's been a total of four now. A new firm enters the mix and starts repeating the lies of their client, obstructing and creating delays. If/when they get called out or sanctioned (three times so far), then boom - they announce they have formed their own firm (and continue representing my opponent). Confusingly, it seems like at least one attorney is still attached/advertised as part of their previous firm as well as their new independent practice - I don't really understand how that works.

Does this happen a lot in the legal world? Is there a common reason that attorneys who have been in practice with 1-4 other partners for a decade or more suddenly go off on their own in the middle of litigation? Is it a way to protect and/or limit the liability of the original firm from a malpractice suit or worse?

Hope my question makes sense; again, IANAL, just trying to make sense of what I'm experiencing trying to get justice against some super shady folks. Thanks for any insight you might have!",AskLawyers
[Ky] Making Near Identical Products?,"There is an industrial aerosol spray product that is expensive, and I am wondering what would stop me from producing something that is very similar. 

I have the sds, know the contents, and I'm aware that things like patents exist, but how could one make a similar product without infringing on a patent? Could the percentage of some of the ingredients in the aerosol be more or less? Ideally it'd be easiest to just sort of copy and paste, but perhaps another ingredient could be substituted.

I'm partly wondering as if I could get said product made without infringing on a patent or similar, there could be lots of money involved. ",AskLawyers
"[MO] If I call in sick, my employer doesn’t pay me and takes away my PTO. Is this legal?","I am a nurse at a non-unionized hospital in Missouri. 

I am paid hourly, full time is 36 hours/week split into three 12 hour shifts. I accrue a set about a of PTO (Paid Time Off) each week. 

If I am unable to go to work and need to call in sick on weekends or holidays
•I do not get paid AND 
•I get 12 hours of PTO SUBTRACTED from my accrued PTO balance 

Is this legal? 

If I call in on non holidays/weekdays they use my PTO to pay me.",AskLawyers
[CA] family law question,"Hi,

I have a question about family law.

I just got a restraining order against the father of our 8 month old boy. I have sole legal and custodial rights of our son. The restrained dad has court supervised visits. 

May I ask what happens when the restraining order ends? Do I still have the physical and legal custody or can my ex come back and fight to have custodial rights? 

I don’t know anyone who’s been in this situation, where they have a restraining order against the father of the child. 

I’m a little confused with how this works.

Advice is appreciated. 

",AskLawyers
[CA] harassment ,"Harassment 

Hi I hope someone could help me. So I’m being harassed by neighbors and I’m the only person who knows it. I live in a studio beneath my mom’s apartment that has a separate entrance in the back so I have my own privacy. We also have neighbors that live in the front house. Then we have neighbors to the right and left of us. The neighbors to the right of us are very nosy and are always standing by my window that’s next to their garage in the back. They’ve hid behind trees and watched my younger niece, they’ve stared at us walking into our home and they can be very loud sometimes. So one day they wouldn’t stop standing by my window and being nosy so I called the cops and the cops spoke to them. Well ever since that day which was about 3 months ago they have been harassing me.

1) they started out by standing by my window and making these weird noises to annoy me. I ended up having to sound proof my windows shut. Then I got cameras and I could never catch them in the act. 

2) once they know I sound proofed my windows they started hanging out in the back of their garage and calling me a faggot. Mind you they are always hiding. 

3) now this is going to sound insane but they’ve somehow managed to get into the walls of my house and in the crawl space. 

I have no evidence of this happening but I know it is because it’s retaliation. My mom, sister, niece don’t believe me but it’s real. 

What can I do about this situation? I’m planning on moving out because it’s just so horrible knowing someone is watching you non stop. ",AskLawyers
[TX] Texas/Wisconsin legality of ornamental possession of peyote cactus?,"I recently got into gardening 4-6 months ago, and currently own 14 plants. I am considering adding a peyote cactus to my collection. However this cactus causes psychedelic effects if eaten. I don't plan on eating or distributing specimen. It is listed as endangered due to overharvesting in the state of Texas.

Is it legal to possess as a purely ornamental plant in both Texas and Wisconsin? If not, is a license needed? I plan on moving to Wisconsin before next year, and want to know if it would be legal to own the plant in both states.",AskLawyers
[TX] What does “2 periods of possession mean”? In regards to visitation,"I recently had temporary orders from the AOG. The father has a step up plan. It says “… on the first, third, and fifth Saturdays of each month for 2 periods of possession.” 
Is that saying he has to do the visits for 2 visits each or for 2 months in order to move to the next step? 
Thank you!",AskLawyers
[non-US] Falsely reported by Reddit,"

My brother got falsely reported for csam on a post of ai edited image of to actress(not a minor). Will we get police at our house? What should we do?",AskLawyers
[IL] Do I have a legal leg to stand on if my 3 year old son was misdiagnosed with an earache then a few days later he was diagnosed with leukemia?  He passed away a couple months later after his cancer returned. ,,AskLawyers
[NC] is it possible to get an expungement on a DUI charge on federal land (military post)?,"I received a DUI charge and reckless &amp; careless charge at the entrance to a military post several years ago and it was handled under the jurisdiction of the US Eastern District Court of NC (although the charges were listed as violations of the NCGS, the prosecutor was from the OSJA)

The DUI was dismissed but I plead guilty to the C&amp;R. Is it possible to have any/all of those charges expunged? Or are the permanent since it was handled by a federal court?

",AskLawyers
[PA] Organ Donor Rules ,"To The Point: Can a person who is an organ donor write in their will or something, that if their organs were harvested and used on a living being, that the proceeds of the organ being used go to the deceased's family instead of the hospital? 

Or are donors organs free for the donee and the hospital doesn't get money from it? 

I guess my question here is more from a legal entitlement standpoint. ",AskLawyers
[PA] What does public inspection mean?,"According to the Clery Act college campus police must ""make the crime log for the most recent 60-day period open to public inspection during normal business hours"" and ""the institution must make any portion of the log older than 60 days available within two business days of a request for public inspection"" (34 CFR 668.46(f)(5)). The crime log is just a log of crimes on campus. I was just wondering how public is public inspection? Is it just that anyone can see it? I'm asking because my local police station allows notes, but you can't take pictures or make copies and that doesn't seem especially public to me, but I'm not a lawyer. ",AskLawyers
[AZ] criminal case help,"AZ help with criminal case
Posting for a friend who is looking for a pro bono lawyer he has a case against az and would like some insight, he has everything has had lawyers in the past look at it but they are to afraid to go against the country we are in even though it will win Thank you for any advice",AskLawyers
[IL] What can I do/carry to protect my dog from off leash dogs?,"I’ve had multiple off-leash dogs run up to both my current and previous dog. My previous dog had actually been attacked. I live in a decent area but no LEO care about a call about an off-leash dog (I’ve called before and they never seem to show). 

I just want to know what’s legal for me to carry/use against an off-leash dog if necessary. Or at least how I can look up the statues. Pepper spray, noise maker, air spray… anything. 

Please point me in the right direction. Thank you!",AskLawyers
[FL] Questions regarding expunging record(s),"Hello everyone I hope you're all having an awesome day. I live in Pinellas County, Florida and my question(s) are pertinent to this area. I was arrested in April 2016 and charged with 2 Felonies which happened around a year previously in June 2015. After completing an 18 month Diversion program (PTI - Pre Trial Intervention) my charges became eligible to be expunged. During the time I committed this crime and I completed PTI. I had turned my life around. I haven't really thought much about it as I was and still am working at the same place since 2014. Even to this day I have stayed sober, out of trouble and always tried to be a productive member of society. Anyways, I have began applying for Masters Degree programs in cybersecurity and second jobs. Unfortunately, I have been turned down by 2 companies which I wanted to work at due to this record.  Furthermore, a majority of the colleges I am looking into applying for are asking about my criminal background even without convictions. Now I have no problem with disclosing what I have done when I was actively a junkie and the results of that however, I would prefer to get that expunged and close that chapter in my life so to speak.  The question I have is would it be mandatory for me to hire an attorney for this process? Also, if not than how much should it cost? Thank you everyone for your time!
",AskLawyers
[IL] Is being a lawyer as cool as Suits makes it look?,"REAL lawyers only. Please only answer if you have passed the bar and are currently a practicing lawyer at a law firm. Also, ignore the ""IL"" in the title. It's just there because of the rule. 

I'm watching Suits, and one thing is very consistent: they make it look EXTREMELY bad ass to be a lawyer. Obviously they're corporate lawyers, and deal with 8+ figure cases, but I doubt I'm gonna get many Harvey Specters on Reddit. 

So anyone who is a real lawyer, is it cool? Bonus points if you work in a major metropolitan area. ",AskLawyers
[TX] Will disputing a debt reset statute of limitations?,"I just got a letter of verification on 14.5k debt and only have until 4.11.24 to dispute it!

Will disputing a debt reset the clock? Ie once they prove it's mine? Will a debt collector tell you where the clock is on the statute of limitations? (I doubt it)

Does anyone know how I could get that answer?

 Because I've answered the phone a few times and tried to settle the debt; they came back with an offer for 10k rather than 14.5k but I didn't have that amount. Was trying to settle for 6k to put on a credit card.

I wonder if trying to settle it was the same as admitting I owe it and therefore I reset the clock...

Is there a point to disputing the debt at all? I do owe it. I feel like they'd have evidence

It's a university tuition/boarding debt. Not a private or federal student loan. Colorado (live in TX now)

Any advise or input is super appreciated, even if y'all don't know anything but one or two snipets of advise. TYIA!",AskLawyers
"[Non-US] What is the solution to this legal ""paradox"" ?"," I just came up with a situation in my head and I'd like to know what's the solution.

Let's assume you invite a friend (let's call him Mike) to your house for dinner, he comes with his car and pulls up in your drive-way. The dinner goes on and Mike have a few drinks and ends up offending you (for example, he insults your wife or something like that), thus you order him to leave your property.

The thing is, it's very cold outside and it would be unhealthy and dangerous for Mike to stay out for too long, and as he's drunk he can't drive back home. And because you told him to leave the property, he has too stay out of the drive-way, so he can't just stay in the car. Considering the weather, you suggest him to drive his car out of the drive-way so that he can wait in it while he sobers up outside of your property, but Mike refuses to let you use his car.

What's the solution to this situation, considering you and Mike are very stubborn ? Is the only solution to find middle ground or is there something else involved, like a law, that could decide for them ?",AskLawyers
[PA] Surgery Quote?,"Hello so I’m having surgery May 15th (today is April 6th) I was originally quoted 7,950 for my out of pocket cost, but yesterday I got a call saying they gave me the wrong quote and it’s actually 16,165 that’s due on May 5th
This surgery been booked since May of 2023  is there anyway I can hold them to the original quoted price? ",AskLawyers
[TN] Do I have any recourse to have mine and my children’s names removed from these cases? ,"I am the stepmom now but during litigation between my spouse and his now ex wife, I was listed many times as my full name and paramour in their divorce documents. 

My children were also named in these documents. 

Do I have any recourse to have mine and my children’s names removed from these cases? The “allegations” bitter ex made against my character are offensive and of course, false/invalid. 

I am not listed in the original complaint for divorce, I am not a party, corespondent or anything else formal. In fact, I have never even met the crazy ex wife and I do not reside in TN I reside with my spouse and children in CO. 

I was never notified I had been named in these petitions/motions etc. so I did not have an opportunity to defend these allegations against my character. 

What can I do? ",AskLawyers
